ship,area,date,trip_no,is_cancellation,tsuri_mono_raw,tsuri_mono,main_sub,fish_raw,time_slot,cnt_min,cnt_max,cnt_avg,is_boat,size_min,size_max,kg_min,kg_max,tackle,point_place1,point_place2,point_place3,n_points_visited,depth_min,depth_max,water_temp_min,water_temp_max,water_color,wind_direction,wind_speed,tide_info,wave_info,weather,by_catch,cancel_reason,cancel_type,kanso_raw,suion_raw,suishoku_raw
平安丸,小田原早川港,2023/09/12,3,0,キハダマグロ,キハダマグロ,メイン,キハダマグロ,,,,,0,,,,,,小田原沖,,,1,,,,,,,,,,,,,,コマセキハダマグロ船。。,,
平安丸,小田原早川港,2023/09/13,1,0,イナダ,イナダ,メイン,イナダ,,8,27,17,0,28,45,,,,小田原沖,,,1,,,,,,,,,,,"メジナ,アジ,カマス",,,イナダ五目。他にメジナ・アジ・カマス・ソウダガツオ交じる。,,
平安丸,小田原早川港,2023/09/13,1,0,イナダ,イナダ,メイン,カンパチ,,0,5,2,0,,,,,,小田原沖,,,1,,,,,,,,,,,"メジナ,アジ,カマス",,,イナダ五目。他にメジナ・アジ・カマス・ソウダガツオ交じる。,,
平安丸,小田原早川港,2023/09/13,2,0,キハダマグロ,キハダマグロ,メイン,キハダマグロ,,,,,0,,,,,,小田原沖,,,1,,,,,,,,,,,,,,コマセキハダマグロ船。。,,
平安丸,小田原早川港,2023/09/15,1,0,ヤリイカ,ヤリイカ,メイン,ヤリイカ,,6,13,9,0,20,32,,,,東沖,,,1,,,,,,,,,,,スルメイカ交じる,,,他にスルメイカ交じる。。,,
平安丸,小田原早川港,2023/09/15,2,0,イナダ,イナダ,メイン,イナダ,,1,4,2,0,30,35,,,,小田原沖,,,1,,,,,,,,,,,"アジ,小イサキ,ソウダガツオ交じる",,,イナダ五目。他にアジ・小イサキ・ソウダガツオ交じる。,,
平安丸,小田原早川港,2023/09/15,2,0,イナダ,イナダ,メイン,カンパチ,,0,3,1,0,,,,,,小田原沖,,,1,,,,,,,,,,,"アジ,小イサキ,ソウダガツオ交じる",,,イナダ五目。他にアジ・小イサキ・ソウダガツオ交じる。,,
平安丸,小田原早川港,2023/09/15,3,0,キハダマグロ,キハダマグロ,メイン,キハダマグロ,,,,,0,,,,,,小田原沖,,,1,,,,,,,,,,,,,,コマセ。本ガツオハリス切れバラシあり。,,
平安丸,小田原早川港,2023/09/16,1,0,イナダ,イナダ,サブ,アジ,,0,20,10,0,18,35,,,,小田原沖,,,1,,,,,,,,,,,"イナダ,カンパチ,サバ",,,イナダ五目。他にイナダ・カンパチ・サバ・モクアジ交じる。,,
平安丸,小田原早川港,2023/09/16,2,0,キハダマグロ,キハダマグロ,メイン,キハダマグロ,,,,,0,,,,,,小田原沖,,,1,,,,,,,,,,,,,,コマセキハダマグロ船。。,,
平安丸,小田原早川港,2023/09/16,3,0,キハダマグロ,キハダマグロ,メイン,キハダマグロ,,,,,0,,,,,,湾内,,,1,,,,,,,,,,,,,,ルアーキハダマグロ船。。,,
平安丸,小田原早川港,2023/09/17,1,0,ビシアジ,ビシアジ,メイン,ビシアジ,,6,33,19,0,25,35,,,,二宮沖,,,1,,,,,,,,,,,サバ交じる,,,他にサバ交じる。。,,
平安丸,小田原早川港,2023/09/17,2,0,イナダ,イナダ,サブ,アジ,,5,15,10,0,18,25,,,,小田原沖,,,1,,,,,,,,,,,"アマダイ,サバ,カンコ",,,イナダ五目・仕立の釣果。他にアマダイ・サバ・カンコ・イサキ交じる。,,
平安丸,小田原早川港,2023/09/17,3,0,キハダマグロ,キハダマグロ,メイン,キハダマグロ,,,,,0,,,,,,小田原沖,,,1,,,,,,,,,,,,,,コマセキハダマグロ船。。,,
平安丸,小田原早川港,2023/09/18,1,0,キハダマグロ,キハダマグロ,メイン,キハダマグロ,,0,1,0,1,,,9.1,9.1,,小田原沖,,,1,,,,,,,,,,,,,,コマセ。1ヒット、1キャッチ。,,
平安丸,小田原早川港,2023/09/18,2,0,イナダ,イナダ,メイン,イナダ,,0,2,1,0,30,55,,,,小田原沖,,,1,,,,,,,,,,,"アジ,サバ,ハタ",,,イナダ五目。他にアジ・サバ・ハタ・ソウダガツオ交じる。,,
平安丸,小田原早川港,2023/09/18,3,0,ヤリイカ,ヤリイカ,メイン,ヤリイカ,,1,4,2,0,20,32,,,,真鶴沖,,,1,,,,,,,,,,,スルメイカ交じる,,,他にスルメイカ交じる。。,,
平安丸,小田原早川港,2023/09/19,1,0,イナダ,イナダ,メイン,イナダ,,0,5,2,0,30,60,,,,小田原沖,,,1,,,,,,,,,,,"アジ,ソウダガツオ,イサキ交じる",,,イナダ五目。他にアジ・ソウダガツオ・イサキ交じる。,,
平安丸,小田原早川港,2023/09/19,2,0,キハダマグロ,キハダマグロ,メイン,キハダマグロ,,,,,0,,,,,,小田原沖,,,1,,,,,,,,,,,,,,コマセキハダマグロ船。。,,
平安丸,小田原早川港,2023/09/20,1,0,ヤリイカ,ヤリイカ,メイン,ヤリイカ,,1,2,1,0,20,32,,,,真鶴沖,,,1,,,,,,,,,,,,,,,,
平安丸,小田原早川港,2023/09/20,2,0,キハダマグロ,キハダマグロ,メイン,キハダマグロ,,,,,0,,,,,,小田原沖,,,1,,,,,,,,,,,,,,コマセキハダマグロ船。。,,
平安丸,小田原早川港,2023/09/22,1,0,アジ,アジ,メイン,アジ,,12,34,23,0,20,27,,,,小田原沖,,,1,,,,,,,,,,,,,,,,
平安丸,小田原早川港,2023/09/22,2,0,イナダ,イナダ,メイン,イナダ,,1,3,2,0,30,40,,,,小田原沖,,,1,,,,,,,,,,,"イシダイ,クロダイ,イサキ",,,イナダ五目。他にイシダイ・クロダイ・イサキ・ソウダガツオも。,,
平安丸,小田原早川港,2023/09/22,2,0,イナダ,イナダ,サブ,アジ,,7,18,12,0,20,35,,,,小田原沖,,,1,,,,,,,,,,,"イシダイ,クロダイ,イサキ",,,イナダ五目。他にイシダイ・クロダイ・イサキ・ソウダガツオも。,,
平安丸,小田原早川港,2023/09/22,3,0,キハダマグロ,キハダマグロ,メイン,キハダ,,,,,0,,,,,,小田原沖,,,1,,,,,,,,,,,,,,,,
平安丸,小田原早川港,2023/09/23,1,0,ヤリイカ,ヤリイカ,メイン,ヤリイカ,,7,15,11,0,20,32,,,,東沖,,,1,,,,,,,,,,,,,,,,
平安丸,小田原早川港,2023/09/23,2,0,イナダ,イナダ,メイン,イナダ,,0,1,0,0,30,40,,,,小田原沖,,,1,,,,,,,,,,,"マダイ,アマダイ,ホウボウ",,,イナダ五目。他にマダイ・アマダイ・ホウボウ・アジ・サバ交じる。,,
平安丸,小田原早川港,2023/09/23,3,0,キハダマグロ,キハダマグロ,メイン,キハダマグロ,,,,,0,,,,,,小田原沖,,,1,,,,,,,,,,,,,,コマセキハダマグロ船。。,,
平安丸,小田原早川港,2023/09/24,1,0,イナダ,イナダ,メイン,イナダ,,0,13,6,0,30,40,,,,小田原沖,,,1,,,,,,,,,,,"アジ,クロダイ,ヒラメ",,,イナダ五目。他にアジ・クロダイ・ヒラメ・ハタ交じる。,,
平安丸,小田原早川港,2023/09/24,2,0,ヤリイカ,ヤリイカ,メイン,ヤリイカ,,6,7,6,0,20,32,,,,東沖,,,1,,,,,,,,,,,,,,,,
平安丸,小田原早川港,2023/09/24,3,0,キハダマグロ,キハダマグロ,メイン,キハダマグロ,,,,,0,,,,,,小田原沖,,,1,,,,,,,,,,,,,,コマセキハダマグロ船。。,,
平安丸,小田原早川港,2023/09/25,1,0,ヤリイカ,ヤリイカ,メイン,ヤリイカ,,4,10,7,0,20,32,,,,真鶴沖,,,1,,,,,,,,,,,,,,,,
平安丸,小田原早川港,2023/09/25,2,0,イナダ,イナダ,メイン,イナダ,,0,7,3,0,30,40,,,,小田原沖,,,1,,,,,,,,,,,カンパチ交じる,,,イナダ五目。他にカンパチ交じる。,,
平安丸,小田原早川港,2023/09/25,3,0,キハダマグロ,キハダマグロ,メイン,キハダマグロ,,,,,0,,,,,,小田原沖,,,1,,,,,,,,,,,,,,コマセキハダマグロ船。。,,
平安丸,小田原早川港,2023/09/26,1,0,キハダマグロ,キハダマグロ,メイン,キハダマグロ,,0,1,0,1,,,66.6,66.6,,小田原沖,,,1,,,,,,,,,,,,,,コマセキハダマグロ船。1ヒット、1キャッチ。,,
平安丸,小田原早川港,2023/09/26,2,0,イナダ,イナダ,メイン,イナダ,,0,3,1,0,30,40,,,,小田原沖,,,1,,,,,,,,,,,,,,イナダ五目。。,,
平安丸,小田原早川港,2023/09/26,2,0,イナダ,イナダ,サブ,クロダイ,,0,2,1,0,,,,,,小田原沖,,,1,,,,,,,,,,,,,,イナダ五目。。,,
平安丸,小田原早川港,2023/09/26,3,0,アジ,アジ,メイン,アジ,,2,25,13,0,22,35,,,,小田原沖,,,1,,,,,,,,,,,"サバ,ムクアジ,アマダイ",,,アジ五目・仕立の釣果。他にサバ・ムクアジ・アマダイ。,,
平安丸,小田原早川港,2023/09/27,1,0,アジ,アジ,メイン,アジ,,20,32,26,0,25,35,,,,二宮沖,,,1,,,,,,,,,,,サバ交じる,,,他にサバ交じる。。,,
平安丸,小田原早川港,2023/09/27,2,0,ヤリイカ,ヤリイカ,メイン,ヤリイカ,,4,13,8,0,20,32,,,,真鶴沖,,,1,,,,,,,,,,,,,,,,
平安丸,小田原早川港,2023/09/27,3,0,キハダマグロ,キハダマグロ,メイン,キハダマグロ,,,,,0,,,,,,小田原沖,,,1,,,,,,,,,,,,,,コマセキハダマグロ船。。,,
平安丸,小田原早川港,2023/09/29,1,0,ヤリイカ,ヤリイカ,メイン,ヤリイカ,,6,17,11,0,20,32,,,,東沖,,,1,,,,,,,,,,,スルメイカ交じる,,,他にスルメイカ交じる。。,,
平安丸,小田原早川港,2023/09/29,2,0,イナダ,イナダ,サブ,アジ,,31,31,31,0,18,35,,,,小田原沖,,,1,,,,,,,,,,,,,,イナダ五目。。,,
平安丸,小田原早川港,2023/09/29,3,0,キハダマグロ,キハダマグロ,メイン,キハダマグロ,,,,,0,,,,,,小田原沖,,,1,,,,,,,,,,,,,,コマセキハダマグロ船。。,,
平安丸,小田原早川港,2023/09/30,1,0,イナダ,イナダ,メイン,イナダ,,0,3,1,0,30,40,,,,小田原沖,,,1,,,,,,,,,,,"マダイ,クロダイ,カンパチ",,,イナダ五目。他にマダイ・クロダイ・カンパチ・アマダイ交じる。,,
平安丸,小田原早川港,2023/09/30,1,0,イナダ,イナダ,サブ,アジ,,5,16,10,0,,,,,,小田原沖,,,1,,,,,,,,,,,"マダイ,クロダイ,カンパチ",,,イナダ五目。他にマダイ・クロダイ・カンパチ・アマダイ交じる。,,
平安丸,小田原早川港,2023/09/30,2,0,イナダ,イナダ,メイン,イナダ,,0,2,1,0,30,40,,,,小田原沖,,,1,,,,,,,,,,,"モクアジ,イトヨリ,ソウダガツオ交じる",,,イナダ五目・仕立の釣果。他にモクアジ・イトヨリ・ソウダガツオ交じる。,,
平安丸,小田原早川港,2023/09/30,2,0,イナダ,イナダ,サブ,アジ,,3,15,9,0,,,,,,小田原沖,,,1,,,,,,,,,,,"モクアジ,イトヨリ,ソウダガツオ交じる",,,イナダ五目・仕立の釣果。他にモクアジ・イトヨリ・ソウダガツオ交じる。,,
平安丸,小田原早川港,2023/09/30,3,0,キハダマグロ,キハダマグロ,メイン,キハダマグロ,,,,,0,,,,,,小田原沖,,,1,,,,,,,,,,,,,,コマセキハダマグロ船。。,,
幸丸,飯岡港,2023/09/05,1,0,マダイ,マダイ,メイン,マダイ,,0,4,2,0,,,0.3,4.9,,,,,1,30.0,40.0,,,,,,,ウネリ,,"イシダイ,ウマヅラハギ,カサゴ",,,午前船の釣果。他にイシダイ・ウマヅラハギ・カサゴ・カンパチ・ガンゾウビラメ・ハナダイ・ヒラメ・マハタ。,,
幸丸,飯岡港,2023/09/05,2,0,マダイ,マダイ,メイン,マダイ,,0,4,2,0,,,0.4,4.0,,,,,1,25.0,45.0,,,,,,,,,"イナダ,カサゴ,シイラ",,,午前船の釣果。他にイナダ・カサゴ・シイラ・ハナダイ。,,
幸丸,飯岡港,2023/09/05,3,0,マダイ,マダイ,メイン,マダイ,,0,4,2,0,,,0.3,1.6,,,,,1,30.0,30.0,,,,,,,,,"イシダイ,カサゴ,ガンゾウビラメ",,,午前船の釣果。他にイシダイ・カサゴ・ガンゾウビラメ・シイラ・ハナダイ・ヒラメ。,,
幸丸,飯岡港,2023/09/05,4,0,ヒラメ,ヒラメ,メイン,ヒラメ,,2,8,5,0,,,0.5,3.6,,,,,1,15.0,15.0,1.0,1.0,,,,,,,,,,午前船の釣果。浅場を転々としました。,,
幸丸,飯岡港,2023/09/05,5,0,カツオ,カツオ,メイン,カツオ,,0,6,3,0,,,1.5,2.5,,,,,1,,,,,,,,,,,シイラ,,,午前船の釣果。他にシイラ。,,
幸丸,飯岡港,2023/09/06,1,0,マダイ,マダイ,メイン,マダイ,,0,6,3,0,,,0.3,7.4,,,,,1,25.0,25.0,,,,,,,,,"カサゴ,カンダイ,ガンゾウビラメ",,,午前船の釣果。他にカサゴ・カンダイ・ガンゾウビラメ・キビレ・ハナダイ。,,
幸丸,飯岡港,2023/09/06,2,0,マダイ,マダイ,メイン,マダイ,,0,6,3,0,,,0.4,5.3,,,,,1,25.0,25.0,,,,,,,,,"ガンゾウビラメ,ヒラメ,ウマヅラハギ",,,午前船の釣果。他にガンゾウビラメ・ヒラメ・ウマヅラハギ・キビレ・ショウゴ・トラフグ・ハナダイ。,,
幸丸,飯岡港,2023/09/06,3,0,マダイ,マダイ,メイン,マダイ,,0,10,5,0,,,0.3,3.5,,,,,1,30.0,30.0,,,,,,,,,"ウマヅラハギ,カサゴ,ガンゾウビラメ",,,午前船の釣果。他にウマヅラハギ・カサゴ・ガンゾウビラメ・シイラ・タカノハダイ・トラフグ・ハナダイ。,,
幸丸,飯岡港,2023/09/06,4,0,マダイ,マダイ,メイン,マダイ,,0,6,3,0,,,0.3,5.7,,,,,1,30.0,30.0,,,,,,,,,"ウマヅラハギ,カサゴ,キビレ",,,午前船の釣果。他にウマヅラハギ・カサゴ・キビレ・ハナダイ。,,
幸丸,飯岡港,2023/09/06,5,0,ヒラメ,ヒラメ,メイン,ヒラメ,,1,6,3,0,,,0.4,6.3,,,,,1,30.0,30.0,,,,,,,,,スズキ,,,午前船の釣果。他にスズキ。,,
幸丸,飯岡港,2023/09/10,1,0,マダイ,マダイ,メイン,マダイ,,0,3,1,0,,,0.4,6.5,,,,,1,25.0,25.0,,,,,,,,,"イシダイ,ウマヅラハギ,カサゴ",,,午前船の釣果。他にイシダイ・ウマヅラハギ・カサゴ・キビレ・ソウダガツオ・ハタ・ハナダイ・タカノハダイ・ワラサ。,,
幸丸,飯岡港,2023/09/10,2,0,マダイ,マダイ,メイン,マダイ,,0,4,2,0,,,0.3,5.9,,,,,1,30.0,30.0,,,,,,,,,"イナダ,カサゴ,カンパチ",,,午前船の釣果。他にイナダ・カサゴ・カンパチ・ガンゾウビラメ・キビレ・シイラ・トラフグ・ワラサ。,,
幸丸,飯岡港,2023/09/10,3,0,マダイ,マダイ,メイン,マダイ,,0,7,3,0,,,0.3,1.8,,,,,1,25.0,25.0,,,,,,,,,"イナダ,ウマヅラハギ,カサゴ",,,午前船の釣果。他にイナダ・ウマヅラハギ・カサゴ・ガンゾウビラメ・シイラ・ハナダイ・ヒラメ・フグ。,,
幸丸,飯岡港,2023/09/10,4,0,マダイ,マダイ,メイン,マダイ,,0,6,3,0,,,0.3,1.2,,,,,1,30.0,30.0,,,,,,,,,"ウマヅラハギ,カサゴ,ガンゾウビラメ",,,仕立・午前船の釣果。他にウマヅラハギ・カサゴ・ガンゾウビラメ・シイラ・ハナダイ・ヒラメ・フグ。,,
幸丸,飯岡港,2023/09/10,5,0,ヒラメ,ヒラメ,メイン,ヒラメ,,2,10,6,0,,,0.4,4.3,,,,,1,10.0,50.0,,,,,,,,,,,,午前船の釣果。今日は転々と走り回りました。,,
幸丸,飯岡港,2023/09/10,6,0,カツオ,カツオ,メイン,カツオ,,1,7,4,0,,,1.5,4.0,,,,,1,,,,,,,,,,,,,,午前船の釣果。今日もカツオはオデコなし!!カツオのサイズも上がり(MAX4kg)、キメジ交じりでした!そのためか?ラインブレイク等バラシが非常に多かったですね。,,
幸丸,飯岡港,2023/09/10,6,0,カツオ,カツオ,メイン,キメジ,,0,1,0,0,,,2.0,5.0,,,,,1,,,,,,,,,,,,,,午前船の釣果。今日もカツオはオデコなし!!カツオのサイズも上がり(MAX4kg)、キメジ交じりでした!そのためか?ラインブレイク等バラシが非常に多かったですね。,,
幸丸,飯岡港,2023/09/11,1,0,マダイ,マダイ,メイン,マダイ,,0,3,1,0,,,0.5,5.8,,,,,1,25.0,25.0,,,,,,,,,"ウマヅラハギ,カサゴ,ガンゾウビラメ",,,午前船の釣果。他にウマヅラハギ・カサゴ・ガンゾウビラメ・キビレ・ハナダイ・フグ。,,
幸丸,飯岡港,2023/09/11,2,0,マダイ,マダイ,メイン,マダイ,,1,7,4,0,,,0.3,5.9,,,,,1,25.0,25.0,1.0,1.0,,,,,,,"イシダイ,ウマヅラハギ,カサゴ",,,午前船の釣果。他にイシダイ・ウマヅラハギ・カサゴ・カワハギ・ガンゾウビラメ・キビレ・トラフグ・ハナダイ・マハタ。,,
幸丸,飯岡港,2023/09/11,3,0,マダイ,マダイ,メイン,マダイ,,0,14,7,0,,,0.3,1.2,,,,,1,30.0,30.0,,,,,,,,,"ウマヅラハギ,カサゴ,ガンゾウビラメ",,,午前船の釣果。他にウマヅラハギ・カサゴ・ガンゾウビラメ・キビレ・ハナダイ。,,
幸丸,飯岡港,2023/09/11,4,0,ヒラメ,ヒラメ,メイン,ヒラメ,,2,8,5,0,,,0.4,2.8,,,,,1,10.0,10.0,,,,,,,,,,,,午前船の釣果。今日は朝からアタリ多く、齧られも沢山ありました。,,
幸丸,飯岡港,2023/09/13,1,0,マダイ,マダイ,メイン,マダイ,,0,3,1,0,,,0.3,5.3,,,,,1,30.0,30.0,,,,,,,,,"ウマヅラハギ,カサゴ,ガンゾウビラメ",,,午前船の釣果。他にウマヅラハギ・カサゴ・ガンゾウビラメ・シイラ・トラフグ・ハナダイ。,,
幸丸,飯岡港,2023/09/13,2,0,マダイ,マダイ,メイン,マダイ,,0,3,1,0,,,0.5,4.9,,,,,1,30.0,30.0,,,,,,,,,"ヒラメ,ハナダイ,ガンゾウビラメ",,,午前船の釣果。他にヒラメ・ハナダイ・ガンゾウビラメ・ハタ。,,
幸丸,飯岡港,2023/09/13,3,0,マダイ,マダイ,メイン,マダイ,,0,3,1,0,,,0.3,3.8,,,,,1,25.0,25.0,,,,,,,,,"ウマヅラハギ,カサゴ,ガンゾウビラメ",,,午前船の釣果。他にウマヅラハギ・カサゴ・ガンゾウビラメ・ハタ・ハナダイ・ヒラメ。,,
幸丸,飯岡港,2023/09/13,4,0,マダイ,マダイ,メイン,マダイ,,0,6,3,0,,,0.3,2.4,,,,,1,30.0,30.0,,,,,,,,,"ウマヅラハギ,カサゴ,ガンゾウビラメ",,,午前船の釣果。他にウマヅラハギ・カサゴ・ガンゾウビラメ・ハナダイ・ヒラメ。,,
幸丸,飯岡港,2023/09/13,5,0,ヒラメ,ヒラメ,メイン,ヒラメ,,1,11,6,0,,,0.4,2.4,,,,,1,10.0,10.0,,,,,,,,,,,,午前船の釣果。今日はどこでもアタリ多く、着底と同時にバンバン、バババン!丁寧なやり取りをする方はバラシ少なく、数が伸びました!8匹超え4人!。,,
幸丸,飯岡港,2023/09/13,6,0,カツオ,カツオ,メイン,カツオ,,0,5,2,0,,,1.5,4.0,,,,,1,,,,,,,,,,,,,,午前船の釣果。今日は動きが速く、食いもイマイチ悪く苦戦しました。,,
幸丸,飯岡港,2023/09/13,6,0,カツオ,カツオ,メイン,キメジ,,0,2,1,0,,,2.0,5.0,,,,,1,,,,,,,,,,,,,,午前船の釣果。今日は動きが速く、食いもイマイチ悪く苦戦しました。,,
幸丸,飯岡港,2023/09/14,1,0,マダイ,マダイ,メイン,マダイ,,0,11,5,0,,,0.3,3.5,,,,,1,30.0,30.0,,,,,,,,,"イナダ,ウマヅラハギ,カサゴ",,,午前船の釣果。他にイナダ・ウマヅラハギ・カサゴ・ガンゾウビラメ・キビレ・ハナダイ・ヒラメ・フグ。,,
幸丸,飯岡港,2023/09/14,2,0,マダイ,マダイ,メイン,マダイ,,0,7,3,0,,,0.5,1.2,,,,,1,30.0,30.0,,,,,,,,,"イナダ,ウマヅラハギ,カサゴ",,,午前船の釣果。他にイナダ・ウマヅラハギ・カサゴ・ガンゾウビラメ・ハナダイ・ヒラメ。,,
幸丸,飯岡港,2023/09/14,3,0,マダイ,マダイ,メイン,マダイ,,0,4,2,0,,,0.3,1.0,,,,,1,25.0,25.0,,,,,,,,,"ウマヅラハギ,カサゴ,ガンゾウビラメ",,,午前船の釣果。他にウマヅラハギ・カサゴ・ガンゾウビラメ・シイラ・ハナダイ。,,
幸丸,飯岡港,2023/09/14,4,0,ヒラメ,ヒラメ,メイン,ヒラメ,,0,10,5,0,,,0.6,2.1,,,,,1,30.0,30.0,,,,,,,,,"マハタ,ワラサ",,,午前船の釣果。他にマハタ・ワラサ。,,
幸丸,飯岡港,2023/09/14,5,0,カツオ,カツオ,メイン,カツオ,,0,4,2,0,,,1.5,4.0,,,,,1,,,,,,,,,,,,,,午前船の釣果。鳥山もハネも結構ありましたが、掛かりが悪くイマイチでした。,,
幸丸,飯岡港,2023/09/14,5,0,カツオ,カツオ,メイン,キメジ,,0,2,1,0,,,2.0,4.5,,,,,1,,,,,,,,,,,,,,午前船の釣果。鳥山もハネも結構ありましたが、掛かりが悪くイマイチでした。,,
幸丸,飯岡港,2023/09/15,1,0,マダイ,マダイ,メイン,マダイ,,0,10,5,0,,,0.3,6.2,,,,,1,30.0,30.0,,,,,,,,,"ウマヅラハギ,カサゴ,ガンゾウビラメ",,,午前船の釣果。他にウマヅラハギ・カサゴ・ガンゾウビラメ・ハナダイ・ヒラメ。,,
幸丸,飯岡港,2023/09/15,2,0,マダイ,マダイ,メイン,マダイ,,0,7,3,0,,,0.3,4.0,,,,,1,25.0,25.0,,,,,,,,,"ウマヅラハギ,カサゴ,ガンゾウビラメ",,,午前船の釣果。他にウマヅラハギ・カサゴ・ガンゾウビラメ・ハナダイ。,,
幸丸,飯岡港,2023/09/15,3,0,マダイ,マダイ,メイン,マダイ,,0,7,3,0,,,0.3,3.8,,,,,1,30.0,30.0,,,,,,,,,"イナダ,カサゴ,ガンゾウビラメ",,,午前船の釣果。他にイナダ・カサゴ・ガンゾウビラメ・ハナダイ・ヒラメ・ワラサ。,,
幸丸,飯岡港,2023/09/15,3,0,マダイ,マダイ,サブ,イシダイ,,,,,0,,,3.8,3.8,,,,,1,,,,,,,,,,,"イナダ,カサゴ,ガンゾウビラメ",,,午前船の釣果。他にイナダ・カサゴ・ガンゾウビラメ・ハナダイ・ヒラメ・ワラサ。,,
幸丸,飯岡港,2023/09/15,4,0,ヒラメ,ヒラメ,メイン,ヒラメ,,1,10,5,0,,,0.3,2.8,,,,,1,10.0,10.0,,,,,,,,,カサゴ,,,午前船の釣果。他にカサゴ。,,
幸丸,飯岡港,2023/09/15,5,0,カツオ,カツオ,メイン,カツオ,,2,16,9,0,,,1.5,4.0,,,,,1,,,,,,,,,,,,,,午前船の釣果。今日はオデコなく皆さんカツオゲット!!カツオのサイズも良くお土産バッチリでした!バラシも非常に多かったが、終始ナブラ多く掛かりも良かったですね。,,
幸丸,飯岡港,2023/09/17,1,0,マダイ,マダイ,メイン,マダイ,,0,8,4,0,,,0.4,5.9,,,,,1,25.0,25.0,,,,,,,,,"ヒラメ,カンダイ,カサゴ",,,午前船の釣果。他にヒラメ・カンダイ・カサゴ。,,
幸丸,飯岡港,2023/09/17,2,0,マダイ,マダイ,メイン,マダイ,,0,3,1,0,,,0.3,4.6,,,,,1,25.0,25.0,,,,,,,,,"カサゴ,キビレ,シイラ",,,午前船の釣果。他にカサゴ・キビレ・シイラ・ハナダイ。,,
幸丸,飯岡港,2023/09/17,3,0,マダイ,マダイ,メイン,マダイ,,0,7,3,0,,,0.3,4.3,,,,,1,30.0,30.0,,,,,,,,,"イシガキダイ,ウマヅラハギ,カサゴ",,,午前船の釣果。他にイシガキダイ・ウマヅラハギ・カサゴ・ガンゾウビラメ・キビレ・ハナダイ。,,
幸丸,飯岡港,2023/09/17,4,0,マダイ,マダイ,メイン,マダイ,,0,5,2,0,,,0.3,3.9,,,,,1,10.0,10.0,,,,,,,,,"カサゴ,ガンゾウビラメ,キビレ",,,午前船の釣果。他にカサゴ・ガンゾウビラメ・キビレ・シイラ・タカノハダイ・ハナダイ・ワラサ。,,
幸丸,飯岡港,2023/09/17,5,0,ヒラメ,ヒラメ,メイン,ヒラメ,,1,11,6,0,,,0.4,4.3,,,,,1,50.0,50.0,,,,,,,,,,,,午前船の釣果。MAX4.3kg、4.1kg、3.3kg、3.1kg、2kg台多数GET!転々とする中で、道中バタバタタイムもあり楽しめました。,,
幸丸,飯岡港,2023/09/17,6,0,カツオ,カツオ,メイン,カツオ,,0,3,1,0,,,1.0,4.0,,,,,1,,,,,,,,,,,,,,午前船の釣果。鳥山は多かったのですが、とにかく食いが悪く大苦戦でした。,,
幸丸,飯岡港,2023/09/17,6,0,カツオ,カツオ,メイン,キメジ,,0,1,0,0,,,3.0,3.0,,,,,1,,,,,,,,,,,,,,午前船の釣果。鳥山は多かったのですが、とにかく食いが悪く大苦戦でした。,,
幸丸,飯岡港,2023/09/18,1,0,マダイ,マダイ,メイン,マダイ,,0,4,2,0,,,0.3,4.7,,,,,1,30.0,30.0,,,,,,,,,"カサゴ,ガンゾウビラメ,シイラ",,,午前船の釣果。他にカサゴ・ガンゾウビラメ・シイラ・ハナダイ。,,
幸丸,飯岡港,2023/09/18,2,0,マダイ,マダイ,メイン,マダイ,,0,13,6,0,,,0.3,3.8,,,,,1,25.0,25.0,,,,,,,,,"カサゴ,ガンゾウビラメ,トラフグ",,,午前船の釣果。他にカサゴ・ガンゾウビラメ・トラフグ・ハナダイ。,,
幸丸,飯岡港,2023/09/18,3,0,マダイ,マダイ,メイン,マダイ,,0,3,1,0,,,0.3,3.3,,,,,1,25.0,25.0,,,,,,,,,"ウマヅラハギ,カサゴ,ガンゾウビラメ",,,午前船の釣果。他にウマヅラハギ・カサゴ・ガンゾウビラメ・ハナダイ・ハタ。,,
幸丸,飯岡港,2023/09/18,4,0,マダイ,マダイ,メイン,マダイ,,0,9,4,0,,,0.3,1.0,,,,,1,25.0,25.0,,,,,,,,,"ウマヅラハギ,カサゴ,ガンゾウビラメ",,,午前船の釣果。他にウマヅラハギ・カサゴ・ガンゾウビラメ・シイラ・コショウダイ・ハタ・ハナダイ。,,
幸丸,飯岡港,2023/09/18,5,0,ヒラメ,ヒラメ,メイン,ヒラメ,,1,10,5,0,,,0.4,2.3,,,,,1,10.0,10.0,,,,,,,,,"カサゴ,マゴチ",,,午前船の釣果。他にカサゴ・マゴチ。,,
幸丸,飯岡港,2023/09/18,6,0,カツオ,カツオ,メイン,カツオ,,0,4,2,0,,,1.0,4.6,,,,,1,,,,,,,,,,,,,,午前船の釣果。昨日同様に食いがイマイチでした。,,
幸丸,飯岡港,2023/09/19,1,0,マダイ,マダイ,メイン,マダイ,,0,2,1,0,,,0.3,3.2,,,,,1,30.0,30.0,4.0,4.0,,,,,,,"イシガキダイ,カサゴ,ガンゾウビラメ",,,午前船の釣果。他にイシガキダイ・カサゴ・ガンゾウビラメ・キビレ・シイラ・ハナダイ。,,
幸丸,飯岡港,2023/09/19,2,0,マダイ,マダイ,メイン,マダイ,,0,5,2,0,,,0.3,1.6,,,,,1,25.0,25.0,,,,,,,,,"カサゴ,キビレ,ハタ",,,午前船の釣果。他にカサゴ・キビレ・ハタ・ハナダイ・ワラサ。,,
幸丸,飯岡港,2023/09/19,3,0,マダイ,マダイ,メイン,マダイ,,2,15,8,0,,,0.3,0.8,,,,,1,30.0,30.0,,,,,,,,,"カサゴ,ガンゾウビラメ,ハナダイ",,,仕立・午前船の釣果。他にカサゴ・ガンゾウビラメ・ハナダイ・ホウボウ。,,
幸丸,飯岡港,2023/09/19,4,0,ヒラメ,ヒラメ,メイン,ヒラメ,,1,11,6,0,,,0.3,3.8,,,,,1,30.0,30.0,,,,,,,,,,,,午前船の釣果。今日はじっくり攻めました。,,
幸丸,飯岡港,2023/09/20,1,0,マダイ,マダイ,メイン,マダイ,,0,10,5,0,,,0.3,5.8,,,,,1,30.0,30.0,,,,,,,,,"イシダイ,ウマヅラハギ,キビレ",,,午前船の釣果。他にイシダイ・ウマヅラハギ・キビレ・カサゴ・ハナダイ・メバル。,,
幸丸,飯岡港,2023/09/20,2,0,マダイ,マダイ,メイン,マダイ,,0,6,3,0,,,0.3,5.2,,,,,1,25.0,25.0,,,,,,,,,"カサゴ,キビレ,シイラ",,,午前船の釣果。他にカサゴ・キビレ・シイラ・ハナダイ・ヒゲソリダイ。,,
