ship,area,date,trip_no,is_cancellation,tsuri_mono_raw,tsuri_mono,main_sub,fish_raw,time_slot,cnt_min,cnt_max,cnt_avg,is_boat,size_min,size_max,kg_min,kg_max,tackle,point_place1,point_place2,point_place3,n_points_visited,depth_min,depth_max,water_temp_min,water_temp_max,water_color,wind_direction,wind_speed,tide_info,wave_info,weather,by_catch,cancel_reason,cancel_type,kanso_raw,suion_raw,suishoku_raw,source
平作丸,久里浜港,2024/05/12,2,0,タチウオ,タチウオ,メイン,タチウオ,,2,5,3,0,70,120,,,,走水沖,,,1,60.0,60.0,18.0,18.0,澄み,,,,,,,,,タチウオ船。走水沖を狙い、何とか全員ゲットする事が出来ました!テンヤは特大、大型!テンビン5匹、4匹、最大90cm。,16～18℃,澄む,釣りビジョン
平作丸,久里浜港,2024/05/12,3,0,イサキ,イサキ,メイン,イサキ,,0,3,1,0,24,30,,,,久里浜沖,,,1,40.0,40.0,18.0,18.0,澄み,,,,,,"マダイ,アジ,カワハギ",,,ウィリー五目船。久里浜沖を狙い、潮が澄み大苦戦しました。,16～18℃,澄む,釣りビジョン
平作丸,久里浜港,2024/05/14,1,0,クロダイ,クロダイ,メイン,クロダイ,朝,9,23,16,0,35,48,,,,久里浜沖,,,1,25.0,25.0,18.5,18.5,,,,潮変わり,,,"カワハギ,カサゴ交じる",,,クロダイ船。久里浜沖を狙い、朝からポツポツとアタリ出し、潮変わりと共に入れ掛かり状態!終わってみればトップ23匹、次いで19匹が2人、12匹、10匹、9匹と大爆釣!他にカワハギ・カサゴ交じる。,18～18.5℃,,釣りビジョン
平作丸,久里浜港,2024/05/14,1,0,クロダイ,イシダイ,サブ,イシダイ,朝,,,,0,,,1.8,1.8,,久里浜沖,,,1,,,18.5,18.5,,,,潮変わり,,,"カワハギ,カサゴ交じる",,,クロダイ船。久里浜沖を狙い、朝からポツポツとアタリ出し、潮変わりと共に入れ掛かり状態!終わってみればトップ23匹、次いで19匹が2人、12匹、10匹、9匹と大爆釣!他にカワハギ・カサゴ交じる。,18～18.5℃,,釣りビジョン
平作丸,久里浜港,2024/05/14,2,0,イサキ,イサキ,メイン,イサキ,,4,42,23,0,21,34,,,,久里浜沖,,,1,40.0,40.0,18.5,18.5,,,,,,,"アジ,サバ交じる",,,ウィリー五目船。久里浜沖を狙い、今日は順調に釣れ始め、シャクリの合う方は良型多数でアタリ途切れず良い釣果になりました!他にアジ・サバ交じる。,18～18.5℃,,釣りビジョン
平作丸,久里浜港,2024/05/15,1,0,アジ,アジ,メイン,アジ,朝,11,51,31,0,23,35,,,,久里浜沖,,,1,40.0,40.0,18.5,18.5,,,,,,,ウマヅラハギ交じる,,,ウィリー五目船。久里浜沖を狙い、朝からアジ・サバの活性高く釣れ続き良い釣果になりました!その分イサキが少なく残念でした。,18～18.5℃,,釣りビジョン
平作丸,久里浜港,2024/05/15,1,0,アジ,イサキ,サブ,イサキ,朝,0,3,1,0,19,37,,,,久里浜沖,,,1,,,18.5,18.5,,,,,,,ウマヅラハギ交じる,,,ウィリー五目船。久里浜沖を狙い、朝からアジ・サバの活性高く釣れ続き良い釣果になりました!その分イサキが少なく残念でした。,18～18.5℃,,釣りビジョン
平作丸,久里浜港,2024/05/15,2,0,クロダイ,クロダイ,メイン,クロダイ,,3,20,11,0,35,48,,,,久里浜沖,,,1,25.0,25.0,18.5,18.5,,,,,,,"メジナ,アジ,サバ",,,クロダイ船。久里浜沖を狙い、活性非常に高く連日絶好調!トップ20匹、次いで15匹、12匹、7匹が2人!他にメジナ・アジ・サバ・カサゴ。,18～18.5℃,,釣りビジョン
平作丸,久里浜港,2024/05/16,1,0,アジ,アジ,メイン,アジ,,38,44,41,0,24,37,,,,久里浜沖,,,1,40.0,40.0,18.5,18.5,,,,,,,サバも交じりお土産になりました,,,ウィリー五目船。久里浜沖を狙い、今日もイサキの活性低く型見たのみ。,18.5℃,,釣りビジョン
平作丸,久里浜港,2024/05/16,2,0,クロダイ,クロダイ,メイン,クロダイ,,3,15,9,0,35,48,,,,久里浜沖,,,1,25.0,25.0,18.5,18.5,,,,,,,"メジナ,大アジ,カサゴ",,,クロダイ船。久里浜沖を狙い、連日好調に釣れています!トップ15匹、次いで14匹、9匹、6匹、3匹!他にメジナ・大アジ・カサゴ。,18.5℃,,釣りビジョン
平作丸,久里浜港,2024/05/19,1,0,アジ,アジ,メイン,アジ,朝,82,132,107,0,20,36,,,,久里浜沖,,,1,40.0,40.0,19.5,19.5,,,,,,,"良型イサキ,サバ交じる!",,,ウィリー五目船。久里浜沖を狙い、朝からアジの活性非常に高く、中型主体、大型交じりで入れ掛かり状態でした!他に良型イサキ・サバ交じる!。,19～19.5℃,,釣りビジョン
平作丸,久里浜港,2024/05/19,2,0,クロダイ,クロダイ,メイン,クロダイ,,4,13,8,0,35,46,,,,久里浜沖,,,1,25.0,25.0,19.5,19.5,,,,,,,"大アジ,サバ,カサゴ交じる!",,,クロダイ船。久里浜沖を狙い、今日も活性非常に高くトップ13匹、次いで12匹、11匹が2人、8匹、6匹、4匹が2人と連日絶好調!他に大アジ・サバ・カサゴ交じる!。,19～19.5℃,,釣りビジョン
平作丸,久里浜港,2024/05/21,1,0,アジ,アジ,メイン,アジ,,33,59,46,0,20,37,,,,久里浜沖,,,1,40.0,40.0,19.5,19.5,,,,,,,"ウマヅラハギ,サバ交じる",,,ウィリー五目船。久里浜沖を狙い、ナギ良く釣り日和でお土産も確保できました!皆さんまったりとして楽しめたようです!中アジ主体で他にウマヅラハギ・サバ交じる。,19.5℃,,釣りビジョン
平作丸,久里浜港,2024/05/21,2,0,クロダイ,クロダイ,メイン,クロダイ,,7,12,9,0,35,48,,,,久里浜沖,,,1,25.0,25.0,19.5,19.5,,,,,,,"メジナ,大アジ多数でお土産になりました",,,クロダイ船。久里浜沖を狙い、連日絶好調!トップ12匹、次いで11匹、10匹が2人、9匹、8匹、7匹が2人!マダイ6.9kg!イシダイ1.2kgに、他にメジナ・大アジ多数でお土産になりました。,19.5℃,,釣りビジョン
平作丸,久里浜港,2024/05/21,2,0,クロダイ,マダイ,サブ,マダイ,,,,,0,,,6.9,6.9,,久里浜沖,,,1,,,19.5,19.5,,,,,,,"メジナ,大アジ多数でお土産になりました",,,クロダイ船。久里浜沖を狙い、連日絶好調!トップ12匹、次いで11匹、10匹が2人、9匹、8匹、7匹が2人!マダイ6.9kg!イシダイ1.2kgに、他にメジナ・大アジ多数でお土産になりました。,19.5℃,,釣りビジョン
平作丸,久里浜港,2024/05/21,2,0,クロダイ,イシダイ,サブ,イシダイ,,,,,0,,,1.2,1.2,,久里浜沖,,,1,,,19.5,19.5,,,,,,,"メジナ,大アジ多数でお土産になりました",,,クロダイ船。久里浜沖を狙い、連日絶好調!トップ12匹、次いで11匹、10匹が2人、9匹、8匹、7匹が2人!マダイ6.9kg!イシダイ1.2kgに、他にメジナ・大アジ多数でお土産になりました。,19.5℃,,釣りビジョン
平作丸,久里浜港,2024/05/22,1,0,アジ,アジ,メイン,アジ,,10,58,34,0,20,36,,,,久里浜沖,,,1,40.0,40.0,19.5,19.5,,,,,,,イサキ交じる,,,ウィリー五目船。久里浜沖を狙い、今日もアジ主体で皆さんお土産になりました!トップ58匹、次いで52匹、43匹、37匹と好調に釣れています。,19.5℃,,釣りビジョン
平作丸,久里浜港,2024/05/22,2,0,クロダイ,クロダイ,メイン,クロダイ,,5,10,7,0,35,48,,,,久里浜沖,,,1,25.0,25.0,19.5,19.5,,,,,,,"マダイ,メジナ,大アジ",,,クロダイ船。久里浜沖を狙い、爆釣とはいきませんでしたが好調に釣れています!トップ10匹、次いで7匹、5匹が2人。,19.5℃,,釣りビジョン
平安丸,小田原早川港,2024/05/01,1,0,タチウオ,タチウオ,メイン,タチウオ,,1,14,7,0,70,110,,,,小田原沖,,,1,,,,,,,,,,,,,,,,,釣りビジョン
平安丸,小田原早川港,2024/05/01,2,0,マルイカ,マルイカ,メイン,マルイカ,夜,0,5,2,0,18,35,,,,真鶴沖,,,1,,,,,,,,,,,ムギイカ交じる,,,他にムギイカ交じる。。,,,釣りビジョン
平安丸,小田原早川港,2024/05/02,1,0,イサキ,イサキ,メイン,アジ,,3,11,7,0,20,30,,,,小田原沖,二宮沖,,2,,,,,,,,,,,"サバ,アマダイ交じる",,,LT五目。他にサバ・アマダイ交じる。,,,釣りビジョン
平安丸,小田原早川港,2024/05/02,2,0,タチウオ,タチウオ,メイン,タチウオ,,1,4,2,0,70,110,,,,小田原沖,,,1,,,,,,,,,,,,,,,,,釣りビジョン
平安丸,小田原早川港,2024/05/02,3,0,キンメダイ,キンメダイ,メイン,キンメ,,0,2,1,0,25,30,,,,小田原沖,,,1,,,,,,,,,,,"シロムツ,アラ交じる",,,根魚船。他にシロムツ・アラ交じる。,,,釣りビジョン
平安丸,小田原早川港,2024/05/02,3,0,キンメダイ,キンメダイ,メイン,クロムツ,,0,5,2,0,25,35,,,,小田原沖,,,1,,,,,,,,,,,"シロムツ,アラ交じる",,,根魚船。他にシロムツ・アラ交じる。,,,釣りビジョン
平安丸,小田原早川港,2024/05/03,1,0,イサキ,イサキ,メイン,アジ,,6,20,13,0,20,30,,,,二宮沖,,,1,,,,,,,,,,,"サバ,ハナダイ交じる",,,LT五目。他にサバ・ハナダイ交じる。,,,釣りビジョン
平安丸,小田原早川港,2024/05/03,2,0,イサキ,イサキ,メイン,アジ,,0,10,5,0,20,27,,,,小田原沖,,,1,,,,,,,,,,,"アマダイ,カサゴ,マトウダイ",,,LT五目。他にアマダイ・カサゴ・マトウダイ・サバ交じる。,,,釣りビジョン
平安丸,小田原早川港,2024/05/03,3,0,タチウオ,タチウオ,メイン,タチウオ,,0,3,1,0,70,110,,,,小田原沖,,,1,,,,,,,,,,,サバ交じる,,,他にサバ交じる。。,,,釣りビジョン
平安丸,小田原早川港,2024/05/04,1,0,イサキ,イサキ,メイン,アジ,,2,32,17,0,20,33,,,,二宮沖,,,1,,,,,,,,,,,"ハナダイ,サバ交じる",,,LT五目。他にハナダイ・サバ交じる。,,,釣りビジョン
平安丸,小田原早川港,2024/05/04,2,0,メダイ,メダイ,メイン,メダイ,,0,1,0,1,,,1.0,2.3,,二宮沖,,,1,,,,,,,,,,,"アジ,サバ交じる",,,他にアジ・サバ交じる。。,,,釣りビジョン
平安丸,小田原早川港,2024/05/04,2,0,メダイ,マダイ,サブ,マダイ,,0,1,0,1,,,1.4,1.4,,小田原沖,,,1,,,,,,,,,,,"アジ,サバ交じる",,,他にアジ・サバ交じる。。,,,釣りビジョン
平安丸,小田原早川港,2024/05/04,3,0,マルイカ,マルイカ,メイン,マルイカ,夜,0,5,2,0,18,35,,,,小田原沖,,,1,,,,,,,,,,,,,,,,,釣りビジョン
平安丸,小田原早川港,2024/05/06,1,0,キンメダイ,キンメダイ,メイン,キンメ,,2,4,3,0,26,32,,,,小田原沖,,,1,,,,,,,,,,,,,,根魚船。。,,,釣りビジョン
平安丸,小田原早川港,2024/05/06,1,0,キンメダイ,キンメダイ,メイン,クロムツ,,0,2,1,0,,,,,,小田原沖,,,1,,,,,,,,,,,,,,根魚船。。,,,釣りビジョン
平安丸,小田原早川港,2024/05/06,1,0,キンメダイ,キンメダイ,メイン,シロムツ,,10,15,12,0,,,,,,小田原沖,,,1,,,,,,,,,,,,,,根魚船。。,,,釣りビジョン
平安丸,小田原早川港,2024/05/06,2,0,ムギイカ,ムギイカ,メイン,ムギイカ・マルイカ,夜,0,4,2,0,18,35,,,,小田原沖,,,1,,,,,,,,,,,,,,,,,釣りビジョン
平安丸,小田原早川港,2024/05/06,3,0,マダイ,マダイ,メイン,マダイ,,,,,0,,,,,,小田原沖,,,1,,,,,,,,,,,"ハナダイ,メダイ,アジ",,,他にハナダイ・メダイ・アジ・サバ交じる。。,,,釣りビジョン
平安丸,小田原早川港,2024/05/06,3,0,マダイ,マダイ,サブ,メジナ,,0,3,1,0,,,0.7,1.2,,小田原沖,,,1,,,,,,,,,,,"ハナダイ,メダイ,アジ",,,他にハナダイ・メダイ・アジ・サバ交じる。。,,,釣りビジョン
平安丸,小田原早川港,2024/05/08,1,0,マルイカ,マルイカ,メイン,マルイカ,,1,11,6,0,18,30,,,,真鶴沖,,,1,,,,,,,,,,,ムギイカ交じる,,,他にムギイカ交じる。。,,,釣りビジョン
平安丸,小田原早川港,2024/05/08,2,0,,,メイン,アコウ,,0,1,0,1,,,2.5,2.5,,小田原沖,,,1,,,,,,,,,,,"トウジン,エチオピア交じる",,,他にトウジン・エチオピア交じる。。,,,釣りビジョン
平安丸,小田原早川港,2024/05/08,3,0,マダイ,マダイ,メイン,マダイ,,,,,0,,,,,,小田原沖,,,1,,,,,,,,,,,"アジ,サバ,イトヨリ",,,他にアジ・サバ・イトヨリ・ハナダイ交じる。。,,,釣りビジョン
平安丸,小田原早川港,2024/05/10,1,0,アジ,アジ,メイン,アジ,,22,43,32,0,20,35,,,,二宮沖,,,1,,,,,,,,,,,サバ交じる,,,他にサバ交じる。。,,,釣りビジョン
平安丸,小田原早川港,2024/05/10,2,0,キンメダイ,キンメダイ,メイン,キンメ,,0,4,2,0,26,32,,,,小田原沖,,,1,,,,,,,,,,,"クロムツ,シロムツ,カゴカマス交じる",,,根魚船。他にクロムツ・シロムツ・カゴカマス交じる。,,,釣りビジョン
平安丸,小田原早川港,2024/05/10,3,0,マダイ,マダイ,サブ,メジナ,,0,6,3,0,,,0.7,1.5,,小田原沖,,,1,,,,,,,,,,,アジ交じる,,,他にアジ交じる。。,,,釣りビジョン
平安丸,小田原早川港,2024/05/11,1,0,マダイ,マダイ,メイン,マダイ,,0,3,1,1,,,0.6,1.6,,小田原沖,,,1,,,,,,,,,,,"ハナダイ,アジ,サバ",,,他にハナダイ・アジ・サバ・イトヨリ交じる。。,,,釣りビジョン
平安丸,小田原早川港,2024/05/11,2,0,キンメダイ,キンメダイ,メイン,メバル・シロムツ・カンコ・ハシキンメ,,7,10,8,0,20,40,,,,小田原沖,,,1,,,,,,,,,,,,,,根魚五目。。,,,釣りビジョン
平安丸,小田原早川港,2024/05/12,1,0,,,メイン,アコウ,,0,3,1,1,,,1.2,3.0,,真鶴沖,,,1,,,,,,,,,,,トウジン交じる,,,他にトウジン交じる。。,,,釣りビジョン
平安丸,小田原早川港,2024/05/12,2,0,イサキ,イサキ,メイン,アジ,,7,17,12,0,18,32,,,,小田原沖,,,1,,,,,,,,,,,"アマダイ,シキシマハナダイ,クロムツ",,,LT五目。他にアマダイ・シキシマハナダイ・クロムツ・サバ・イサキ・イトヨリ交じる。,,,釣りビジョン
平安丸,小田原早川港,2024/05/12,3,0,マダイ,マダイ,メイン,マダイ,,,,,0,,,,,,小田原沖,,,1,,,,,,,,,,,"アジ,イトヨリ,サバ交じる",,,他にアジ・イトヨリ・サバ交じる。。,,,釣りビジョン
平安丸,小田原早川港,2024/05/14,1,0,ビシアジ,ビシアジ,メイン,ビシアジ,,10,41,25,0,20,38,,,,小田原沖,,,1,,,,,,,,,,,"クロムツ,サバ交じる",,,他にクロムツ・サバ交じる。。,,,釣りビジョン
平安丸,小田原早川港,2024/05/14,2,0,マダイ,マダイ,メイン,マダイ,,,,,0,,,,,,小田原沖,二宮沖,,2,,,,,,,,,,,"メダイ,アジ,サバ交じる",,,バラシあり。他にメダイ・アジ・サバ交じる。,,,釣りビジョン
平安丸,小田原早川港,2024/05/15,1,0,ビシアジ,ビシアジ,メイン,ビシアジ,,18,30,24,0,23,35,,,,二宮沖,,,1,,,,,,,,,,,"サバ,マトウダイ交じる",,,他にサバ・マトウダイ交じる。。,,,釣りビジョン
平安丸,小田原早川港,2024/05/15,2,0,キンメダイ,キンメダイ,メイン,キンメ・クロムツ・シロムツ・スミヤキ,,7,12,9,0,20,50,,,,真鶴沖,,,1,,,,,,,,,,,,,,根魚船。。,,,釣りビジョン
平安丸,小田原早川港,2024/05/15,3,0,ムギイカ,ムギイカ,メイン,ムギイカ,夜,2,2,2,0,18,30,,,,真鶴沖,,,1,,,,,,,,,,,,,,,,,釣りビジョン
平安丸,小田原早川港,2024/05/17,1,0,ビシアジ,ビシアジ,メイン,ビシアジ,,4,31,17,0,24,37,,,,二宮沖,,,1,,,,,,,,,,,サバ交じる,,,他にサバ交じる。。,,,釣りビジョン
平安丸,小田原早川港,2024/05/17,2,0,ムギイカ,ムギイカ,メイン,ムギイカ,夜,1,5,3,0,18,32,,,,真鶴沖,,,1,,,,,,,,,,,マルイカ交じる,,,他にマルイカ交じる。。,,,釣りビジョン
平安丸,小田原早川港,2024/05/17,3,0,,,メイン,アコウ,,,,,0,,,,,,小田原沖,,,1,,,,,,,,,,,トウジン交じる,,,他にトウジン交じる。。,,,釣りビジョン
平安丸,小田原早川港,2024/05/18,1,0,イサキ,イサキ,メイン,アジ,,7,34,20,0,18,32,,,,小田原沖,,,1,,,,,,,,,,,"アマダイ,サバ交じる",,,LT五目。他にアマダイ・サバ交じる。,,,釣りビジョン
平安丸,小田原早川港,2024/05/18,2,0,キンメダイ,キンメダイ,メイン,キンメ,,1,4,2,0,25,32,,,,小田原沖,,,1,,,,,,,,,,,"シロムツ,クロムツ,スミヤキ交じる",,,根魚船。他にシロムツ・クロムツ・スミヤキ交じる。,,,釣りビジョン
平安丸,小田原早川港,2024/05/18,3,0,アジ,アジ,メイン,アジ,,10,35,22,0,24,38,,,,二宮沖,,,1,,,,,,,,,,,"サバ,カガミダイ,マトウダイ交じる",,,仕立の釣果。他にサバ・カガミダイ・マトウダイ交じる。,,,釣りビジョン
平安丸,小田原早川港,2024/05/19,1,0,,,メイン,アコウ,,0,5,2,1,,,1.0,3.2,,小田原南沖,,,1,,,,,,,,,,,トウジン交じる,,,他にトウジン交じる。。,,,釣りビジョン
平安丸,小田原早川港,2024/05/19,2,0,イサキ,イサキ,メイン,アジ,,10,21,15,0,18,34,,,,小田原沖,,,1,,,,,,,,,,,"イトヨリ,アマダイ,サバ",,,LT五目。他にイトヨリ・アマダイ・サバ・ウルメイワシ・ソウダガツオ交じる。,,,釣りビジョン
平安丸,小田原早川港,2024/05/19,3,0,マダイ,マダイ,メイン,マダイ,,,,,0,,,,,,小田原沖,,,1,,,,,,,,,,,"メダイ,アジ,サバ交じる",,,他にメダイ・アジ・サバ交じる。。,,,釣りビジョン
平安丸,小田原早川港,2024/05/21,1,0,ムギイカ,ムギイカ,メイン,ムギイカ,,8,25,16,0,18,30,,,,真鶴沖,,,1,,,,,,,,,,,マルイカ交じる,,,他にマルイカ交じる。。,,,釣りビジョン
平安丸,小田原早川港,2024/05/21,2,0,マダイ,マダイ,メイン,マダイ,,0,1,0,1,,,5.6,5.6,,小田原沖,二宮沖,,2,,,,,,,,,,,"メダイ,アジ,サバ交じる",,,他にメダイ・アジ・サバ交じる。。,,,釣りビジョン
平安丸,小田原早川港,2024/05/21,3,0,ビシアジ,ビシアジ,メイン,ビシアジ,,30,38,34,0,20,33,,,,二宮沖,,,1,,,,,,,,,,,サバ交じる,,,他にサバ交じる。。,,,釣りビジョン
平安丸,小田原早川港,2024/05/22,1,0,ムギイカ,ムギイカ,メイン,ムギイカ,,16,24,20,0,18,32,,,,真鶴沖,,,1,,,,,,,,,,,,,,,,,釣りビジョン
平安丸,小田原早川港,2024/05/22,2,0,ビシアジ,ビシアジ,メイン,ビシアジ,,12,32,22,0,24,37,,,,二宮沖,,,1,,,,,,,,,,,サバ交じる,,,他にサバ交じる。。,,,釣りビジョン
平安丸,小田原早川港,2024/05/22,3,0,キンメダイ,キンメダイ,メイン,キンメ,,,,,0,,,,,,真鶴沖,,,1,,,,,,,,,,,"シロムツ,アラ交じる",,,根魚船。他にシロムツ・アラ交じる。,,,釣りビジョン
平安丸,小田原早川港,2024/05/24,1,0,ムギイカ,ムギイカ,メイン,ムギイカ,,7,12,9,0,18,24,,,,真鶴沖,,,1,,,,,,,,,,,マルイカ交じる,,,他にマルイカ交じる。。,,,釣りビジョン
平安丸,小田原早川港,2024/05/24,2,0,ビシアジ,ビシアジ,メイン,ビシアジ,,20,38,29,0,22,35,,,,二宮沖,,,1,,,,,,,,,,,サバ交じる,,,他にサバ交じる。。,,,釣りビジョン
平安丸,小田原早川港,2024/05/24,3,0,マダイ,マダイ,メイン,マダイ,,,,,0,,,,,,二宮沖,,,1,,,,,,,,,,,"アジ,サバ交じる",,,他にアジ・サバ交じる。。,,,釣りビジョン
平安丸,小田原早川港,2024/05/24,3,0,マダイ,メダイ,サブ,メダイ,,1,3,2,0,,,1.2,3.2,,小田原沖,,,1,,,,,,,,,,,"アジ,サバ交じる",,,他にアジ・サバ交じる。。,,,釣りビジョン
平安丸,小田原早川港,2024/05/25,1,0,イサキ,イサキ,メイン,アジ,,20,42,31,0,18,28,,,,小田原沖,,,1,,,,,,,,,,,"アマダイ,カサゴ,ホウボウ",,,LT五目。他にアマダイ・カサゴ・ホウボウ・サバ・マトウダイ交じる。,,,釣りビジョン
平安丸,小田原早川港,2024/05/25,2,0,ムギイカ,ムギイカ,メイン,ムギイカ,夜,3,15,9,0,18,24,,,,真鶴沖,,,1,,,,,,,,,,,,,,,,,釣りビジョン
平安丸,小田原早川港,2024/05/25,3,0,マダイ,マダイ,メイン,マダイ,,,,,0,,,,,,二宮沖,小田原沖,,2,,,,,,,,,,,"アジ,サバ交じる",,,他にアジ・サバ交じる。。,,,釣りビジョン
平安丸,小田原早川港,2024/05/26,1,0,,,メイン,アコウ,,0,3,1,1,,,1.0,2.8,,小田原南沖,,,1,,,,,,,,,,,トウジン交じる,,,他にトウジン交じる。。,,,釣りビジョン
平安丸,小田原早川港,2024/05/26,2,0,ムギイカ,ムギイカ,メイン,ムギイカ,夜,3,20,11,0,18,24,,,,真鶴沖,,,1,,,,,,,,,,,マルイカ交じる,,,他にマルイカ交じる。。,,,釣りビジョン
平安丸,小田原早川港,2024/05/26,3,0,イサキ,イサキ,メイン,アジ,,1,15,8,0,20,30,,,,小田原沖,,,1,,,,,,,,,,,"サバ多数,アマダイ,カサゴ",,,LT五目。他にサバ多数・アマダイ・カサゴ・マルソウダ交じる。,,,釣りビジョン
平安丸,小田原早川港,2024/05/29,1,0,イサキ,イサキ,メイン,アジ,,10,25,17,0,20,30,,,,小田原沖,,,1,,,,,,,,,,,"アマダイ,イトヨリ,サバ",,,LT五目。他にアマダイ・イトヨリ・サバ。,,,釣りビジョン
平安丸,小田原早川港,2024/05/29,2,0,ムギイカ,ムギイカ,メイン,ムギイカ,夜,3,9,6,0,18,30,,,,真鶴沖,,,1,,,,,,,,,,,マルイカ交じる,,,他にマルイカ交じる。。,,,釣りビジョン
平安丸,小田原早川港,2024/05/31,1,0,イサキ,イサキ,メイン,アジ,,15,27,21,0,20,28,,,,小田原沖,,,1,,,,,,,,,,,"アマダイ,カサゴ,カイワリ",,,LT五目。他にアマダイ・カサゴ・カイワリ・サバ。,,,釣りビジョン
幸丸,飯岡港,2024/05/05,1,0,マダイ,マダイ,メイン,マダイ,午前,1,22,11,0,,,0.3,1.8,,,,,1,20.0,20.0,,,,,,,,,"カサゴ,ガンゾウビラメ,ハナダイ",,,午前船の釣果。他にカサゴ・ガンゾウビラメ・ハナダイ・ヒラメ・フグ・ホウボウ。,,,釣りビジョン
幸丸,飯岡港,2024/05/05,2,0,マダイ,マダイ,メイン,マダイ,午前,2,20,11,0,,,0.3,1.0,,,,,1,20.0,20.0,,,,,,,,,"カサゴ,カワハギ,クロダイ",,,午前船の釣果。他にカサゴ・カワハギ・クロダイ・トラフグ・ハナダイ・フグ・ヒラメ。,,,釣りビジョン
幸丸,飯岡港,2024/05/05,3,0,マダイ,マダイ,メイン,マダイ,午前,0,16,8,0,,,0.3,1.2,,,,,1,20.0,20.0,,,,,,,,,"カサゴ,ガンゾウビラメ,トラフグ",,,午前船の釣果。他にカサゴ・ガンゾウビラメ・トラフグ・フグ・ハナダイ。,,,釣りビジョン
幸丸,飯岡港,2024/05/05,4,0,マダイ,マダイ,メイン,マダイ,午前,1,15,8,0,,,0.3,1.7,,,,,1,20.0,20.0,,,,,,,,,"カサゴ,ショウサイフグ,トラフグ",,,午前船の釣果。他にカサゴ・ショウサイフグ・トラフグ・ハナダイ・ヒラメ。,,,釣りビジョン
幸丸,飯岡港,2024/05/05,5,0,マダイ,マダイ,メイン,マダイ,午前,1,13,7,0,,,0.3,1.4,,,,,1,30.0,30.0,,,,,,,,,"ウマヅラハギ,カサゴ,ガンゾウビラメ",,,午前船の釣果。他にウマヅラハギ・カサゴ・ガンゾウビラメ・ハナダイ・ヒラメ・フグ・ホウボウ・マハタ・ムシガレイ。,,,釣りビジョン
幸丸,飯岡港,2024/05/05,6,0,アカムツ,アカムツ,メイン,アカムツ,午前,0,2,1,0,25,35,,,,,,,1,170.0,170.0,,,,,,,,,"クロムツ,サバ,ユメカサゴ",,,午前船の釣果。他にクロムツ・サバ・ユメカサゴ。,,,釣りビジョン
幸丸,飯岡港,2024/05/11,1,0,マダイ,マダイ,メイン,マダイ,午前,1,15,8,0,,,0.3,1.3,,,,,1,20.0,20.0,,,,,,,,,"カサゴ,ガンゾウビラメ,クロダイ",,,午前船の釣果。他にカサゴ・ガンゾウビラメ・クロダイ・ハナダイ・ムシガレイ・フグ。,,,釣りビジョン
幸丸,飯岡港,2024/05/11,2,0,マダイ,マダイ,メイン,マダイ,午前,0,15,7,0,,,0.3,1.0,,,,,1,20.0,20.0,,,,,,潮流れず,,,"イナダ,カサゴ,ガンゾウビラメ",,,午前船の釣果。他にイナダ・カサゴ・ガンゾウビラメ・ハナダイ・ヒラメ・フグ。,,,釣りビジョン
幸丸,飯岡港,2024/05/11,3,0,マダイ,マダイ,メイン,マダイ,午前,1,13,7,0,,,0.3,0.9,,,,,1,20.0,20.0,,,,,,,,,"カサゴ,ガンゾウビラメ,ショウサイフグ",,,午前船の釣果。他にカサゴ・ガンゾウビラメ・ショウサイフグ・トラフグ・ハナダイ・ムシガレイ。,,,釣りビジョン
幸丸,飯岡港,2024/05/11,4,0,マダイ,マダイ,メイン,マダイ,午前,0,10,5,0,,,0.3,0.5,,,,,1,15.0,30.0,,,,,,,,,"カサゴ,ガンゾウビラメ,ハナダイ",,,午前船の釣果。他にカサゴ・ガンゾウビラメ・ハナダイ・ヒラメ・ムシガレイ・フグ・ワラサ。,,,釣りビジョン
幸丸,飯岡港,2024/05/12,1,0,マダイ,マダイ,メイン,マダイ,午前,2,19,10,0,,,0.3,2.8,,,,,1,20.0,20.0,,,,,,,,,"カサゴ,ハナダイ,フグ",,,午前船の釣果。他にカサゴ・ハナダイ・フグ。,,,釣りビジョン
幸丸,飯岡港,2024/05/12,2,0,マダイ,マダイ,メイン,マダイ,午前,1,16,8,0,,,0.3,3.3,,,,,1,20.0,20.0,,,,,,,,,"カサゴ,ガンゾウビラメ,ハナダイ",,,午前船の釣果。他にカサゴ・ガンゾウビラメ・ハナダイ・ホウボウ・ムシガレイ。,,,釣りビジョン
幸丸,飯岡港,2024/05/12,3,0,マダイ,マダイ,メイン,マダイ,午前,0,16,8,0,,,0.3,1.3,,,,,1,20.0,20.0,,,,,,,,,"カサゴ,ガンゾウビラメ,ハナダイ",,,午前船の釣果。他にカサゴ・ガンゾウビラメ・ハナダイ・ヒラメ・ホウボウ・フグ。,,,釣りビジョン
