ship,area,date,trip_no,is_cancellation,tsuri_mono_raw,tsuri_mono,main_sub,fish_raw,time_slot,cnt_min,cnt_max,cnt_avg,is_boat,size_min,size_max,kg_min,kg_max,tackle,point_place1,point_place2,point_place3,n_points_visited,depth_min,depth_max,water_temp_min,water_temp_max,water_color,wind_direction,wind_speed,tide_info,wave_info,weather,by_catch,cancel_reason,cancel_type,kanso_raw,suion_raw,suishoku_raw,source
光進丸,金谷港,2024/05/27,1,0,アジ,アジ,メイン,アジ,午前,5,51,28,0,25,45,,,,金谷沖,,,1,,,,,,,,"潮速く,中潮",,,,,,午前黄金アジ船。今日も期間限定!メガギガ狙いです!途中潮速く苦戦も幅広肉厚の大型多々交じり船中40匹前後の御客様も多数!浅場メインで喰い順調でした!初挑戦&貸し竿の御客様も5～29匹と今日も平均して遊べた1日でした!。,,,釣りビジョン
光進丸,金谷港,2024/05/30,1,0,アジ,アジ,メイン,アジ,午前,10,103,56,0,25,42,,,,金谷沖,,,1,,,,,,,,,,,,,,午前黄金アジ船。今日も期間限定!メガギガ狙いです!この群れ釣っちゃって下さい!幅広肉厚の大型多々交じり船中50匹前後の御客様も多数!浅場メインで喰い順調でした!初挑戦&貸し竿の御客様も10～20匹と今日も平均して遊べた1日でした!。,,,釣りビジョン
共栄丸,富浦港,2024/05/04,1,0,マダイ,マダイ,メイン,マダイ,,0,3,1,0,,,1.0,4.3,,,,,1,,,,,,,,,,,,,,コマセマダイ船。。,,,釣りビジョン
共栄丸,富浦港,2024/05/04,2,0,マダイ,マダイ,メイン,マダイ,午後,0,2,1,0,,,1.0,3.2,,,,,1,,,,,,,,,,,,,,午後便コマセマダイ船。。,,,釣りビジョン
共栄丸,富浦港,2024/05/12,1,0,マダイ,マダイ,メイン,マダイ,,0,6,3,0,,,0.7,2.43,,,,,1,,,,,,,,,,,,,,コマセマダイ船。後半、潮の変わり目でポツポツアタリバラシもあり。,,,釣りビジョン
共栄丸,富浦港,2024/05/14,1,0,マダイ,マダイ,メイン,マダイ,,1,3,2,0,,,0.7,1.15,,,,,1,,,,,,,,,,,,,,コマセマダイ船。サバ邪魔もポイントあちこち周り拾い釣りでした。,,,釣りビジョン
共栄丸,富浦港,2024/05/15,1,0,マダイ,マダイ,メイン,マダイ,,1,1,1,1,,,6.17,6.17,,,,,1,,,,,,,,,,,,,,コマセマダイ船。。,,,釣りビジョン
共栄丸,富浦港,2024/05/15,2,0,マダイ,マダイ,メイン,マダイ,午後,2,7,4,1,,,0.86,3.3,,,,,1,,,,,,,,,,,,,,午後便コマセマダイ船・6人の釣果。。,,,釣りビジョン
共栄丸,富浦港,2024/05/17,1,0,マダイ,マダイ,メイン,マダイ,午後,0,3,1,0,,,0.6,3.29,,,,,1,,,,,,,,,,,,,,午後便コマセマダイ船。潮流れて良い反応入って来るとアタリました。,,,釣りビジョン
共栄丸,富浦港,2024/05/19,1,0,マダイ,マダイ,メイン,マダイ,朝,1,5,3,0,,,0.8,2.54,,,,,1,,,,,,,,,,,,,,コマセマダイ船。朝からサバうるさくなく反応入って来てポツリポツリと型見れました。,,,釣りビジョン
共栄丸,富浦港,2024/05/20,1,0,マダイ,マダイ,メイン,マダイ,朝,0,4,2,0,,,0.6,2.68,,,,,1,,,,,,,,,,,,,,コマセマダイ船。朝からサバうるさくなく、たまに反応入って来てポツポツ釣れた。,,,釣りビジョン
共栄丸,富浦港,2024/05/22,1,0,マダイ,マダイ,メイン,マダイ,,0,4,2,0,,,0.5,3.44,,,,,1,,,,,,,,,,,,,,コマセマダイ船。。,,,釣りビジョン
共栄丸,富浦港,2024/05/22,2,0,マダイ,マダイ,メイン,マダイ,午後,0,3,1,0,,,0.4,2.39,,,,,1,,,,,,,,,,,,,,午後便コマセマダイ船。。,,,釣りビジョン
共栄丸,富浦港,2024/05/23,1,0,マダイ,マダイ,メイン,マダイ,,0,3,1,0,,,0.6,2.63,,,,,1,,,,,,,,,,,,,,コマセマダイ船。。,,,釣りビジョン
共栄丸,富浦港,2024/05/23,2,0,マダイ,マダイ,メイン,マダイ,午後,0,3,1,0,,,0.4,2.63,,,,,1,,,,,,,,,,,,,,午後便コマセマダイ船。。,,,釣りビジョン
共栄丸,富浦港,2024/05/24,1,0,マダイ,マダイ,メイン,マダイ,朝,1,4,2,0,,,0.6,1.58,,,,,1,,,,,,,,,,,,,,コマセマダイ船。朝から潮流れ速かったが、弛んで来てからアタリ出して釣れた。,,,釣りビジョン
利一丸,網代,2024/05/05,1,0,アマダイ,アマダイ,メイン,アジ・キダイ・アマダイ・サバ,,15,15,15,1,25,45,,,,,,,1,,,,,,,,,,,,,,,,,釣りビジョン
利一丸,網代,2024/05/05,2,0,,,メイン,キダイ,,10,10,10,1,30,30,,,,,,,1,,,,,,,,,,,,,,,,,釣りビジョン
利一丸,網代,2024/05/05,3,0,アジ,アジ,メイン,シマアジ・マダイ,,5,5,5,1,24,35,,,,,,,1,,,,,,,,,,,,,,ボートの釣果。。,,,釣りビジョン
利一丸,網代,2024/05/05,4,0,アマダイ,アマダイ,メイン,アマダイ,,3,3,3,1,45,45,,,,,,,1,,,,,,,,,,,,,,仕立の釣果。釣れてます。,,,釣りビジョン
利一丸,網代,2024/05/05,5,0,アマダイ,アマダイ,メイン,アマダイ・アジ,,7,7,7,1,25,45,,,,,,,1,,,,,,,,,,,,,,仕立の釣果。。,,,釣りビジョン
利一丸,網代,2024/05/11,1,0,アマダイ,アマダイ,メイン,アマダイ・キダイ,,8,8,8,1,15,35,,,,,,,1,,,,,,,,,,,,,,仕立の釣果。。,,,釣りビジョン
利一丸,網代,2024/05/14,1,0,シイラ,シイラ,メイン,シイラ,,3,3,3,1,35,45,,,,,,,1,,,,,,,,,,,,,,ボートの釣果。ルアーで釣れてます。,,,釣りビジョン
利一丸,網代,2024/05/15,1,0,マダイ,マダイ,メイン,マダイ・イトヨリ・カイワリ,,8,8,8,1,20,35,,,,,,,1,,,,,,,,,,,,,,ボートの釣果。釣れました。,,,釣りビジョン
利一丸,網代,2024/05/18,1,0,カサゴ,カサゴ,メイン,メジナ・イトヨリ・カサゴ,,3,3,3,1,,,,,,,,,1,,,,,,,,,,,,,,,,,釣りビジョン
利一丸,網代,2024/05/18,2,0,,,メイン,メジナ,,3,3,3,1,40,40,,,,,,,1,,,,,,,,,,,,,,ボートの釣果。。,,,釣りビジョン
利一丸,網代,2024/05/19,1,0,マダイ,マダイ,メイン,マダイ,,3,3,3,1,20,20,,,,,,,1,,,,,,,,,,,,,,ボートの釣果。今日は食い渋い。,,,釣りビジョン
利一丸,網代,2024/05/24,1,0,カサゴ,カサゴ,メイン,カサゴ,,1,1,1,1,40,40,,,,,,,1,,,,,,,,,,,,,,仕立の釣果。。,,,釣りビジョン
利一丸,網代,2024/05/26,1,0,マダイ,マダイ,メイン,マダイ・イトヨリ・メジナ,,5,5,5,1,20,35,,,,,,,1,,,,,,,,,,,,,,ボートの釣果。。,,,釣りビジョン
勇幸丸,片貝港,2024/05/03,1,0,イサキ,イサキ,メイン,イサキ,,0,13,6,0,20,36,,,,太東沖,片貝沖,,2,30.0,30.0,18.3,18.3,薄濁り,,,,,,"マダイ,メバル,ウマヅラハギ等も交じる",,,反応あるも潮悪く喰い渋かった。タイは終盤狙った。,18.3℃,薄濁り,釣りビジョン
勇幸丸,片貝港,2024/05/03,1,0,イサキ,ハナダイ,サブ,ハナダイ,,0,2,1,0,21,30,,,,,,,1,,,18.3,18.3,薄濁り,,,,,,"マダイ,メバル,ウマヅラハギ等も交じる",,,反応あるも潮悪く喰い渋かった。タイは終盤狙った。,18.3℃,薄濁り,釣りビジョン
勇幸丸,片貝港,2024/05/04,1,0,キンメダイ,キンメダイ,メイン,キンメ,,9,40,24,0,23,37,,,,片貝沖,,,1,250.0,250.0,21.0,21.0,薄濁り,,,,,,サバも,,,反応良く順調にアタった。2番手37匹で他にサバも。,21℃,薄濁り,釣りビジョン
勇幸丸,片貝港,2024/05/05,1,0,イサキ,イサキ,メイン,イサキ,,15,48,31,0,22,38,,,,太東沖,,,1,30.0,30.0,18.2,18.2,薄濁り,,,潮速く,,,"マダイ,マハタ等も交じる",,,前半潮速く苦戦したが後半上向き、良型主体。他にマダイ・マハタ等も交じる。,18.2℃,薄濁り,釣りビジョン
勇幸丸,片貝港,2024/05/11,1,0,イサキ,イサキ,メイン,イサキ,,8,50,29,0,20,40,,,,太東沖,,,1,30.0,30.0,17.5,17.5,薄濁り,,,,,,メジナも交じる,,,潮温低下も反応良く順調にアタった。バラシも多く、他にメジナも交じる。,17.5℃,薄濁り,釣りビジョン
勇幸丸,片貝港,2024/05/15,1,0,イサキ,イサキ,メイン,イサキ,,3,25,14,0,20,38,,,,太東沖,,,1,30.0,30.0,17.3,17.3,濁り,,,,,,"メジナ,サバも",,,シケ後の潮温低下と潮の流れも速く釣り難かった。イサキは良型主体で、他にメジナ・サバも。,17.3℃,濁る,釣りビジョン
勇幸丸,片貝港,2024/05/16,1,0,イサキ,イサキ,メイン,イサキ,,0,28,14,0,22,38,,,,太東沖,,,1,30.0,30.0,18.2,18.2,濁り,,,,,,"アジ,サバも交じる",,,仕立船の釣果。海況悪く釣り難かったがアタれば良型主体。,18.2℃,濁る,釣りビジョン
勇幸丸,片貝港,2024/05/18,1,0,イサキ,イサキ,メイン,イサキ,,4,30,17,0,21,38,,,,太東沖,片貝沖,,2,30.0,30.0,20.3,20.3,濁り,,,,,,ウマヅラハギも,,,仕立船の釣果。リレー釣り。,20.3℃,濁る,釣りビジョン
勇幸丸,片貝港,2024/05/18,1,0,イサキ,ハナダイ,サブ,ハナダイ,,1,8,4,0,22,34,,,,,,,1,,,20.3,20.3,濁り,,,,,,ウマヅラハギも,,,仕立船の釣果。リレー釣り。,20.3℃,濁る,釣りビジョン
勇幸丸,片貝港,2024/05/21,1,0,イサキ,イサキ,メイン,イサキ,,23,41,32,0,21,38,,,,太東沖,片貝沖,,2,30.0,30.0,19.0,19.0,やや澄み,,,,,,,,,リレー釣り。前半イサキ狙い、反応良く良型主体で好調。,19℃,澄み気味,釣りビジョン
勇幸丸,片貝港,2024/05/21,1,0,イサキ,ハナダイ,サブ,ハナダイ,,2,10,6,0,20,35,,,,,,,1,,,19.0,19.0,やや澄み,,,,,,,,,リレー釣り。前半イサキ狙い、反応良く良型主体で好調。,19℃,澄み気味,釣りビジョン
勇幸丸,片貝港,2024/05/23,1,0,イサキ,イサキ,メイン,イサキ,,10,50,30,0,21,40,,,,太東沖,片貝沖,,2,30.0,30.0,19.8,19.8,薄濁り,,,,,,,,,リレー釣り。イサキ主体に狙い、良型中心に好調。,19.8℃,薄濁り,釣りビジョン
勇幸丸,片貝港,2024/05/23,1,0,イサキ,ハナダイ,サブ,ハナダイ,,0,6,3,0,23,35,,,,,,,1,,,19.8,19.8,薄濁り,,,,,,,,,リレー釣り。イサキ主体に狙い、良型中心に好調。,19.8℃,薄濁り,釣りビジョン
勇盛丸,大原港,2024/05/01,1,0,マハタ,マハタ,メイン,マハタ,,,,,0,,,2.2,2.2,,岩船沖,,,1,25.0,65.0,,,,,,潮が速,,,"カサゴ,マトウダイ",,,外房大原港～マハタ&ヒラメに出船しました!!沖は潮が速いとの情報が入ったので浅場から開始しました!!マハタ・カサゴの型があるのですが全体のアタリが少なかったので…深場のポイントに移動しました!!潮の流れは速かったのですが仕掛けの入りは良く!大流しの拾い釣り。良型マハタが好調に釣れました!!マハタ最大2.2kg!!2kg!!1.7kg!!1.6kg!!1.5kg!!他1kg級!!ヒラメ2.1kg!!深場ポイント絶好調!!春の潮の入れ変わり本格シーズン突入!!良型マハタのチャンス到来です!!他にカサゴ・マトウダイも釣れました!!。,,,釣りビジョン
勇盛丸,大原港,2024/05/01,1,0,マハタ,ヒラメ,サブ,ヒラメ,,,,,0,,,2.1,2.1,,,,,1,,,,,,,,潮が速,,,"カサゴ,マトウダイ",,,外房大原港～マハタ&ヒラメに出船しました!!沖は潮が速いとの情報が入ったので浅場から開始しました!!マハタ・カサゴの型があるのですが全体のアタリが少なかったので…深場のポイントに移動しました!!潮の流れは速かったのですが仕掛けの入りは良く!大流しの拾い釣り。良型マハタが好調に釣れました!!マハタ最大2.2kg!!2kg!!1.7kg!!1.6kg!!1.5kg!!他1kg級!!ヒラメ2.1kg!!深場ポイント絶好調!!春の潮の入れ変わり本格シーズン突入!!良型マハタのチャンス到来です!!他にカサゴ・マトウダイも釣れました!!。,,,釣りビジョン
勇盛丸,大原港,2024/05/02,1,0,ヒラメ,ヒラメ,メイン,ヒラメ,朝,,,,0,,,2.9,2.9,,岩船沖,,,1,25.0,60.0,,,,,,,穏やか,,,,,外房大原港～マハタ&ヒラメに出船しました!!朝の内、海が穏やかで潮の流れが悪い…。なので、根を探りながらのポイント流し良型のヒラメ・大型マハタが釣れました!!ヒラメ最大2.9kg!!2.5kg!!2.2kg!!1.9kg!!1.5kg!!マハタ最大4kg!!2.3kg!!他1kg級でした!!深場ポイント絶好調!!春の潮の入れ変わり本格シーズン突入!!良型マハタのチャンス到来です!!。,,,釣りビジョン
勇盛丸,大原港,2024/05/02,1,0,ヒラメ,ヒラメ,メイン,マハタ,朝,,,,0,,,4.0,4.0,,,,,1,,,,,,,,,穏やか,,,,,外房大原港～マハタ&ヒラメに出船しました!!朝の内、海が穏やかで潮の流れが悪い…。なので、根を探りながらのポイント流し良型のヒラメ・大型マハタが釣れました!!ヒラメ最大2.9kg!!2.5kg!!2.2kg!!1.9kg!!1.5kg!!マハタ最大4kg!!2.3kg!!他1kg級でした!!深場ポイント絶好調!!春の潮の入れ変わり本格シーズン突入!!良型マハタのチャンス到来です!!。,,,釣りビジョン
勇盛丸,大原港,2024/05/04,1,0,ヒラメ,ヒラメ,メイン,ヒラメ,,,,,0,,,3.7,3.7,,岩船沖,,,1,25.0,60.0,,,,,,,,,,,,外房大原港～マハタ&ヒラメに出船しました!!今日も潮の流れがまぁまぁ良かったので、大流しの拾い釣り!!日中になると潮の流れが止まってしまったので、深場に移動!!ハリス切れ、バラシ…がありましたが、ヒラメ最大3.7kg!!2.4kg!!1.9kg×2匹!!1.5kg!!マハタ最大2.6kg!!2.4kg!!他1kg級でした!!深場ポイント絶好調!!春の潮の入れ変わり本格シーズン突入!!良型マハタのチャンス到来です!!,,,釣りビジョン
勇盛丸,大原港,2024/05/04,1,0,ヒラメ,ヒラメ,メイン,マハタ,,,,,0,,,2.6,2.6,,,,,1,,,,,,,,,,,,,,外房大原港～マハタ&ヒラメに出船しました!!今日も潮の流れがまぁまぁ良かったので、大流しの拾い釣り!!日中になると潮の流れが止まってしまったので、深場に移動!!ハリス切れ、バラシ…がありましたが、ヒラメ最大3.7kg!!2.4kg!!1.9kg×2匹!!1.5kg!!マハタ最大2.6kg!!2.4kg!!他1kg級でした!!深場ポイント絶好調!!春の潮の入れ変わり本格シーズン突入!!良型マハタのチャンス到来です!!,,,釣りビジョン
勇盛丸,大原港,2024/05/05,1,0,マハタ,マハタ,メイン,マハタ,朝,,,,0,,,4.8,4.8,,岩船沖,,,1,35.0,60.0,,,,,,,,,"マトウダイ,ハチカサゴ,カサゴ",,,外房大原港～マハタ&ヒラメに出船しました!!今日は深場から開始です!!今日も潮の流れ、仕掛けの入り共に良く!大流しの拾い釣り!!朝一から大型マハタ浮上!!4.8kg!!(昨日のハリス切れ、バラシポイント)。その後もアタリ良く!マハタ・良型ヒラメ・マトウダイ・カサゴ・アカヤガラ・ハチカサゴと多彩に釣れました!!マハタ最大4.8kg!!2.6kg!!2kg!!1.7kg×2匹!!1.6kg!!他1kg級!!ヒラメ最大3.7kg!!2.8kg!!2.6kg!!2.2kg!!深場ポイント絶好調!!春の潮の入れ変わり本格シーズン突入中!!良型マハタのラストチャンスです!!他にマトウダイ・ハチカサゴ・カサゴ・アカヤガラも釣れました!!。,,,釣りビジョン
勇盛丸,大原港,2024/05/05,1,0,マハタ,ヒラメ,サブ,ヒラメ,朝,,,,0,,,3.7,3.7,,,,,1,,,,,,,,,,,"マトウダイ,ハチカサゴ,カサゴ",,,外房大原港～マハタ&ヒラメに出船しました!!今日は深場から開始です!!今日も潮の流れ、仕掛けの入り共に良く!大流しの拾い釣り!!朝一から大型マハタ浮上!!4.8kg!!(昨日のハリス切れ、バラシポイント)。その後もアタリ良く!マハタ・良型ヒラメ・マトウダイ・カサゴ・アカヤガラ・ハチカサゴと多彩に釣れました!!マハタ最大4.8kg!!2.6kg!!2kg!!1.7kg×2匹!!1.6kg!!他1kg級!!ヒラメ最大3.7kg!!2.8kg!!2.6kg!!2.2kg!!深場ポイント絶好調!!春の潮の入れ変わり本格シーズン突入中!!良型マハタのラストチャンスです!!他にマトウダイ・ハチカサゴ・カサゴ・アカヤガラも釣れました!!。,,,釣りビジョン
勇盛丸,大原港,2024/05/06,1,0,ヒラメ,ヒラメ,メイン,ヒラメ,,,,,0,,,5.7,5.7,,岩船沖,,,1,35.0,60.0,,,,,,,,,"カサゴ,ハチカサゴ,アカヤガラ",,,外房大原港～泳がせ釣り今季最終日、マハタ&ヒラメに出船しました!!深場ポイントをメインで流して!!大型ヒラメ最大5.7kg!!4.5kg!!3.1kg!!2.2kg!!他1kg級!!マハタ最大2.3kg!!2kg!!1.9kg!!他1kg級!!大型のバラシありましたが…。他にカサゴ・ハチカサゴ・アカヤガラも釣れました!!。,,,釣りビジョン
勇盛丸,大原港,2024/05/06,1,0,ヒラメ,ヒラメ,メイン,マハタ,,,,,0,,,2.3,2.3,,,,,1,,,,,,,,,,,"カサゴ,ハチカサゴ,アカヤガラ",,,外房大原港～泳がせ釣り今季最終日、マハタ&ヒラメに出船しました!!深場ポイントをメインで流して!!大型ヒラメ最大5.7kg!!4.5kg!!3.1kg!!2.2kg!!他1kg級!!マハタ最大2.3kg!!2kg!!1.9kg!!他1kg級!!大型のバラシありましたが…。他にカサゴ・ハチカサゴ・アカヤガラも釣れました!!。,,,釣りビジョン
勇盛丸,大原港,2024/05/10,1,0,キントキ,キントキ,メイン,キントキ,,7,7,7,0,,,,,,大原沖,,,1,30.0,70.0,,,,,,速潮,,,,,,外房大原港～キントキ五目に出船しました!!反応に乗せるとキントキがポツポツとアタリました!日中になると、速潮が迫ってきたので浅場に移動!良いポイントにアタらなくて苦戦しました…。潮が落ち着けば期待できますね!!中型～大型でした。,,,釣りビジョン
勇盛丸,大原港,2024/05/11,1,0,オニカサゴ,オニカサゴ,メイン,オニカサゴ,朝,4,4,4,0,,,1.5,1.5,,岩船沖,,,1,120.0,120.0,,,,,,潮が速,,,"メダイ,カンコ,アヤメカサゴ等も多彩に釣れました!!",,,外房大原港～オニカサゴに出船しました!!潮が速かったので…沖のポイント行けず、浅場のポイントへ!!朝の内は、オマツリが多くて…苦戦…。潮は速いままでしたが、状況に馴れて来て!多少のオマツリはありましたが、なんとか操業しているとオニカサゴがポツポツ釣れて!オニカサゴ小サイズ～最大1.5kg!!トップ4匹!!3匹×2人!!でした。,,,釣りビジョン
勇盛丸,大原港,2024/05/18,1,0,イサキ,イサキ,メイン,イサキ,朝,,,,0,,,,,,大原沖,,,1,20.0,20.0,,,,,,,,,,,,外房大原港～初Lightタックル・イサキに出船しました!!朝から食いが良くダブル、トリプル食い!!このまま定量早上がりかと思いましたが、型程度になって来たので場所移動。このポイントで再び食い始めて、10時半までに皆さん定量となりました!!サイズは中型と大型でした!!。,,,釣りビジョン
勇盛丸,大原港,2024/05/23,1,0,イサキ,イサキ,メイン,イサキ,朝,,,,0,,,,,,大原沖,,,1,20.0,20.0,,,,,,,,,,,,外房大原港～Lightタックル・イサキに出船しました!!朝からダブル、トリプルと活性が高く!絶好調!!サイズは中型主体の大型交じり!!腹パンイサキ!!みなさん定量となりました～!!,,,釣りビジョン
勇盛丸,大原港,2024/05/25,1,0,キントキ,キントキ,メイン,キントキ,,,,,0,,,2.0,2.0,,御宿沖,,,1,,,,,,,,,,,,,,外房大原港～キントキ五目～オニカサゴのリレーに出船しました!!キントキの型が良く最大2kg!!オニカサゴも御宿沖!潮がぱったりと止まったので…ポイント、ポイントを流しポツポツと釣れました!!,,,釣りビジョン
勇盛丸,大原港,2024/05/26,1,0,ヒラマサ,ヒラマサ,メイン,ヒラマサ,,,,,0,,,14.0,14.0,,御宿沖,,,1,50.0,50.0,,,,,,,,,"サバ,良型マハタ,ジギングで他にキントキ",,,外房大原港～キントキ五目に出船しました!!サバ・サメの猛攻で、キントキは型程度!その他良型マハタ・ビッグサイズのヒラマサ14kg!!ハリス6号の五目仕掛けに掛かり、姿を見るまでサメと思ってたのでビックリでした!他にサバ・良型マハタ、ジギングで他にキントキ・サバ・カサゴ等、多彩に釣れました。。,,,釣りビジョン
勘栄丸,太東港,2024/05/03,1,0,イサキ,イサキ,メイン,イサキ,朝,6,14,10,0,21,38,,,,太東沖,,,1,10.0,30.0,,,,,,,,,,,,朝の内食い渋り、日中ポツポツ釣れた。。,,,釣りビジョン
勘栄丸,太東港,2024/05/03,1,0,イサキ,メバル,サブ,メバル,朝,0,2,1,0,22,27,,,,,,,1,,,,,,,,,,,,,,朝の内食い渋り、日中ポツポツ釣れた。。,,,釣りビジョン
勘栄丸,太東港,2024/05/03,1,0,イサキ,イサキ,メイン,マダイ,朝,0,2,1,0,,,0.3,0.5,,,,,1,,,,,,,,,,,,,,朝の内食い渋り、日中ポツポツ釣れた。。,,,釣りビジョン
勘栄丸,太東港,2024/05/03,2,0,ヒラメ,ヒラメ,メイン,ヒラメ,,1,1,1,0,,,1.35,1.35,,太東沖,,,1,10.0,30.0,,,,,,,,,,,,,,,釣りビジョン
勘栄丸,太東港,2024/05/03,2,0,ヒラメ,ヒラメ,サブ,クエ,,,,,0,,,0.72,0.72,,,,,1,,,,,,,,,,,,,,,,,釣りビジョン
勘栄丸,太東港,2024/05/04,1,0,ヒラメ,ヒラメ,メイン,ヒラメ,朝,0,2,1,0,,,0.8,2.92,,太東沖,大原沖,,2,30.0,55.0,,,,,,,,,,,,朝から食い渋った!,,,釣りビジョン
勘栄丸,太東港,2024/05/04,1,0,ヒラメ,ヒラメ,メイン,マハタ,朝,0,1,0,0,,,0.6,1.5,,,,,1,,,,,,,,,,,,,,朝から食い渋った!,,,釣りビジョン
勘栄丸,太東港,2024/05/05,1,0,ヒラメ,ヒラメ,メイン,マハタ,,0,4,2,0,,,0.5,1.0,,大原沖,太東沖,,2,25.0,60.0,,,,,,,,,,,,ヒラメは釣れませんでした。。,,,釣りビジョン
勘栄丸,太東港,2024/05/19,1,0,イサキ,イサキ,メイン,イサキ,朝,38,50,44,0,22,39,,,,太東沖,,,1,17.0,33.0,,,,,,,,,,,,朝から食い活発で10時納竿。。,,,釣りビジョン
勘栄丸,太東港,2024/05/19,1,0,イサキ,メバル,サブ,メバル,朝,0,3,1,0,20,25,,,,,,,1,,,,,,,,,,,,,,朝から食い活発で10時納竿。。,,,釣りビジョン
勘栄丸,太東港,2024/05/19,1,0,イサキ,イサキ,サブ,メジナ,朝,0,3,1,0,25,35,,,,,,,1,,,,,,,,,,,,,,朝から食い活発で10時納竿。。,,,釣りビジョン
勘栄丸,太東港,2024/05/19,1,0,イサキ,イサキ,メイン,マダイ,朝,0,2,1,0,,,0.3,0.5,,,,,1,,,,,,,,,,,,,,朝から食い活発で10時納竿。。,,,釣りビジョン
勘栄丸,太東港,2024/05/26,1,0,イサキ,イサキ,メイン,イサキ,朝,30,50,40,0,21,36,,,,太東沖,大原沖,,2,12.0,30.0,,,,,,,,,,,,竿頭2人。朝からポツポツ釣れた!。,,,釣りビジョン
勘栄丸,太東港,2024/05/26,1,0,イサキ,イサキ,メイン,マダイ,朝,0,1,0,0,,,0.3,0.7,,,,,1,,,,,,,,,,,,,,竿頭2人。朝からポツポツ釣れた!。,,,釣りビジョン
勘栄丸,太東港,2024/05/26,1,0,イサキ,イサキ,サブ,メジナ,朝,0,3,1,0,30,38,,,,,,,1,,,,,,,,,,,,,,竿頭2人。朝からポツポツ釣れた!。,,,釣りビジョン
勘栄丸,太東港,2024/05/26,1,0,イサキ,メバル,サブ,メバル,朝,0,1,0,0,25,30,,,,,,,1,,,,,,,,,,,,,,竿頭2人。朝からポツポツ釣れた!。,,,釣りビジョン
勘栄丸,太東港,2024/05/26,1,0,イサキ,イサキ,メイン,サバ,朝,0,2,1,0,36,40,,,,,,,1,,,,,,,,,,,,,,竿頭2人。朝からポツポツ釣れた!。,,,釣りビジョン
勘次郎丸,金谷港,2024/05/01,1,0,アジ,アジ,メイン,アジ,朝,17,17,17,0,25,45,,,,金谷沖,,,1,30.0,80.0,,,,,,,,,,,,毎日大型狙いです。今日も朝特大をやり、後型揃いをやります。,,,釣りビジョン
勘次郎丸,金谷港,2024/05/03,1,0,アジ,アジ,メイン,アジ,朝,7,36,21,0,25,45,,,,金谷沖,,,1,30.0,80.0,,,澄み,,,,,,,,,毎日大型狙いです。今日も朝特大をやり、後型揃いをやります。,,,釣りビジョン
勘次郎丸,金谷港,2024/05/04,1,0,アジ,アジ,メイン,アジ,朝,7,46,26,0,25,47,,,,金谷沖,,,1,30.0,50.0,,,,,,,,,,,,毎日大型狙いです。今日も朝特大をやり、後型揃いをやります。,,,釣りビジョン
勘次郎丸,金谷港,2024/05/05,1,0,アジ,アジ,メイン,アジ,朝,17,80,48,0,32,47,,,,竹岡沖,,,1,30.0,30.0,,,,,,,,,,,,毎日大型狙いです。今日も朝特大です。,,,釣りビジョン
勘次郎丸,金谷港,2024/05/09,1,0,アジ,アジ,メイン,アジ,朝,17,113,65,0,25,40,,,,金谷沖,,,1,50.0,50.0,,,,,強,,,,,,,毎日大型狙い。今日は朝から風が強くやりづらかったが、型揃いが喰い良く皆さん満足でした。,,,釣りビジョン
勘次郎丸,金谷港,2024/05/11,1,0,アジ,アジ,メイン,アジ,朝,17,105,61,0,25,40,,,,金谷沖,,,1,50.0,50.0,,,,,強,,,,,,,毎日大型狙いです。今日は朝から風強く潮も速くやりづらかったが皆さん頑張りました。,,,釣りビジョン
勘次郎丸,金谷港,2024/05/12,1,0,アジ,アジ,メイン,アジ,朝,21,110,65,0,25,40,,,,金谷沖,,,1,50.0,50.0,,,,,強,,,,,,,毎日大型狙いです。今日も朝から型揃いが喰い良かった。,,,釣りビジョン
勘次郎丸,金谷港,2024/05/14,1,0,アジ,アジ,メイン,アジ,朝,21,72,46,0,25,45,,,,金谷沖,竹岡沖,,2,30.0,50.0,,,,,,,,,,,,毎日大型狙いです。今日も朝から特大と大が喰い良く皆さん大満足でした。,,,釣りビジョン
勘次郎丸,金谷港,2024/05/18,1,0,アジ,アジ,メイン,アジ,朝,9,92,50,0,32,45,,,,金谷沖,,,1,30.0,50.0,,,,,,,,,,,,毎日大型狙いです。今日も朝特大をやり、後型揃いをやります。,,,釣りビジョン
勘次郎丸,金谷港,2024/05/19,1,0,アジ,アジ,メイン,アジ,朝,21,122,71,0,25,48,,,,金谷沖,,,1,30.0,30.0,,,,,,,,,,,,毎日大型狙いです。今日も朝から特大をやりました。,,,釣りビジョン
