ship,area,date,trip_no,is_cancellation,tsuri_mono_raw,tsuri_mono,main_sub,fish_raw,time_slot,cnt_min,cnt_max,cnt_avg,is_boat,size_min,size_max,kg_min,kg_max,tackle,point_place1,point_place2,point_place3,n_points_visited,depth_min,depth_max,water_temp_min,water_temp_max,water_color,wind_direction,wind_speed,tide_info,wave_info,weather,by_catch,cancel_reason,cancel_type,kanso_raw,suion_raw,suishoku_raw
巳之助丸,久比里港,2025/11/13,3,0,アマダイ,アマダイ,メイン,アマダイ,,0,3,1,0,25,43,,,,下浦沖,,,1,60.0,60.0,17.0,17.0,薄濁り,,,,,,"イトヨリ,ホウボウ,カサゴ",,,日中船の釣果。他にイトヨリ・ホウボウ・カサゴ。,16～17℃,薄濁り
巳之助丸,久比里港,2025/11/14,1,0,カワハギ,カワハギ,メイン,カワハギ,,6,30,18,0,5,5,,,,鴨居沖,,,1,10.0,25.0,17.0,17.0,薄濁り,,,,,,"カサゴ,ホウボウ,ウマヅラハギ",,,日中船・2隻の釣果。2番手25匹、次いで24匹。,17℃,薄濁り
巳之助丸,久比里港,2025/11/14,2,0,アジ,アジ,メイン,アジ,,40,110,75,0,22,43,,,,観音崎沖,,,1,50.0,60.0,17.0,17.0,薄濁り,,,,,,マダイ,,,日中船の釣果。他にマダイ。,17℃,薄濁り
巳之助丸,久比里港,2025/11/15,1,0,カワハギ,カワハギ,メイン,カワハギ,,3,25,14,0,16,32,,,,鴨居沖,,,1,10.0,25.0,17.0,17.0,薄濁り,,,,,,"ハナダイ,カサゴ,ホウボウ",,,日中船・4隻の釣果。2番手20匹が2人。,17℃,薄濁り
巳之助丸,久比里港,2025/11/16,1,0,カワハギ,カワハギ,メイン,カワハギ,,2,27,14,0,16,29,,,,鴨居沖,,,1,10.0,30.0,17.0,17.0,薄濁り,,,,,,"ウマヅラハギ,ホウボウ,カサゴ",,,日中船・4隻の高低。竿頭2人、2番手26匹、25匹が2人。,17℃,薄濁り
巳之助丸,久比里港,2025/11/17,1,0,カワハギ,カワハギ,メイン,カワハギ,,2,32,17,0,16,29,,,,観音崎沖,,,1,30.0,30.0,17.0,17.0,薄濁り,,,,,,"カサゴ,ウマヅラハギ,イシダイ",,,日中船・3隻の釣果。2番手28匹、次いで27匹。,17℃,薄濁り
巳之助丸,久比里港,2025/11/18,1,0,カワハギ,カワハギ,メイン,カワハギ,,4,46,25,0,16,29,,,,鴨居沖,,,1,15.0,30.0,17.0,17.0,薄濁り,,,,,,"ホウボウ,ウマヅラハギ,カイワリ",,,日中船・3隻の釣果。次いで27匹。,17℃,薄濁り
巳之助丸,久比里港,2025/11/20,1,0,カワハギ,カワハギ,メイン,カワハギ,,4,33,18,0,5,5,,,,鴨居沖,下浦沖,,2,10.0,30.0,17.0,17.0,薄濁り,,,,,,"イシダイ,ホウボウ,カサゴ",,,日中船・3隻の釣果。2番手28匹、22匹。,17℃,薄濁り
巳之助丸,久比里港,2025/11/20,2,0,アジ,アジ,メイン,アジ,,24,110,67,0,21,34,,,,鴨居沖,観音崎沖,,2,50.0,60.0,17.0,17.0,薄濁り,,,,,,マダイ,,,日中船の釣果。他にマダイ。,17℃,薄濁り
巳之助丸,久比里港,2025/11/21,1,0,カワハギ,カワハギ,メイン,カワハギ,,3,29,16,0,16,29,,,,下浦沖,鴨居沖,,2,10.0,30.0,17.0,17.0,薄濁り,,,,,,"イシダイ,ウマヅラハギ,カサゴ",,,日中船・3隻の釣果。2番手21匹、次いで19匹。,17℃,薄濁り
巳之助丸,久比里港,2025/11/21,2,0,アジ,アジ,メイン,アジ,,30,42,36,0,20,30,,,,鴨居沖,観音崎沖,,2,50.0,60.0,17.0,17.0,薄濁り,,,,,,,,,日中船の釣果。。,17℃,薄濁り
巳之助丸,久比里港,2025/11/22,1,0,カワハギ,カワハギ,メイン,カワハギ,,3,30,16,0,16,29,,,,下浦沖,竹岡沖,,2,10.0,25.0,17.0,17.0,薄濁り,,,,,,"イシダイ,カサゴ,ホウボウ",,,日中船・3隻の釣果。次25匹。,17℃,薄濁り
巳之助丸,久比里港,2025/11/22,2,0,アジ,アジ,メイン,アジ,,15,81,48,0,18,36,,,,鴨居沖,観音崎沖,,2,50.0,60.0,17.0,17.0,薄濁り,,,,,,マダイ,,,日中船の釣果。他にマダイ。,17℃,薄濁り
巳之助丸,久比里港,2025/11/23,1,0,カワハギ,カワハギ,メイン,カワハギ,,2,30,16,0,15,29,,,,竹岡沖,,,1,15.0,25.0,18.0,18.0,薄濁り,,,,,,"カサゴ,ホウボウ",,,日中船・4隻の釣果。2番手28匹。,18℃,薄濁り
巳之助丸,久比里港,2025/11/24,1,0,カワハギ,カワハギ,メイン,カワハギ,,3,28,15,0,16,30,,,,鴨居沖,竹岡沖,,2,15.0,30.0,19.0,19.0,薄濁り,,,,,,,,,,18～19℃,薄濁り
巳之助丸,久比里港,2025/11/24,2,0,アジ,アジ,メイン,アジ,,25,84,54,0,22,38,,,,久里浜沖,,,1,90.0,110.0,19.0,19.0,薄濁り,,,,,,,,,,18～19℃,薄濁り
巳之助丸,久比里港,2025/11/25,1,0,カワハギ,カワハギ,メイン,カワハギ,,2,28,15,0,16,29,,,,下浦沖,竹岡沖,,2,15.0,30.0,,,,,,,,,"カサゴ,ホウボウ",,,日中船・3隻の釣果。他にカサゴ・ホウボウ。,,
巳之助丸,久比里港,2025/11/25,2,0,アジ,アジ,メイン,アジ,,28,71,49,0,21,38,,,,久里浜沖,観音崎沖,,2,40.0,100.0,,,,,,,,,"マダイ,クロムツ",,,日中船の釣果。他にマダイ・クロムツ。,,
巳之助丸,久比里港,2025/11/27,1,0,カワハギ,カワハギ,メイン,カワハギ,,5,39,22,0,5,5,,,,鴨居沖,下浦沖,,2,10.0,30.0,20.0,20.0,澄み,,,,,,"カサゴ,ホウボウ",,,日中船・3隻の釣果。2番手32匹。,20℃,澄む
巳之助丸,久比里港,2025/11/27,2,0,アジ,アジ,メイン,アジ,,10,61,35,0,21,38,,,,久里浜沖,,,1,90.0,120.0,20.0,20.0,澄み,,,,,,"クロムツ,イシナギ",,,日中船の釣果。他にクロムツ・イシナギ。,20℃,澄む
巳之助丸,久比里港,2025/11/28,1,0,カワハギ,カワハギ,メイン,カワハギ,,4,24,14,0,16,31,,,,鴨居沖,下浦沖,,2,15.0,30.0,20.0,20.0,澄み,,,,,,"カサゴ,ホウボウ",,,日中船・3隻の釣果。2番手23匹、次いで22匹。,20℃,澄む
巳之助丸,久比里港,2025/11/28,2,0,アマダイ,アマダイ,メイン,アマダイ,,1,3,2,0,25,42,,,,久里浜沖,,,1,60.0,60.0,20.0,20.0,澄み,,,,,,"イトヨリ,カサゴ",,,日中船の釣果。竿頭2人。,20℃,澄む
巳之助丸,久比里港,2025/11/29,1,0,カワハギ,カワハギ,メイン,カワハギ,,4,41,22,0,16,29,,,,下浦沖,竹岡沖,,2,15.0,30.0,20.0,20.0,澄み,,,,,,"カサゴ,ホウボウ",,,日中船・3隻の釣果。2番手29匹、28匹。,19～20℃,澄む
巳之助丸,久比里港,2025/11/29,2,0,アジ,アジ,メイン,アジ,,17,53,35,0,25,43,,,,久里浜沖,観音崎沖,,2,60.0,120.0,20.0,20.0,澄み,,,,,,,,,日中船の釣果。2番手42匹。,19～20℃,澄む
巳之助丸,久比里港,2025/11/30,1,0,カワハギ,カワハギ,メイン,カワハギ,,1,54,27,0,16,30,,,,下浦沖,竹岡沖,,2,15.0,30.0,20.0,20.0,澄み,,,,,,"ホウボウ,イシダイ,カサゴ",,,日中船・4隻の釣果。2番手41匹、30匹台が5人。,20℃,澄む
平作丸,久里浜港,2025/11/01,1,0,タチウオ,タチウオ,メイン,タチウオ,朝,8,12,10,0,65,108,,,,走水沖,,,1,65.0,65.0,19.5,19.5,,,,,,,,,,タチウオ船。走水沖を狙い、テンヤのみで朝一からアタリは沢山ありましたが、手が中々合わずフッキング出来ませんでした。,19.5℃,
平作丸,久里浜港,2025/11/03,1,0,タチウオ,タチウオ,メイン,タチウオ,,1,10,5,0,65,120,,,,走水沖,,,1,65.0,65.0,19.0,19.0,,,,,,,,,,タチウオ船。走水沖を狙い、前半は反応少なくアタリも少なめでしたが、徐々にアタリだし全員ゲットする事が出来ました。,19℃,
平作丸,久里浜港,2025/11/07,1,0,イシダイ,イシダイ,メイン,イシダイ,,0,1,0,1,31,36,,,,久里浜沖,,,1,40.0,40.0,19.0,19.0,,,,,,,"イナダ,イサキ,アジ",,,五目船。久里浜沖を狙い、イシダイ・マダイ・ワラサ、他にイナダ・イサキ・アジ・カイワリ・ウマヅラハギ・マハタ・ヒラソウダと魚種多彩でお土産になりました。,19℃,
平作丸,久里浜港,2025/11/07,1,0,イシダイ,イシダイ,サブ,マダイ,,0,2,1,1,,,0.5,1.4,,久里浜沖,,,1,,,19.0,19.0,,,,,,,"イナダ,イサキ,アジ",,,五目船。久里浜沖を狙い、イシダイ・マダイ・ワラサ、他にイナダ・イサキ・アジ・カイワリ・ウマヅラハギ・マハタ・ヒラソウダと魚種多彩でお土産になりました。,19℃,
平作丸,久里浜港,2025/11/07,1,0,イシダイ,イシダイ,サブ,ワラサ,,0,1,0,1,,,3.0,3.4,,久里浜沖,,,1,,,19.0,19.0,,,,,,,"イナダ,イサキ,アジ",,,五目船。久里浜沖を狙い、イシダイ・マダイ・ワラサ、他にイナダ・イサキ・アジ・カイワリ・ウマヅラハギ・マハタ・ヒラソウダと魚種多彩でお土産になりました。,19℃,
平作丸,久里浜港,2025/11/09,1,0,イシダイ,イシダイ,サブ,マダイ,,0,1,0,0,,,0.3,3.8,,久里浜沖,,,1,,,20.0,20.0,,,,,,,"ワラサ,イサキ,ヒラソウダ",,,五目船。久里浜沖を狙い、前半はアタリ少なめでワラサ・イサキ等が釣れましたが、後半の潮変わりからイシダイ・クロダイが釣れました。,20℃,
平作丸,久里浜港,2025/11/09,1,0,イシダイ,イシダイ,サブ,クロダイ,,0,1,0,0,36,44,,,,久里浜沖,,,1,,,20.0,20.0,,,,,,,"ワラサ,イサキ,ヒラソウダ",,,五目船。久里浜沖を狙い、前半はアタリ少なめでワラサ・イサキ等が釣れましたが、後半の潮変わりからイシダイ・クロダイが釣れました。,20℃,
平作丸,久里浜港,2025/11/10,1,0,イシダイ,イシダイ,メイン,イシダイ,朝,0,2,1,0,30,36,,,,久里浜沖,,,1,40.0,40.0,20.0,20.0,,,,,,,"ワラサ,イナダ,カワハギ",,,五目船。久里浜沖を狙い、朝からアタリ始め、1日通して活性高く久し振りに楽しい五目船になりました。,20℃,
平作丸,久里浜港,2025/11/10,1,0,イシダイ,イシダイ,サブ,マダイ,朝,0,4,2,0,,,0.3,1.2,,久里浜沖,,,1,,,20.0,20.0,,,,,,,"ワラサ,イナダ,カワハギ",,,五目船。久里浜沖を狙い、朝からアタリ始め、1日通して活性高く久し振りに楽しい五目船になりました。,20℃,
平作丸,久里浜港,2025/11/10,1,0,イシダイ,イシダイ,サブ,イサキ,朝,0,11,5,0,22,31,,,,久里浜沖,,,1,,,20.0,20.0,,,,,,,"ワラサ,イナダ,カワハギ",,,五目船。久里浜沖を狙い、朝からアタリ始め、1日通して活性高く久し振りに楽しい五目船になりました。,20℃,
平作丸,久里浜港,2025/11/13,1,0,イシダイ,イシダイ,メイン,イシダイ,,0,1,0,0,27,31,,,,久里浜沖,,,1,40.0,40.0,18.0,18.0,,,,,,,"クロダイ,イナダ,カワハギ",,,五目船。久里浜沖を狙い、活性高くアタリも多くイシダイ・マダイ・イサキ、他にクロダイ・イナダ・カワハギ・ウマヅラハギ・マトウダイ・コショウダイ・ヒラソウダと魚種多彩でお土産になりました。,18℃,
平作丸,久里浜港,2025/11/13,1,0,イシダイ,イシダイ,サブ,マダイ,,0,3,1,0,,,0.4,1.0,,久里浜沖,,,1,,,18.0,18.0,,,,,,,"クロダイ,イナダ,カワハギ",,,五目船。久里浜沖を狙い、活性高くアタリも多くイシダイ・マダイ・イサキ、他にクロダイ・イナダ・カワハギ・ウマヅラハギ・マトウダイ・コショウダイ・ヒラソウダと魚種多彩でお土産になりました。,18℃,
平作丸,久里浜港,2025/11/13,1,0,イシダイ,イシダイ,サブ,イサキ,,0,6,3,0,22,26,,,,久里浜沖,,,1,,,18.0,18.0,,,,,,,"クロダイ,イナダ,カワハギ",,,五目船。久里浜沖を狙い、活性高くアタリも多くイシダイ・マダイ・イサキ、他にクロダイ・イナダ・カワハギ・ウマヅラハギ・マトウダイ・コショウダイ・ヒラソウダと魚種多彩でお土産になりました。,18℃,
平作丸,久里浜港,2025/11/16,1,0,イシダイ,イシダイ,メイン,イシダイ,,0,1,0,0,,,,,,久里浜沖,,,1,40.0,40.0,17.5,17.5,,,,,,,"イナダ,イサキ,カワハギ",,,五目船・2隻の釣果。久里浜沖を狙い、イシダイ・マダイ、他にイナダ・イサキ・カワハギ・アマダイ・イトヨリ・カイワリ・キジハタ・キダイ・ヒラソウダと魚種多彩でしたが、アタリは少なめでした。,17.5℃,
平作丸,久里浜港,2025/11/16,1,0,イシダイ,イシダイ,サブ,マダイ,,0,2,1,0,,,0.5,1.7,,久里浜沖,,,1,,,17.5,17.5,,,,,,,"イナダ,イサキ,カワハギ",,,五目船・2隻の釣果。久里浜沖を狙い、イシダイ・マダイ、他にイナダ・イサキ・カワハギ・アマダイ・イトヨリ・カイワリ・キジハタ・キダイ・ヒラソウダと魚種多彩でしたが、アタリは少なめでした。,17.5℃,
平作丸,久里浜港,2025/11/17,1,0,イシダイ,イシダイ,メイン,イシダイ,,0,2,1,0,26,37,,,,久里浜沖,,,1,40.0,40.0,18.5,18.5,,,強,,,,"ワラサ,イナダ,ショゴ",,,五目船。久里浜沖を狙い、風強く12時に帰港となりましたが、活性高くアタリ活発、魚種多彩で良いお土産になりました。,18.5℃,
平作丸,久里浜港,2025/11/17,1,0,イシダイ,イシダイ,サブ,マダイ,,0,5,2,0,,,0.3,1.5,,久里浜沖,,,1,,,18.5,18.5,,,強,,,,"ワラサ,イナダ,ショゴ",,,五目船。久里浜沖を狙い、風強く12時に帰港となりましたが、活性高くアタリ活発、魚種多彩で良いお土産になりました。,18.5℃,
平作丸,久里浜港,2025/11/17,1,0,イシダイ,イシダイ,サブ,イサキ,,0,11,5,0,20,32,,,,久里浜沖,,,1,,,18.5,18.5,,,強,,,,"ワラサ,イナダ,ショゴ",,,五目船。久里浜沖を狙い、風強く12時に帰港となりましたが、活性高くアタリ活発、魚種多彩で良いお土産になりました。,18.5℃,
平作丸,久里浜港,2025/11/21,1,0,マダイ,マダイ,メイン,マダイ,,0,5,2,0,,,0.4,1.1,,久里浜沖,,,1,40.0,40.0,18.5,18.5,,,,,,,"イシダイ,イナダ,イサキ",,,五目船。久里浜沖を狙い、ポツポツとアタリがありお土産になりました。,18.5℃,
平作丸,久里浜港,2025/11/21,1,0,マダイ,マダイ,サブ,イナダ,,0,2,1,0,45,50,,,,久里浜沖,,,1,,,18.5,18.5,,,,,,,"イシダイ,イナダ,イサキ",,,五目船。久里浜沖を狙い、ポツポツとアタリがありお土産になりました。,18.5℃,
平作丸,久里浜港,2025/11/23,1,0,タチウオ,タチウオ,メイン,タチウオ,,1,21,11,0,65,117,,,,走水沖,,,1,65.0,65.0,17.5,17.5,,,,潮止まり,,,,,,タチウオ船。走水沖～観音崎沖で1日頑張りました!反応も少なく、久々の出番で冷汗をかきましたが、アタリが出だすと良型主体でポツポツと釣れ始め、潮が効いている間は誰かが釣り上げるくらいでした。,17.5℃,
平作丸,久里浜港,2025/11/24,1,0,イシダイ,イシダイ,サブ,五目,,0,14,7,0,20,71,,,,久里浜沖,,,1,40.0,40.0,19.8,19.8,,,,,,,"ワラサ,イナダ,イサキ",,,五目船・2隻の釣果。久里浜沖を狙い、本日も活性の上がる時間が短く、短期集中でバリバリっとお土産を確保して頂きました。,19.8℃,
平作丸,久里浜港,2025/11/24,1,0,イシダイ,イシダイ,メイン,イシダイ,,0,1,0,0,22,30,,,,久里浜沖,,,1,,,19.8,19.8,,,,,,,"ワラサ,イナダ,イサキ",,,五目船・2隻の釣果。久里浜沖を狙い、本日も活性の上がる時間が短く、短期集中でバリバリっとお土産を確保して頂きました。,19.8℃,
平作丸,久里浜港,2025/11/24,1,0,イシダイ,イシダイ,サブ,マダイ,,0,2,1,0,,,0.7,1.1,,久里浜沖,,,1,,,19.8,19.8,,,,,,,"ワラサ,イナダ,イサキ",,,五目船・2隻の釣果。久里浜沖を狙い、本日も活性の上がる時間が短く、短期集中でバリバリっとお土産を確保して頂きました。,19.8℃,
平作丸,久里浜港,2025/11/24,1,0,イシダイ,イシダイ,サブ,アジ,,0,14,7,0,20,38,,,,久里浜沖,,,1,,,19.8,19.8,,,,,,,"ワラサ,イナダ,イサキ",,,五目船・2隻の釣果。久里浜沖を狙い、本日も活性の上がる時間が短く、短期集中でバリバリっとお土産を確保して頂きました。,19.8℃,
平安丸,小田原早川港,2025/11/01,1,0,キハダマグロ,キハダマグロ,メイン,キハダマグロ,,0,2,1,1,,,12.3,56.3,,小田原湾内,,,1,,,,,,,,,,,,,,,,
平安丸,小田原早川港,2025/11/02,1,0,イナダ,イナダ,メイン,イナダ・ワラサ,,0,4,2,0,35,85,,,,小田原沖,,,1,,,,,,,,,,,"カンパチ,アジ,サバ",,,イナダ五目。ワラサ船中3匹。,,
平安丸,小田原早川港,2025/11/03,1,0,キハダマグロ,キハダマグロ,メイン,キハダマグロ,,0,1,0,1,,,9.8,46.7,,小田原湾内,,,1,,,,,,,,,,,,,,,,
平安丸,小田原早川港,2025/11/03,2,0,イナダ,イナダ,メイン,イナダ,,0,2,1,0,35,45,,,,小田原沖,,,1,,,,,,,,,,,"本ガツオ,マゴチ,アジ",,,イナダ五目。他に本ガツオ・マゴチ・アジ・サバ・ソウダガツオ交じる。,,
平安丸,小田原早川港,2025/11/03,2,0,イナダ,イナダ,メイン,カンパチ,,0,6,3,0,35,48,,,,小田原沖,,,1,,,,,,,,,,,"本ガツオ,マゴチ,アジ",,,イナダ五目。他に本ガツオ・マゴチ・アジ・サバ・ソウダガツオ交じる。,,
平安丸,小田原早川港,2025/11/04,1,0,キハダマグロ,キハダマグロ,メイン,キハダマグロ,,0,2,1,1,,,11.1,49.0,,小田原湾内,,,1,,,,,,,,,,,,,,,,
平安丸,小田原早川港,2025/11/04,2,0,カンパチ,カンパチ,メイン,カンパチ,,6,18,12,0,35,48,,,,小田原沖,,,1,,,,,,,,,,,"クエ,アジ,サバ交じる",,,他にクエ・アジ・サバ交じる。。,,
平安丸,小田原早川港,2025/11/04,2,0,カンパチ,カンパチ,メイン,イナダ,,0,7,3,0,35,45,,,,小田原沖,,,1,,,,,,,,,,,"クエ,アジ,サバ交じる",,,他にクエ・アジ・サバ交じる。。,,
平安丸,小田原早川港,2025/11/05,1,0,キハダマグロ,キハダマグロ,メイン,キハダマグロ,,0,1,0,1,,,16.2,57.0,,小田原湾内,,,1,,,,,,,,,,,,,,,,
平安丸,小田原早川港,2025/11/05,2,0,ヤリイカ,ヤリイカ,メイン,ヤリイカ,夜,1,16,8,0,20,38,,,,二宮沖,,,1,,,,,,,,,,,,,,,,
平安丸,小田原早川港,2025/11/07,1,0,キハダマグロ,キハダマグロ,メイン,キハダマグロ,,0,1,0,1,,,55.7,55.7,,小田原湾内,,,1,,,,,,,,,,,,,,,,
平安丸,小田原早川港,2025/11/07,2,0,イナダ,イナダ,メイン,カンパチ,,1,8,4,0,35,50,,,,小田原沖,,,1,,,,,,,,,,,"マゴチ,メジナ,アジ",,,イナダ五目。他にマゴチ・メジナ・アジ・ソウダガツオ交じる。,,
平安丸,小田原早川港,2025/11/07,2,0,イナダ,イナダ,メイン,イナダ,,0,8,4,0,35,45,,,,小田原沖,,,1,,,,,,,,,,,"マゴチ,メジナ,アジ",,,イナダ五目。他にマゴチ・メジナ・アジ・ソウダガツオ交じる。,,
平安丸,小田原早川港,2025/11/08,1,0,キハダマグロ,キハダマグロ,メイン,キハダマグロ,,0,1,0,1,,,62.7,62.7,,小田原湾内,,,1,,,,,,,,,,,,,,,,
平安丸,小田原早川港,2025/11/08,2,0,イナダ,イナダ,メイン,イナダ,,1,6,3,0,35,70,,,,小田原沖,,,1,,,,,,,,,,,,,,イナダ五目・仕立の釣果。。,,
平安丸,小田原早川港,2025/11/09,1,0,イナダ,イナダ,メイン,イナダ,,0,7,3,0,40,47,,,,小田原沖,,,1,,,,,,,,,,,"カンパチ,カイワリ交じる",,,イナダ五目・仕立の釣果。他にカンパチ・カイワリ交じる。,,
平安丸,小田原早川港,2025/11/10,1,0,イナダ,イナダ,メイン,イナダ,,0,3,1,0,40,75,,,,小田原沖,,,1,,,,,,,,,,,サワラ交じる,,,イナダ五目。他にサワラ交じる。,,
平安丸,小田原早川港,2025/11/11,1,0,キンメダイ,キンメダイ,メイン,キンメ,,3,21,12,0,25,30,,,,小田原沖,,,1,,,,,,,,,,,"シロムツ,クロムツ交じる",,,根魚船。他にシロムツ・クロムツ交じる。,,
平安丸,小田原早川港,2025/11/12,1,0,キハダマグロ,キハダマグロ,メイン,キハダマグロ,,1,1,1,1,,,31.3,31.3,,小田原湾内,,,1,,,,,,,,,,,,,,,,
平安丸,小田原早川港,2025/11/12,2,0,ヤリイカ,ヤリイカ,メイン,ヤリイカ,夜,0,9,4,0,23,35,,,,真鶴沖,,,1,,,,,,,,,,,,,,,,
平安丸,小田原早川港,2025/11/14,1,0,ヤリイカ,ヤリイカ,メイン,ヤリイカ,,0,9,4,0,23,35,,,,真鶴沖,,,1,,,,,,,,,,,,,,,,
平安丸,小田原早川港,2025/11/15,1,0,イナダ,イナダ,メイン,イナダ,,0,2,1,0,40,75,,,,小田原沖,,,1,,,,,,,,,,,,,,イナダ五目。。,,
平安丸,小田原早川港,2025/11/16,1,0,キハダマグロ,キハダマグロ,メイン,キハダマグロ,,1,1,1,1,,,9.7,9.7,,小田原湾内,,,1,,,,,,,,,,,本ガツオ交じる,,,他に本ガツオ交じる。。,,
平安丸,小田原早川港,2025/11/16,2,0,ビシアジ,ビシアジ,メイン,ビシアジ,,15,41,28,0,23,28,,,,二宮沖,,,1,,,,,,,,,,,サバ交じる,,,仕立の釣果。他にサバ交じる。,,
平安丸,小田原早川港,2025/11/17,1,0,ヤリイカ,ヤリイカ,メイン,ヤリイカ,,1,8,4,0,23,40,,,,真鶴沖,,,1,,,,,,,,,,,スルメイカ交じる,,,他にスルメイカ交じる。。,,
平安丸,小田原早川港,2025/11/17,2,0,キンメダイ,キンメダイ,メイン,キンメ,,3,15,9,0,25,30,,,,小田原沖,,,1,,,,,,,,,,,"クロムツ,シロムツ,スミヤキ交じる",,,根魚船。他にクロムツ・シロムツ・スミヤキ交じる。,,
平安丸,小田原早川港,2025/11/18,1,0,イナダ,イナダ,メイン,イナダ,,4,11,7,0,35,48,,,,小田原沖,,,1,,,,,,,,,,,,,,イナダ五目。。,,
平安丸,小田原早川港,2025/11/19,1,0,イナダ,イナダ,メイン,イナダ,,0,6,3,0,40,65,,,,小田原沖,,,1,,,,,,,,,,,マハタ交じる,,,イナダ五目。他にマハタ交じる。,,
平安丸,小田原早川港,2025/11/19,2,0,マダイ,マダイ,メイン,マダイ,,1,1,1,0,,,0.4,0.7,,小田原沖,,,1,,,,,,,,,,,"アマダイ,カイワリ,イナダ",,,他にアマダイ・カイワリ・イナダ・アジ・イトヨリ・ハタ・ホウボウ交じる。。,,
平安丸,小田原早川港,2025/11/21,1,0,ヤリイカ,ヤリイカ,メイン,ヤリイカ,,4,17,10,0,25,35,,,,二宮沖,,,1,,,,,,,,,,,,,,,,
平安丸,小田原早川港,2025/11/21,2,0,イナダ,イナダ,メイン,イナダ,,0,5,2,0,40,50,,,,小田原沖,,,1,,,,,,,,,,,"マダイ,アマダイ,カイワリ",,,イナダ五目。他にマダイ・アマダイ・カイワリ・イトヨリ交じる。,,
平安丸,小田原早川港,2025/11/22,1,0,キハダマグロ,キハダマグロ,メイン,キハダマグロ,,0,2,1,1,,,14.0,43.5,,小田原湾内,,,1,,,,,,,,,,,,,,,,
平安丸,小田原早川港,2025/11/22,2,0,キンメダイ,キンメダイ,メイン,キンメ,,4,13,8,0,25,30,,,,小田原沖,,,1,,,,,,,,,,,"クロムツ,シロムツ,メダイ交じる",,,根魚船。他にクロムツ・シロムツ・メダイ交じる。,,
平安丸,小田原早川港,2025/11/23,1,0,キハダマグロ,キハダマグロ,メイン,キハダマグロ,,0,2,1,1,,,10.9,29.5,,小田原湾内,,,1,,,,,,,,,,,,,,,,
平安丸,小田原早川港,2025/11/23,2,0,イナダ,イナダ,メイン,イナダ,,0,4,2,0,40,68,,,,小田原沖,,,1,,,,,,,,,,,,,,イナダ五目・仕立船の釣果。。,,
平安丸,小田原早川港,2025/11/24,1,0,ヤリイカ,ヤリイカ,メイン,ヤリイカ,,0,5,2,0,25,35,,,,二宮沖,,,1,,,,,,,,,,,,,,,,
平安丸,小田原早川港,2025/11/24,2,0,イナダ,イナダ,メイン,イナダ,,0,5,2,0,40,85,,,,小田原沖,,,1,,,,,,,,,,,マトウダイ交じる,,,イナダ五目。他にマトウダイ交じる。,,
平安丸,小田原早川港,2025/11/25,1,0,イナダ,イナダ,メイン,イナダ,,2,7,4,0,40,85,,,,小田原沖,,,1,,,,,,,,,,,,,,,,
平安丸,小田原早川港,2025/11/25,2,0,キンメダイ,キンメダイ,メイン,キンメ,,10,10,10,0,25,30,,,,小田原沖,,,1,,,,,,,,,,,シロムツ多数交じる,,,根魚船。他にシロムツ多数交じる。,,
平安丸,小田原早川港,2025/11/25,2,0,キンメダイ,キンメダイ,サブ,アカムツ,,1,1,1,0,,,,,,小田原沖,,,1,,,,,,,,,,,シロムツ多数交じる,,,根魚船。他にシロムツ多数交じる。,,
平安丸,小田原早川港,2025/11/25,2,0,キンメダイ,キンメダイ,メイン,クロムツ,,4,4,4,0,,,,,,小田原沖,,,1,,,,,,,,,,,シロムツ多数交じる,,,根魚船。他にシロムツ多数交じる。,,
平安丸,小田原早川港,2025/11/26,1,0,キンメダイ,キンメダイ,メイン,キンメ,,3,25,14,0,25,30,,,,真鶴沖,,,1,,,,,,,,,,,"メダイ,スミヤキ交じる",,,根魚船。他にメダイ・スミヤキ交じる。,,
平安丸,小田原早川港,2025/11/26,1,0,キンメダイ,キンメダイ,メイン,クロムツ,,2,12,7,0,28,40,,,,小田原沖,,,1,,,,,,,,,,,"メダイ,スミヤキ交じる",,,根魚船。他にメダイ・スミヤキ交じる。,,
平安丸,小田原早川港,2025/11/26,2,0,ヤリイカ,ヤリイカ,メイン,ヤリイカ,夜,8,15,11,0,23,35,,,,二宮沖,,,1,,,,,,,,,,,,,,,,
平安丸,小田原早川港,2025/11/28,1,0,イナダ,イナダ,メイン,イナダ,,0,5,2,0,38,70,,,,小田原沖,,,1,,,,,,,,,,,,,,イナダ五目。。,,
平安丸,小田原早川港,2025/11/28,2,0,キンメダイ,キンメダイ,メイン,キンメ,,10,11,10,0,25,30,,,,小田原沖,,,1,,,,,,,,,,,"クロムツ,シロムツ,メダイ交じる",,,根魚船。他にクロムツ・シロムツ・メダイ交じる。,,
平安丸,小田原早川港,2025/11/29,1,0,イナダ,イナダ,メイン,イナダ,,0,2,1,0,38,70,,,,小田原沖,,,1,,,,,,,,,,,カンパチ交じる,,,イナダ五目。他にカンパチ交じる。,,
平安丸,小田原早川港,2025/11/30,1,0,イナダ,イナダ,メイン,イナダ,,0,3,1,0,38,65,,,,小田原沖,,,1,,,,,,,,,,,,,,イナダ五目。。,,
平安丸,小田原早川港,2025/11/30,2,0,キンメダイ,キンメダイ,メイン,キンメ,,0,4,2,0,25,30,,,,真鶴沖,小田原沖,,2,,,,,,,,,,,"シロムツ,メダイ,カゴカマス交じる",,,根魚船。他にシロムツ・メダイ・カゴカマス交じる。,,
