ship,area,date,trip_no,is_cancellation,tsuri_mono_raw,tsuri_mono,main_sub,fish_raw,time_slot,cnt_min,cnt_max,cnt_avg,is_boat,size_min,size_max,kg_min,kg_max,tackle,point_place1,point_place2,point_place3,n_points_visited,depth_min,depth_max,water_temp_min,water_temp_max,water_color,wind_direction,wind_speed,tide_info,wave_info,weather,by_catch,cancel_reason,cancel_type,kanso_raw,suion_raw,suishoku_raw,source
弁天屋,金沢八景,2026/05/09,4,0,アジ,アジ,メイン,午前アジ,午前,5,40,22,0,17,30,,,,富岡沖,,,1,15.0,20.0,,,,,,,,,,,,,,,釣りビジョン
弁天屋,金沢八景,2026/05/09,5,0,シロギス,シロギス,メイン,午前シロギス,午前,4,59,31,0,16,23,,,,中ノ瀬,,,1,15.0,20.0,,,,,,,,,,,,,,,釣りビジョン
弁天屋,金沢八景,2026/05/09,6,0,アジ,アジ,メイン,午後アジ,午後,25,49,37,0,18,24,,,,小柴沖,,,1,20.0,20.0,,,,,,,,,,,,,,,釣りビジョン
弁天屋,金沢八景,2026/05/09,7,0,シロギス,シロギス,メイン,午後シロギス,午後,8,62,35,0,17,23,,,,中ノ瀬,,,1,15.0,20.0,,,,,,,,,,,,,,,釣りビジョン
弁天屋,金沢八景,2026/05/10,1,0,マゴチ,マゴチ,メイン,全日マゴチ,,0,4,2,0,37,58,,,,富津沖,,,1,10.0,20.0,,,,,,,,,,,,,,,釣りビジョン
弁天屋,金沢八景,2026/05/10,2,0,アジ,アジ,メイン,全日アジ,,17,142,79,0,17,45,,,,富岡沖,,,1,20.0,25.0,,,,,,,,,,,,,,,釣りビジョン
弁天屋,金沢八景,2026/05/10,3,0,アジ,アジ,メイン,午前アジ,午前,15,41,28,0,18,28,,,,富岡沖,,,1,15.0,20.0,,,,,,,,,,,,,,,釣りビジョン
弁天屋,金沢八景,2026/05/10,4,0,シロギス,シロギス,メイン,午前シロギス,午前,10,59,34,0,17,23,,,,中ノ瀬,,,1,15.0,20.0,,,,,,,,,,,,,,,釣りビジョン
弁天屋,金沢八景,2026/05/10,5,0,アジ,アジ,メイン,午後アジ,午後,10,30,20,0,18,26,,,,小柴沖,,,1,20.0,25.0,,,,,,,,,,,,,,,釣りビジョン
弁天屋,金沢八景,2026/05/10,6,0,シロギス,シロギス,メイン,午後シロギス,午後,16,46,31,0,17,23,,,,中ノ瀬,,,1,15.0,20.0,,,,,,,,,,,,,,,釣りビジョン
弘漁丸,日立久慈港,2026/05/08,1,0,マダイ,マダイ,メイン,マダイ,,2,7,4,0,,,0.3,1.8,,,,,1,,,,,,,,,,,,,,,,,釣りビジョン
弘漁丸,日立久慈港,2026/05/09,1,0,マダイ,マダイ,メイン,マダイ,,0,5,2,0,,,0.3,3.0,,,,,1,,,,,,,,,,,,,,,,,釣りビジョン
弘漁丸,日立久慈港,2026/05/10,1,0,マダイ,マダイ,メイン,マダイ,,0,8,4,0,,,0.3,1.7,,,,,1,,,,,,,,,,,,,,,,,釣りビジョン
弘漁丸,日立久慈港,2026/05/11,1,0,マダイ,マダイ,メイン,マダイ,,0,6,3,0,,,0.3,2.3,,,,,1,,,,,,,,,,,,,,,,,釣りビジョン
弘漁丸,日立久慈港,2026/05/12,1,0,マダイ,マダイ,メイン,マダイ,,0,5,2,0,,,0.3,4.9,,,,,1,,,,,,,,,,,,,,,,,釣りビジョン
弘漁丸,日立久慈港,2026/05/13,1,0,マダイ,マダイ,メイン,マダイ,,0,3,1,0,,,0.3,0.8,,日立久慈港,,,1,,,,,,,,,,,,,,,,,釣りビジョン
弘漁丸,日立久慈港,2026/05/14,1,0,マダイ,マダイ,メイン,マダイ,,0,4,2,0,,,0.3,0.7,,,,,1,,,,,,,強,,,,,,,風強く、早上がりでした!0.7kgのマダイが最大で竿頭4匹!ゲストは魚種多彩!,,,釣りビジョン
弘漁丸,日立久慈港,2026/05/15,1,0,マダイ,マダイ,メイン,マダイ,,0,5,2,0,,,0.3,0.9,,,,,1,,,,,,,,,,,,,,,,,釣りビジョン
弘漁丸,日立久慈港,2026/05/16,1,0,マダイ,マダイ,メイン,マダイ,,0,5,2,0,,,0.3,1.5,,,,,1,,,,,,,,,,,,,,,,,釣りビジョン
強丸,松輪間口港,2026/05/03,1,0,マダイ,マダイ,メイン,マダイ,,1,2,1,0,,,0.6,3.0,,剣崎沖,,,1,,,,,,,,,,,"イサキ,クロダイ,メジナ",,,マダイ好調で大きいアタリもあり、ハリス切れもありました。他にイサキ・クロダイ・メジナ。,,,釣りビジョン
恒丸,大磯港,2026/05/10,1,0,アジ,アジ,メイン,アジ,,30,51,40,0,22,38,,,,瀬の海,,,1,100.0,100.0,,,,,,,,,サバが交じりました,,,アジ乗合。今日は良型主体に食いが良かったです。,,,釣りビジョン
恒丸,大磯港,2026/05/14,1,0,マダイ,マダイ,サブ,アジ,,15,40,27,0,23,40,,,,,,,1,,,,,,,,,,,"サバ,ウルメイワシ,クロムツ",,,今日アジは良型主体に食いが良かったです。他にサバ・ウルメイワシ・クロムツ・メダイ・マダイが交じりました。,,,釣りビジョン
敷嶋丸,大原港,2026/05/05,1,0,フグ,フグ,メイン,フグ,,6,16,11,0,18,36,,,,太東沖,,,1,6.0,6.0,15.0,15.0,,,,,,,,,,"地図を表示 敷嶋丸での釣行プラン・料金 敷嶋丸周辺の天気 大原港 1時間毎の天気 千葉県 の週間天気 注意報・警報 令和８年５月１１日２０時３７分 銚子地方気象台 発表 北西部解除 北東部なし 南部解除 注意報を解除します。 千葉中央 (解除)強風注意報、(解除)波浪注意報 印旛 発表注意報・警報はなし 東葛飾 (解除)強風注意報、(解除)波浪注意報 香取・海匝 発表注意報・警報はなし 山武・長生 発表注意報・警報はなし 君津 (解除)強風注意報、(解除)波浪注意報 夷隅・安房 発表注意報・警報はなし 敷嶋丸周辺の潮汐 関連番組一覧 敷嶋丸の釣果・施設情報 最新釣果 ニュース 営業情報 １日の流れ 施設写真 地図 釣りもの 天気 潮汐 釣りビジョン マガジン 釣りビジョン マガジンより 2025年11月07日公開 【数型とも好調！】千葉県外房・大原のショウサイフグ、大型活発！初心者もOK！！千葉県大原港『敷嶋丸』 2024年09月14日公開 【カットウ釣り】大原太東沖のショウサイフグが絶好調！トラフグも浮上！千葉県大原港『敷嶋丸』 2023年12月14日公開 《規定数達成続出！》外房・大原沖のフグ、今年も群れ濃く期待大！千葉県大原港『敷嶋丸』 2022年10月12日公開 大原沖のショウサイフグ、良型揃いで大満足！！ 2021年01月15日公開 千葉県・大原沖のフグ、良型アカメフグ交じり出す！ もっと見る 各地方の釣果 北海道・東北地方 関東地方 北陸・甲信越地方 東海地方 関西地方 中国地方 四国地方 九州・沖縄地方 各都道府県の釣果 北海道 青森県 岩手県 宮城県 秋田県 山形県 福島県 茨城県 栃木県 群馬県 埼玉県 千葉県 東京都 神奈川県 新潟県 富山県 石川県 福井県 山梨県 長野県 岐阜県 静岡県 愛知県 三重県 滋賀県 京都府 大阪府 兵庫県 奈良県 和歌山県 鳥取県 島根県 岡山県 広島県 山口県 徳島県 香川県 愛媛県 高知県 福岡県 佐賀県 長崎県 熊本県 大分県 宮崎県 鹿児島県 沖縄県 周辺の施設を見る 大原港 大原港の施設を見る つる丸 新幸丸 秀丸 長福丸 長栄丸 広布号 勇盛丸 富士丸 進誠丸 義丸 義之丸 富久丸 臼井丸 熊吉丸 あままさ丸 板倉丸 勝晃丸 力漁丸 山正丸 春栄丸 松栄丸 春日丸 初栄丸 若栄丸 拓永丸 松鶴丸 鈴栄丸 利東丸 第三松栄丸 利永丸 外房 近隣を見る 外川港 飯岡港 片貝港 御宿岩和田港 勝浦川津港 太東港 天津港 千葉県 他のエリアを見る 南房 内房 東京湾奥 関東 他の県を見る 茨城県 栃木県 群馬県 埼玉県 千葉県 東京都 神奈川県 ページTOPへ 視聴方法 釣りビジョンVOD スカパー! J:COM ケーブルテレビ ひかりTV 法人のお客様 番組情報 番組情報 番組表 番組ラインナップ 放送番組の編集の基準 番組審議委員会 議事録 衛星基幹放送に係る 有料基幹放送契約約款 釣り情報 釣果・施設情報 釣り場の天気 釣具店情報 釣り入門動画 釣りビジョン マガジン よくあるご質問 その他 公式SNS オンラインショップ プレゼント 会社概要 電子公告 お知らせ一覧 採用情報 お問い合わせ プライバシーポリシー このサイトについて 利用者情報の外部送信について &copy;Fishing Vision Co., Ltd. function initialize(){ var maplatlng = [{""shop_cd"":""66"",""latitude"":""35.2518501609806"",""longitude"":""140.405469023032"",""type_cd"":""2""},{""shop_cd"":""66"",""latitude"":""35.2519465364708"",""longitude"":""140.405340276999"",""type_cd"":""2""},{""shop_cd"":""66"",""latitude"":""35.2518501609806"",""longitude"":""140.405469023032"",""type_cd"":""3""},{""shop_cd"":""66"",""latitude"":""35.2506586"",""longitude"":""140.4033769"",""type_cd"":""1""}]; var icon; var info; var map = new GMaps({ div: '#map', lat: '35.2518501609806', lng: '140.405469023032', zoom: 15, }); map.addMarker({ title: '敷嶋丸', lat: '', lng: '', }); maplatlng.forEach(function( value ) { if(value.type_cd == 2){ icon = 'ship.png'; info = '出港場所'; }else if(value.type_cd == 3){ icon = 'parking.png'; info = '駐車場'; }else { icon = 'shop.png'; info = '敷嶋丸'; } map.addMarker({ title: '敷嶋丸', lat: value.latitude, lng: value.longitude, infoWindow: { content: ' ', }, icon: 'https://www.fishing-v.jp/choka/images/' + icon, //★アイコン指定 infoWindow: { content: ' '+ info +' ', }, clickable: true, }); }); } $(function(){ $('#map').css('height','0'); $('.btn-map').on('click', function () { $(this).css('display', 'none'); $('#map').css('height','400px'); initialize(); }); $('.closeIcon').hide(); $('.__lightBox').on('click', function(){ let src = $(this).find(""figure"").data('src'); console.log(src); let text = $(this).find('p').text(); let lightBox = $(' ').addClass(""lightBox""); $('body').append(lightBox); $('.lightBox').append(' '); $('.lightBox').append(' '); $('.lightBox').children('img').attr('src', src); $('.lightBox').children('p').text(text); $('.lightBoxBg').show(); $('.lightBox').show(); $('.closeIcon').show(); $('body').css('overflow', 'hidden'); }); $('.__close').on('click' , function(){ $('.lightBoxBg').hide(); $('.closeIcon').hide(); $('.lightBox').hide(function(){ $(this).remove(); }); $(this).hide(); $('body').css('overflow', 'auto'); }); });。",15℃,,釣りビジョン
敷嶋丸,大原港,2026/05/06,1,0,フグ,フグ,メイン,フグ,,4,19,11,0,18,35,,,,太東沖,,,1,6.0,6.0,15.5,15.5,,,,,,,,,,今シーズン最後のフグ釣りに出船致しました。。,15.5℃,,釣りビジョン
敷嶋丸,大原港,2026/05/08,1,0,キントキ,キントキ,メイン,キントキ,,0,2,1,0,35,40,,,,御宿沖,,,1,60.0,60.0,17.0,17.0,,,,,,,"ハタ,カサゴ,サバ",,,キントキ五目釣りに出ました。他にハタ・カサゴ・サバが釣れました。,17℃,,釣りビジョン
敷嶋丸,大原港,2026/05/09,1,0,イサキ,イサキ,メイン,イサキ,朝,7,44,25,0,23,32,,,,大原沖,,,1,15.0,15.0,15.0,15.0,,,,,,,,,,イサキ釣りに出船致しました。朝のうちはなかなか釣れませんでしたが、日中はポツポツ良く釣れました。,15℃,,釣りビジョン
敷嶋丸,大原港,2026/05/10,1,0,ヤリイカ,ヤリイカ,メイン,ヤリイカ,,7,29,18,0,25,45,,,,勝浦沖,,,1,160.0,160.0,18.0,18.0,,,,,,,,,,ヤリイカ釣りに出船しました。。,18℃,,釣りビジョン
敷嶋丸,大原港,2026/05/15,1,0,イサキ,イサキ,メイン,イサキ,,10,25,17,0,20,35,,,,太東沖,大原沖,,2,15.0,40.0,17.0,17.0,,,,,,,,,,イサキ&キントキリレー釣り。キントキは釣れなく、カサゴだけでした。,17℃,,釣りビジョン
新修丸,金沢八景,2026/05/02,1,0,アジ,アジ,サブ,ショートカサゴ,ショート,10,41,25,0,13,25,,,,本牧沖,,,1,20.0,20.0,,,,,,,,,アジも多数,,,中型主体に他にアジも多数。。,,,釣りビジョン
新修丸,金沢八景,2026/05/02,2,0,カサゴ,カサゴ,メイン,ショートカサゴ,ショート,7,37,22,0,,,,,,,,,1,,,,,,,,,,,,,,,,,釣りビジョン
新修丸,金沢八景,2026/05/09,1,0,カサゴ,カサゴ,メイン,ショートカサゴ,ショート,15,46,30,0,13,28,,,,猿島沖,,,1,20.0,20.0,,,,,,,,,メバルも,,,良型多数釣れ、他にメバルも。。,,,釣りビジョン
新修丸,金沢八景,2026/05/09,2,0,アカムツ,アカムツ,サブ,クロムツ,,2,9,5,0,28,36,,,,,,,1,,,,,,,,,,,,,,アカムツは本命6人型見ず。。,,,釣りビジョン
新修丸,金沢八景,2026/05/09,2,0,アカムツ,アカムツ,メイン,アカムツ,,,,,0,,,,,,,,,1,,,,,,,,,,,,,,アカムツは本命6人型見ず。。,,,釣りビジョン
新修丸,金沢八景,2026/05/10,1,0,カサゴ,カサゴ,メイン,ショートカサゴ,ショート,21,47,34,0,13,26,,,,猿島沖,,,1,20.0,35.0,,,,,,,,,,,,中型中心に2番手45匹。。,,,釣りビジョン
新修丸,金沢八景,2026/05/10,2,0,アカムツ,アカムツ,メイン,アカムツ,,1,1,1,0,32,32,,,,,,,1,,,,,,,,,,,クロムツも,,,他にクロムツも。。,,,釣りビジョン
新修丸,金沢八景,2026/05/12,1,0,カサゴ,カサゴ,メイン,ショートカサゴ,ショート,27,125,76,0,13,27,,,,猿島沖,,,1,20.0,35.0,,,,,,,,,,,,魚影濃く入れ喰いで2番手も120匹。。,,,釣りビジョン
新修丸,金沢八景,2026/05/15,1,0,カサゴ,カサゴ,メイン,ショートカサゴ,ショート,14,61,37,0,13,26,,,,猿島沖,,,1,20.0,35.0,,,,,,,,,,,,,,,釣りビジョン
新幸丸,大原港,2026/05/08,1,0,マダイ,マダイ,メイン,午前マダイ,午前,1,4,2,0,,,0.4,4.8,,岩船沖,,,1,35.0,65.0,,,,,,,,,"ハタ,カサゴ,ウマヅラハギ",,,乗っ込みマダイ復活絶好調!1kgクラスマダイ、中ダイ、大ダイ連発し、最大4.8kg絶好調!!他にハタ・カサゴ・ウマヅラハギ。。,,,釣りビジョン
新幸丸,大原港,2026/05/09,1,0,マダイ,マダイ,メイン,マダイ,朝,0,1,0,0,,,0.3,1.7,,岩船沖,,,1,35.0,62.0,,,,,,潮止まって,,,"ハタ,カサゴ,カンダイ",,,朝に流れ良くゲスト交じりながら中ダイキャッチ、後半は潮止まってしまった。他にハタ・カサゴ・カンダイ・アカイサキ・ウマヅラハギ。,,,釣りビジョン
新幸丸,大原港,2026/05/10,1,0,マダイ,マダイ,メイン,午前マダイ,午前,0,3,1,0,,,0.3,0.8,,岩船沖,,,1,28.0,58.0,,,,,,,,,"カサゴ,ハタ,オニカサゴ",,,潮全く流れず苦戦でした。他にカサゴ・ハタ・オニカサゴ・ウマヅラハギ。,,,釣りビジョン
新幸丸,大原港,2026/05/11,1,0,マダイ,マダイ,メイン,マダイ,,1,5,3,0,,,0.4,1.7,,岩船沖,,,1,40.0,60.0,,,,,,,,,"ハタ,カサゴ,アカイサキ",,,前半流れありゲスト交じり、1kgクラスに中ダイも入りました。大ダイクラスのバラシもあり残念でした。,,,釣りビジョン
新幸丸,大原港,2026/05/12,1,0,マダイ,マダイ,メイン,マダイ,,0,7,3,0,,,0.4,4.0,,岩船沖,,,1,37.0,62.0,,,,,,,,,"ハタ,カサゴ,ウマヅラハギ",,,乗っ込みマダイ好調!1kgクラス交じりながら中ダイ、大ダイ最大4kgキャッチ、ハタやカサゴのゲストも良く喰った。明日も楽しみ!他にハタ・カサゴ・ウマヅラハギ・サバ。,,,釣りビジョン
新幸丸,大原港,2026/05/13,1,0,マダイ,マダイ,メイン,午前マダイ,午前,0,5,2,0,,,0.3,3.7,,岩船沖,,,1,40.0,65.0,,,,,,,,,"ハタ,カサゴ",,,乗っ込みマダイ好調。朝方潮が激流(2.4～2.8ノット)と速かったが中ダイと大ダイキャッチ、後半も流れ良く良型マダイぽつぽつ喰った。,,,釣りビジョン
新幸丸,大原港,2026/05/13,1,0,マダイ,マダイ,サブ,ヒラマサ,朝,,,,0,,,7.0,7.0,,,,,1,,,,,,,,,,,"ハタ,カサゴ",,,乗っ込みマダイ好調。朝方潮が激流(2.4～2.8ノット)と速かったが中ダイと大ダイキャッチ、後半も流れ良く良型マダイぽつぽつ喰った。,,,釣りビジョン
新幸丸,大原港,2026/05/15,1,0,マダイ,マダイ,メイン,マダイ,,1,6,3,0,,,0.4,4.5,,大原沖,,,1,25.0,42.0,,,,,,,,,"カサゴ,ハタ,ウマヅラハギ",,,乗っ込みマダイ好調!マダイの型良く1kgクラス交じりながら中ダイ、大ダイ連発。バラシも多数あり残念でした。,,,釣りビジョン
日正丸,日立久慈港,2026/05/07,1,0,マダイ,マダイ,メイン,マダイ,,0,7,3,0,,,0.3,1.0,,,,,1,20.0,30.0,15.0,15.0,,,,,,,"ハナダイ,カサゴ,ソイ",,,本日もテンヤマダイ出船。浅場でマダイ釣れ始まりました!!大ダイ上がらずでしたがアタリ多く今後も期待大!他にハナダイ・カサゴ・ソイ・メバル・イナダ・マハタ・ヒラメ。,14～15℃,,釣りビジョン
日正丸,日立久慈港,2026/05/08,1,0,マダイ,マダイ,メイン,マダイ,,1,6,3,0,,,0.3,2.2,,,,,1,20.0,30.0,15.0,15.0,,,,,,,"ハナダイ,カサゴ,ソイ",,,本日もテンヤマダイ出船。オデコなし最大2.2kg、1.5kgゲット!!浅場でマダイ釣れ始まりました!!今後も期待大!他にハナダイ・カサゴ・ソイ・メバル・イナダ・マハタ・ヒラメ・アイナメ。,14～15℃,,釣りビジョン
日正丸,日立久慈港,2026/05/10,1,0,マダイ,マダイ,メイン,マダイ,,1,3,2,0,,,0.3,1.0,,,,,1,10.0,30.0,15.0,15.0,,,,,,,"ハナダイ,カサゴ,ソイ",,,本日テンヤマダイ出船。オデコなし最大1kg!浅場でマダイ釣れ始まりました!!今後も期待大!他にハナダイ・カサゴ・ソイ・メバル・イナダ・マハタ・ヒラメ・クロダイ。,14～15℃,,釣りビジョン
日正丸,日立久慈港,2026/05/11,1,0,マダイ,マダイ,メイン,マダイ,,0,3,1,0,,,0.3,0.7,,,,,1,10.0,30.0,15.0,15.0,,,,,,,"ハナダイ,カサゴ,イナダ",,,本日もテンヤマダイ出船。団体様ご利用ありがとうございました。,14～15℃,,釣りビジョン
日正丸,日立久慈港,2026/05/12,1,0,マダイ,マダイ,メイン,マダイ,,0,5,2,0,,,0.3,1.0,,,,,1,10.0,30.0,15.0,15.0,,,,,,,"ハナダイ,カサゴ,イナダ",,,本日テンヤマダイ出船。他にハナダイ・カサゴ・イナダ・ホウボウ。,14～15℃,,釣りビジョン
日正丸,日立久慈港,2026/05/13,1,0,マダイ,マダイ,メイン,マダイ,,3,7,5,0,,,0.3,1.5,,,,,1,10.0,30.0,15.0,15.0,,,,,,,"ハナダイ,カサゴ,イナダ",,,本日テンヤマダイ出船。オデコなし頭7匹!最大1.5kg、1kgゲット!他にハナダイ・カサゴ・イナダ・ホウボウ・メバル。,14～15℃,,釣りビジョン
日正丸,日立久慈港,2026/05/14,1,0,マダイ,マダイ,メイン,マダイ,,0,4,2,0,,,0.3,3.2,,,,,1,10.0,30.0,15.0,15.0,,,強,,,,"ハナダイ,カサゴ,イナダ",,,本日テンヤマダイ出船。最大3.2kg、1.2kg、1kgゲット!風強くなった為、早上がりでした。,14～15℃,,釣りビジョン
明広丸,御宿岩和田港,2026/05/06,1,0,マハタ,マハタ,メイン,マハタ,午前,0,4,2,1,,,0.7,3.4,,興津沖,岩和田沖航程18,30分,3,20.0,50.0,,,,,,,,,"カンパチ,ハチカサゴ,カサゴ",,,午前船の釣果。今日も朝からアジ釣り、岩和田海水浴場沖から反応少なく喰い渋く御宿港沖に移動して、アジの反応濃くあり、ポツポツと釣れました。,,,釣りビジョン
明広丸,御宿岩和田港,2026/05/06,1,0,マハタ,マハタ,サブ,ヒラメ,午前,1,1,1,1,,,4.2,4.2,,御宿港沖,,,1,,,,,,,,,,,"カンパチ,ハチカサゴ,カサゴ",,,午前船の釣果。今日も朝からアジ釣り、岩和田海水浴場沖から反応少なく喰い渋く御宿港沖に移動して、アジの反応濃くあり、ポツポツと釣れました。,,,釣りビジョン
明広丸,御宿岩和田港,2026/05/07,1,0,マハタ,マハタ,メイン,マハタ,午前,3,3,3,0,,,1.2,3.6,,勝浦灯台沖,岩和田沖航程18,20分,3,20.0,40.0,18.4,18.4,,,,,,,"カサゴ,マアジ,小サバ",,,午前船の釣果。今日も朝からアジ釣り、岩和田海水浴場沖から反応非常に濃くあるが、イワシが邪魔してアジはポツンポツンと交じる程度。,17.2～18.4℃,,釣りビジョン
明広丸,御宿岩和田港,2026/05/09,1,0,マハタ,マハタ,メイン,マハタ,午前,2,3,2,1,,,0.8,2.7,,勝浦灯台沖,岩和田沖航程18,20分,3,20.0,40.0,17.1,17.1,,,,,,,"ヒラメ,ヒラスズキ,ヒラマサ",,,午前船の釣果。今日も朝からアジ釣り、岩和田港沖からイワシの反応非常に濃くあり、イワシが邪魔して、アジはポツンポツンと交じる程度。,15.8～17.1℃,,釣りビジョン
明広丸,御宿岩和田港,2026/05/10,1,0,マハタ,マハタ,メイン,マハタ,午前,0,3,1,1,,,0.7,1.3,,岩和田沖航程18,20分,,2,20.0,50.0,16.7,16.7,,,,,,,"キジハタ,ハチカサゴ,カサゴ",,,午前船の釣果。今日も朝からアジ釣り、岩和田港沖からアジの型は良かったが喰い渋くポツンポツン。,15.6～16.7℃,,釣りビジョン
明広丸,御宿岩和田港,2026/05/10,1,0,マハタ,マハタ,サブ,ヒラメ,午前,2,2,2,1,,,,,,岩和田沖,,,1,,,16.7,16.7,,,,,,,"キジハタ,ハチカサゴ,カサゴ",,,午前船の釣果。今日も朝からアジ釣り、岩和田港沖からアジの型は良かったが喰い渋くポツンポツン。,15.6～16.7℃,,釣りビジョン
明広丸,御宿岩和田港,2026/05/11,1,0,マハタ,マハタ,メイン,マハタ,午前,0,1,0,1,,,0.8,3.8,,岩和田沖,勝浦灯台沖航程18,20分,3,20.0,50.0,18.7,18.7,,,,,,,"マトウダイ,マアジ,小サバ",,,午前船の釣果。今日も朝からアジ釣り、岩和田港沖からアジの型も良くポツリポツリと釣れました。,15.9～18.7℃,,釣りビジョン
明広丸,御宿岩和田港,2026/05/11,1,0,マハタ,マハタ,サブ,ヒラマサ,午前,,,,0,,,3.7,3.7,,岩和田沖,,,1,,,18.7,18.7,,,,,,,"マトウダイ,マアジ,小サバ",,,午前船の釣果。今日も朝からアジ釣り、岩和田港沖からアジの型も良くポツリポツリと釣れました。,15.9～18.7℃,,釣りビジョン
明広丸,御宿岩和田港,2026/05/11,1,0,マハタ,マハタ,サブ,クエ,午前,,,,0,,,2.8,2.8,,岩和田沖,,,1,,,18.7,18.7,,,,,,,"マトウダイ,マアジ,小サバ",,,午前船の釣果。今日も朝からアジ釣り、岩和田港沖からアジの型も良くポツリポツリと釣れました。,15.9～18.7℃,,釣りビジョン
明広丸,御宿岩和田港,2026/05/11,1,0,マハタ,マハタ,サブ,メダイ,午前,,,,0,,,4.0,4.0,,岩和田沖,,,1,,,18.7,18.7,,,,,,,"マトウダイ,マアジ,小サバ",,,午前船の釣果。今日も朝からアジ釣り、岩和田港沖からアジの型も良くポツリポツリと釣れました。,15.9～18.7℃,,釣りビジョン
明広丸,御宿岩和田港,2026/05/11,1,0,マハタ,マハタ,サブ,ハチカサゴ,午前,4,4,4,1,,,,,,岩和田沖,,,1,,,18.7,18.7,,,,,,,"マトウダイ,マアジ,小サバ",,,午前船の釣果。今日も朝からアジ釣り、岩和田港沖からアジの型も良くポツリポツリと釣れました。,15.9～18.7℃,,釣りビジョン
明広丸,御宿岩和田港,2026/05/12,1,0,マハタ,マハタ,メイン,マハタ,午前,0,2,1,1,,,0.6,2.2,,岩和田沖,勝浦灯台沖航程18,20分,3,20.0,50.0,18.8,18.8,,,,潮が速,,,"ヒラメ,カサゴ,マアジ",,,午前船の釣果。今日も朝からアジ釣り、岩和田港沖からアジの型は良いが反応少なく喰い渋く苦戦。,15.7～18.8℃,,釣りビジョン
明広丸,御宿岩和田港,2026/05/14,1,0,マハタ,マハタ,メイン,マハタ,午前,0,1,0,1,,,0.5,1.8,,岩和田沖,行川沖航程20,30分,3,20.0,50.0,18.4,18.4,,,,"潮が速,潮緩",,,"ヒラメ,ワラサ,マアジ",,,午前船の釣果。今日も朝からアジ釣り。,17.6～18.4℃,,釣りビジョン
明広丸,御宿岩和田港,2026/05/14,1,0,マハタ,マハタ,サブ,ヒラメ,午前,1,1,1,1,,,,,,興津沖,,,1,,,18.4,18.4,,,,"潮が速,潮緩",,,"ヒラメ,ワラサ,マアジ",,,午前船の釣果。今日も朝からアジ釣り。,17.6～18.4℃,,釣りビジョン
明広丸,御宿岩和田港,2026/05/16,1,0,マハタ,マハタ,メイン,マハタ,午前,0,1,0,1,,,0.5,2.1,,岩和田沖,大沢港沖航程20,30分,3,25.0,50.0,21.9,21.9,,,,潮が速,,,"ワラサ,マトウダイ,マアジ",,,午前船の釣果。今日も朝からアジ釣り、岩和田港沖からアジの反応少なく喰わず大苦戦。,20.6～21.9℃,,釣りビジョン
明広丸,御宿岩和田港,2026/05/16,1,0,マハタ,マハタ,サブ,ヒラメ,午前,3,3,3,1,,,,,,興津沖,,,1,,,21.9,21.9,,,,潮が速,,,"ワラサ,マトウダイ,マアジ",,,午前船の釣果。今日も朝からアジ釣り、岩和田港沖からアジの反応少なく喰わず大苦戦。,20.6～21.9℃,,釣りビジョン
明進丸,日立久慈港,2026/05/06,1,0,メバル,メバル,メイン,メバル,,15,30,22,0,23,38,,,エサ,,,,1,,,,,,,,,,,"ムシガレイ,カサゴ,ワラサ",,,本日は中深場五目にて出船しました。今日は沖は水色も良く、1投目から超大型沖メバルが好調で、4点掛け、5点掛け、6点掛けなども有りました。,,,釣りビジョン
明進丸,日立久慈港,2026/05/07,1,0,アマダイ,アマダイ,メイン,アマダイ,,2,6,4,0,30,43,,,エサ,,,,1,,,,,,,,,,,"ブリサイズ,サバ,ムシガレイ",,,本日は大アマダイにて出船しました。今日は先日まで大アマダイが好調に釣れたポイントへ。,,,釣りビジョン
春盛丸,長井漆山港,2026/05/07,1,0,マルイカ,マルイカ,メイン,マルイカ,,5,32,18,0,15,35,,,,,,,1,,,,,,,,,,,日中スルメイカも交じって釣れました,,,他に日中スルメイカも交じって釣れました。。,,,釣りビジョン
春盛丸,長井漆山港,2026/05/09,1,0,マルイカ,マルイカ,メイン,マルイカ,,2,30,16,0,13,30,,,,,,,1,,,,,,,,,,,,,,日中、良型も交じって釣れました。。,,,釣りビジョン
