ship,area,date,trip_no,is_cancellation,tsuri_mono_raw,tsuri_mono,main_sub,fish_raw,time_slot,cnt_min,cnt_max,cnt_avg,is_boat,size_min,size_max,kg_min,kg_max,tackle,point_place1,point_place2,point_place3,n_points_visited,depth_min,depth_max,water_temp_min,water_temp_max,water_color,wind_direction,wind_speed,tide_info,wave_info,weather,by_catch,cancel_reason,cancel_type,kanso_raw,suion_raw,suishoku_raw,source
大洗丸,大洗港,2026/05/07,1,0,タイ五目,タイ五目,メイン,トラフグ,,,,,0,,,,,,,,,1,,,,,,,,,,,,,,テンヤマダイ五目釣り・4人の釣果。釣人竿操作上手く、マダイはじめイナダ・ホウボウ・カサゴ・トラフグ・サバ・フグ・マガレイ等、五目で釣れる。,,,釣りビジョン
大洗丸,大洗港,2026/05/07,1,0,タイ五目,タイ五目,メイン,サバ,,,,,0,,,,,,,,,1,,,,,,,,,,,,,,テンヤマダイ五目釣り・4人の釣果。釣人竿操作上手く、マダイはじめイナダ・ホウボウ・カサゴ・トラフグ・サバ・フグ・マガレイ等、五目で釣れる。,,,釣りビジョン
大洗丸,大洗港,2026/05/07,1,0,タイ五目,タイ五目,メイン,フグ,,,,,0,,,,,,,,,1,,,,,,,,,,,,,,テンヤマダイ五目釣り・4人の釣果。釣人竿操作上手く、マダイはじめイナダ・ホウボウ・カサゴ・トラフグ・サバ・フグ・マガレイ等、五目で釣れる。,,,釣りビジョン
大洗丸,大洗港,2026/05/08,1,0,マダイ,マダイ,メイン,マダイ,,1,6,3,0,,,0.3,2.8,,,,,1,,,,,,,,,,,"ホウボウ,カサアゴ,サバ",,,テンヤマダイ。2.8kgのマダイはじめ上げる。,,,釣りビジョン
大洗丸,大洗港,2026/05/09,1,0,マダイ,マダイ,メイン,マダイ,,3,9,6,0,,,0.5,1.8,,,,,1,,,,,,,,,,,"大トラフグ,ホウボウ",,,テンヤマダイ・4人の釣果。マダイを狙う。,,,釣りビジョン
大洗丸,大洗港,2026/05/16,1,0,マダイ,マダイ,メイン,マダイ,,0,8,4,0,,,0.4,2.3,,,,,1,,,,,,,,,,,"トラフグ,マガレイ,ホウボウ",,,テンヤマダイ。マダイを攻める。,,,釣りビジョン
大貫丸,日立久慈港,2026/05/07,1,0,マダイ,マダイ,メイン,マダイ,,0,6,3,0,,,0.3,2.2,,,,,1,,,,,,,,,,,"ハナダイ,カサゴ,メバル",,,テンヤマダイ船。2.2kg、1.2kgヒット!!良型交じり良い人5～6匹でした!小学生の女の子が2.2kg、1.2kg含み4匹でした!他にハナダイ・カサゴ・メバル・ソイ・ホウボウ・イナダ・ショウサイフグ等!。,,,釣りビジョン
大貫丸,日立久慈港,2026/05/07,2,0,キンメダイ,キンメダイ,メイン,ムラソイ,,0,2,1,0,30,35,,,,,,,1,,,,,,,,,,,"マハタ,カサゴ,アジ等!",,,ムラソイ船。ムラソイ35cm含み良い人2匹。,,,釣りビジョン
大貫丸,日立久慈港,2026/05/07,2,0,キンメダイ,キンメダイ,サブ,クロメバル,,0,4,2,0,28,33,,,,,,,1,,,,,,,,,,,"マハタ,カサゴ,アジ等!",,,ムラソイ船。ムラソイ35cm含み良い人2匹。,,,釣りビジョン
大貫丸,日立久慈港,2026/05/09,1,0,マダイ,マダイ,メイン,マダイ,,0,7,3,0,,,0.3,1.9,,,,,1,,,,,,,,,,,"ヒラメ,アイナメ,ウマヅラハギ",,,テンヤマダイ船。1.9kgを最大に良型交じり良い人5～7匹でした!!他にヒラメ・アイナメ・ウマヅラハギ・ハナダイ・カサゴ・メバル・ソイ・マハタ・イナダ・ショウサイフグ等!。,,,釣りビジョン
大貫丸,日立久慈港,2026/05/09,2,0,キンメダイ,キンメダイ,メイン,ムラソイ,,0,2,1,0,20,35,,,,,,,1,,,,,,,,,,,"クロメバル,カサゴ,アイナメ等!",,,ムラソイ船。前半アジ狙い、活性高く良型多数交じり良い人100匹超え!後半ムラソイ狙い、大型交じり良い人2匹でした!!他にクロメバル・カサゴ・アイナメ等!。,,,釣りビジョン
大貫丸,日立久慈港,2026/05/09,2,0,キンメダイ,キンメダイ,サブ,アジ,,15,130,72,0,20,33,,,,,,,1,,,,,,,,,,,"クロメバル,カサゴ,アイナメ等!",,,ムラソイ船。前半アジ狙い、活性高く良型多数交じり良い人100匹超え!後半ムラソイ狙い、大型交じり良い人2匹でした!!他にクロメバル・カサゴ・アイナメ等!。,,,釣りビジョン
大貫丸,日立久慈港,2026/05/10,1,0,マダイ,マダイ,メイン,マダイ,,0,4,2,0,,,0.3,1.0,,,,,1,,,,,,,,,,,"ハナダイ,カサゴ,ソイ",,,テンヤマダイ船。1kgを最大に良い人3～4匹でした!!他にハナダイ・カサゴ・ソイ・マハタ・ホウボウ・イナダ・ショウサイフグ等!。,,,釣りビジョン
大貫丸,日立久慈港,2026/05/11,1,0,マダイ,マダイ,メイン,マダイ,,0,9,4,0,,,0.3,0.8,,,,,1,,,,,,,,,,,"ヒラメ,ハナダイ,カサゴ",,,テンヤマダイ船。0.8kg含み良い人9匹でした!!他にヒラメ・ハナダイ・カサゴ・メバル・ソイ・マハタ・ホウボウ・イナダ・ショウサイフグ等!。,,,釣りビジョン
大貫丸,日立久慈港,2026/05/11,2,0,キンメダイ,キンメダイ,サブ,アジ,,25,35,30,0,20,32,,,,,,,1,,,,,,,,,,,クロメバル等!,,,根魚五目船。前半アジ狙い、30cm級多数交じり良い人30匹超え!後半根魚狙い、カサゴ、他にクロメバル等!。,,,釣りビジョン
大貫丸,日立久慈港,2026/05/11,2,0,キンメダイ,キンメダイ,サブ,カサゴ,,13,15,14,0,23,30,,,,,,,1,,,,,,,,,,,クロメバル等!,,,根魚五目船。前半アジ狙い、30cm級多数交じり良い人30匹超え!後半根魚狙い、カサゴ、他にクロメバル等!。,,,釣りビジョン
大貫丸,日立久慈港,2026/05/12,1,0,マダイ,マダイ,メイン,マダイ,,3,6,4,0,,,0.3,1.6,,,,,1,,,,,,,,,,,"ヒラメ,ハナダイ,カサゴ",,,テンヤマダイ船。1.6kgを最大に、良型交じり良い人5～6匹でした!他にヒラメ・ハナダイ・カサゴ・メバル・ソイ・イナダ・ショウサイフグ等!。,,,釣りビジョン
大貫丸,日立久慈港,2026/05/12,2,0,アジ,アジ,メイン,アジ,,6,44,25,0,20,38,,,,,,,1,,,,,,,,,,,,,,アジ五目船。前半アジ狙い、30cm級多数交じり良い人40匹超え!後半ムラソイ狙いましたが、活性低く苦戦でした。,,,釣りビジョン
大貫丸,日立久慈港,2026/05/13,1,0,マダイ,マダイ,メイン,マダイ,,0,6,3,0,,,0.3,1.0,,,,,1,,,,,,,,,,,"ヒラメ,ハナダイ,カサゴ",,,テンヤマダイ船。1kgを最大に良い人6匹でした!!他にヒラメ・ハナダイ・カサゴ・メバル・ウマヅラハギ・ホウボウ・イナダ・ショウサイフグ等!。,,,釣りビジョン
大貫丸,日立久慈港,2026/05/13,2,0,アジ,アジ,メイン,アジ,,60,110,85,0,18,35,,,,,,,1,,,,,,,,,,,"クロメバル,カサゴ,ソイ等!",,,アジ五目船。前半アジ狙い、30cm級多数交じり良い人100匹超え!後半根魚狙い、他にクロメバル・カサゴ・ソイ等!。,,,釣りビジョン
大貫丸,日立久慈港,2026/05/14,1,0,マダイ,マダイ,メイン,マダイ,,0,3,1,0,,,0.3,3.0,,,,,1,,,,,,,,,,,,,,テンヤマダイ船。大ダイ3kgヒット!!良型交じり良い人2～3匹でした!!。,,,釣りビジョン
大貫丸,日立久慈港,2026/05/16,1,0,マダイ,マダイ,メイン,マダイ,,0,2,1,0,,,0.3,1.9,,,,,1,,,,,,,,,,,"ハナダイ,カサゴ,メバル",,,テンヤマダイ船。1.9kgを最大に良い人2匹でした!!他にハナダイ・カサゴ・メバル・ソイ・マハタ・ウマヅラハギ・アイナメ・イナダ等!。,,,釣りビジョン
大貫丸,日立久慈港,2026/05/16,2,0,キンメダイ,キンメダイ,サブ,カサゴ,,3,14,8,0,23,38,,,,,,,1,,,,,,,,,,,,,,根魚五目船。前半アジ狙いましたが苦戦。,,,釣りビジョン
太幸丸,飯岡港,2026/05/06,1,0,コマセ五目,コマセ五目,メイン,ハナダイ,,13,24,18,0,20,33,,,,,,,1,,,,,,,,,,,,,,コマセ五目。。,,,釣りビジョン
太幸丸,飯岡港,2026/05/08,1,0,コマセ五目,コマセ五目,メイン,アジ,,15,38,26,0,30,45,,,,,,,1,,,,,,,,,,,,,,コマセ五目。ジャンボアジが良く釣れました!!ハナダイはチラホラくらいでしたね。,,,釣りビジョン
太幸丸,飯岡港,2026/05/08,1,0,コマセ五目,コマセ五目,メイン,ハナダイ,,2,12,7,0,20,30,,,,,,,1,,,,,,,,,,,,,,コマセ五目。ジャンボアジが良く釣れました!!ハナダイはチラホラくらいでしたね。,,,釣りビジョン
太幸丸,飯岡港,2026/05/09,1,0,コマセ五目,コマセ五目,メイン,アジ,,8,34,21,0,30,45,,,,,,,1,,,,,,,,,,,"ハナダイ,イサキ",,,コマセ五目。ジャンボアジ好調です!初挑戦の方もたくさん釣りましたよ!他にハナダイ・イサキが釣れました。,,,釣りビジョン
太幸丸,飯岡港,2026/05/10,1,0,コマセ五目,コマセ五目,メイン,アジ,,3,25,14,0,30,45,,,,,,,1,,,,,,,,,,,"ハナダイ,マダイ,イサキ",,,コマセ五目。コマセ釣りでジャンボアジ釣りです。,,,釣りビジョン
太幸丸,飯岡港,2026/05/11,1,0,コマセ五目,コマセ五目,メイン,アジ,,15,32,23,0,30,45,,,,,,,1,,,,,,,,,,,"カイワリ,ホウボウ,ウマヅラハギ",,,コマセ五目。コマセ釣りでジャンボアジ釣り好調!!他にカイワリ・ホウボウ・ウマヅラハギ・カサゴ・メバル・サバが釣れました!!。,,,釣りビジョン
太幸丸,飯岡港,2026/05/11,1,0,コマセ五目,コマセ五目,メイン,ハナダイ,,3,15,9,0,20,32,,,,,,,1,,,,,,,,,,,"カイワリ,ホウボウ,ウマヅラハギ",,,コマセ五目。コマセ釣りでジャンボアジ釣り好調!!他にカイワリ・ホウボウ・ウマヅラハギ・カサゴ・メバル・サバが釣れました!!。,,,釣りビジョン
太幸丸,飯岡港,2026/05/14,1,0,コマセ五目,コマセ五目,メイン,アジ,,8,40,24,0,25,45,,,,,,,1,,,,,,,,,,,"カサゴ,メバル,ニベ",,,コマセ五目。コマセ釣りでアジ狙いです!他にカサゴ・メバル・ニベ・サバが釣れました。,,,釣りビジョン
太幸丸,飯岡港,2026/05/15,1,0,コマセ五目,コマセ五目,メイン,アジ,,10,28,19,0,35,45,,,,,,,1,,,,,,,,,,,"ハナダイ,カサゴ,メバル",,,コマセ五目。コマセ釣りでジャンボアジ狙いです!!他にハナダイ・カサゴ・メバル・ウマヅラハギ・サバが釣れました!。,,,釣りビジョン
太郎丸,小坪港,2026/05/06,1,0,,,メイン,五目,,10,30,20,0,25,40,,,,沖ノ瀬,,,1,80.0,110.0,18.0,18.0,,,,,,,,,,日中船・沖ノ瀬コマセウィリー五目船の釣果。五目は沖メバル・レンコダイ・クロムツ・ハチビキ・オニカサゴ・アカイサキ・カンコ・キツネダイ・ウマヅラハギ等。,18℃,,釣りビジョン
太郎丸,小坪港,2026/05/08,1,0,キンメダイ,キンメダイ,メイン,キンメダイ,朝,5,12,8,0,28,38,,,,沖ノ瀬,,,1,300.0,400.0,18.0,18.0,,,強,,,,クロムツ交じり,,,日中船の釣果。朝イチよりキンメダイ多数掛けでも上がり、クロムツ交じりで上がりました。,18℃,,釣りビジョン
太郎丸,小坪港,2026/05/09,1,0,キンメダイ,キンメダイ,メイン,キンメダイ,,2,10,6,0,28,43,,,,沖ノ瀬,,,1,330.0,420.0,18.0,18.0,,,,,ウネリ,,メダイ交じり,,,日中船の釣果。ウネリ残り前半釣りにくかったのですが1日通してポツポツのアタリお土産はキープ。,18℃,,釣りビジョン
太郎丸,小坪港,2026/05/09,1,0,キンメダイ,キンメダイ,メイン,クロムツ,,0,3,1,0,30,40,,,,,,,1,,,18.0,18.0,,,,,ウネリ,,メダイ交じり,,,日中船の釣果。ウネリ残り前半釣りにくかったのですが1日通してポツポツのアタリお土産はキープ。,18℃,,釣りビジョン
太郎丸,小坪港,2026/05/10,1,0,キンメダイ,キンメダイ,メイン,キンメダイ,,1,11,6,0,28,38,,,,沖ノ瀬,,,1,250.0,450.0,18.0,18.0,濁り,,,,,,"サバ,ハチビキ",,,日中船の釣果。前半キンメダイポツリポツリと上がり、後半クロムツ・メダイ・ハチビキ多点掛けアタリ良くクーラー満タンでした。,18℃,濁る,釣りビジョン
太郎丸,小坪港,2026/05/10,1,0,キンメダイ,キンメダイ,メイン,クロムツ,,6,15,10,0,30,40,,,,,,,1,,,18.0,18.0,濁り,,,,,,"サバ,ハチビキ",,,日中船の釣果。前半キンメダイポツリポツリと上がり、後半クロムツ・メダイ・ハチビキ多点掛けアタリ良くクーラー満タンでした。,18℃,濁る,釣りビジョン
太郎丸,小坪港,2026/05/10,1,0,キンメダイ,キンメダイ,メイン,メダイ,,1,8,4,0,,,1.0,2.0,,,,,1,,,18.0,18.0,濁り,,,,,,"サバ,ハチビキ",,,日中船の釣果。前半キンメダイポツリポツリと上がり、後半クロムツ・メダイ・ハチビキ多点掛けアタリ良くクーラー満タンでした。,18℃,濁る,釣りビジョン
太郎丸,小坪港,2026/05/12,1,0,キンメダイ,キンメダイ,メイン,キンメダイ,,2,7,4,0,30,38,,,,沖ノ瀬,,,1,300.0,400.0,18.0,18.0,濁り,,,,,,,,,日中船の釣果。ナギ良く釣り日和で、反応見られるも底潮冷たく数伸びず。,18℃,濁る,釣りビジョン
太郎丸,小坪港,2026/05/12,1,0,キンメダイ,キンメダイ,メイン,クロムツ,,0,3,1,0,34,43,,,,,,,1,,,18.0,18.0,濁り,,,,,,,,,日中船の釣果。ナギ良く釣り日和で、反応見られるも底潮冷たく数伸びず。,18℃,濁る,釣りビジョン
太郎丸,小坪港,2026/05/13,1,0,,,メイン,五目,,6,15,10,0,25,40,,,,沖ノ瀬,,,1,80.0,100.0,18.0,18.0,濁り,,,,,,,,,日中船の釣果。五目は沖メバル・クロムツ・レンコダイ・ヒシダイ・アカイサキ・オアカムロアジ・ウマヅラハギ。,18℃,濁る,釣りビジョン
太郎丸,小坪港,2026/05/14,1,0,キンメダイ,キンメダイ,メイン,キンメダイ,,0,4,2,0,28,43,,,,沖ノ瀬,,,1,300.0,450.0,18.0,18.0,濁り,,,,,,"メダイ,スミヤキ交じり",,,日中船の釣果。反応見られるも底潮冷たく口使わず数伸びず苦戦しました。,18℃,濁る,釣りビジョン
太郎丸,小坪港,2026/05/14,1,0,キンメダイ,キンメダイ,メイン,クロムツ,,0,3,1,0,30,40,,,,,,,1,,,18.0,18.0,濁り,,,,,,"メダイ,スミヤキ交じり",,,日中船の釣果。反応見られるも底潮冷たく口使わず数伸びず苦戦しました。,18℃,濁る,釣りビジョン
太郎丸,小坪港,2026/05/15,1,0,キンメダイ,キンメダイ,メイン,キンメダイ,,4,7,5,0,28,43,,,,沖ノ瀬,,,1,250.0,400.0,18.0,18.0,濁り,,,,,,"メダイ,スミヤキ,サバ等交じり",,,日中船の釣果。浅場にてキンメダイ良型交じりでクロムツ、他にメダイ・スミヤキ・サバ等交じり、お土産キープ出来ました。,18℃,濁る,釣りビジョン
太郎丸,小坪港,2026/05/15,1,0,キンメダイ,キンメダイ,メイン,クロムツ,,1,6,3,0,30,40,,,,,,,1,,,18.0,18.0,濁り,,,,,,"メダイ,スミヤキ,サバ等交じり",,,日中船の釣果。浅場にてキンメダイ良型交じりでクロムツ、他にメダイ・スミヤキ・サバ等交じり、お土産キープ出来ました。,18℃,濁る,釣りビジョン
孝徳丸,片貝港,2026/05/03,1,0,イサキ,イサキ,メイン,イサキ,,1,5,3,0,28,35,,,,片貝沖,,,1,,,,,,,,,,,"クロメバル,カサゴ,ウマヅラハギ",,,今日もイサキ・ハナダイリレー釣りで出船。始めのイサキは潮の流れが速く1.2ノット流れていて釣果伸びず苦戦、早めに片貝沖に移動してハナダイやクロメバルなどを釣ってお土産にして帰港しました。,,,釣りビジョン
孝徳丸,片貝港,2026/05/03,1,0,イサキ,イサキ,サブ,ハナダイ,,5,16,10,0,25,34,,,,片貝沖,,,1,,,,,,,,,,,"クロメバル,カサゴ,ウマヅラハギ",,,今日もイサキ・ハナダイリレー釣りで出船。始めのイサキは潮の流れが速く1.2ノット流れていて釣果伸びず苦戦、早めに片貝沖に移動してハナダイやクロメバルなどを釣ってお土産にして帰港しました。,,,釣りビジョン
孝徳丸,片貝港,2026/05/05,1,0,イサキ,イサキ,メイン,イサキ,朝,5,29,17,0,27,35,,,,片貝沖,,,1,,,,,,,,,,,"クロメバル,カサゴ,カイワリ",,,今日もイサキ・ハナダイリレー釣りで出船。朝一のイサキは昨日とは違い、ある程度は反応に乗ってられて交じりですがポツリポツリ釣れていて8時半頃までで竿頭29匹。,,,釣りビジョン
孝徳丸,片貝港,2026/05/05,1,0,イサキ,イサキ,サブ,ハナダイ,朝,3,30,16,0,24,36,,,,片貝沖,,,1,,,,,,,,,,,"クロメバル,カサゴ,カイワリ",,,今日もイサキ・ハナダイリレー釣りで出船。朝一のイサキは昨日とは違い、ある程度は反応に乗ってられて交じりですがポツリポツリ釣れていて8時半頃までで竿頭29匹。,,,釣りビジョン
孝徳丸,片貝港,2026/05/09,1,0,イサキ,イサキ,メイン,イサキ,,2,16,9,0,25,36,,,,片貝沖,,,1,,,,,,,,,,,"メバル,カサゴ,カイワリ",,,今日もイサキ・ハナダイリレー釣りで出船、ポイントに着いて水温が低いのに気づき反応は有るのですがその割には食いがいまいちで転々と移動、8時頃まで頑張って頂きその後片貝沖に移動してハナダイを時間までやってお土産にして帰港。他にメバル・カサゴ・カイワリ・メジナ。,,,釣りビジョン
孝徳丸,片貝港,2026/05/09,1,0,イサキ,イサキ,サブ,ハナダイ,,4,15,9,0,23,34,,,,片貝沖,,,1,,,,,,,,,,,"メバル,カサゴ,カイワリ",,,今日もイサキ・ハナダイリレー釣りで出船、ポイントに着いて水温が低いのに気づき反応は有るのですがその割には食いがいまいちで転々と移動、8時頃まで頑張って頂きその後片貝沖に移動してハナダイを時間までやってお土産にして帰港。他にメバル・カサゴ・カイワリ・メジナ。,,,釣りビジョン
孝徳丸,片貝港,2026/05/16,1,0,イサキ,イサキ,メイン,イサキ,,7,30,18,0,25,33,,,,,,,1,,,,,,,,,,,"アジ,ウマヅラハギ,ハタ",,,今日もイサキ・ハナダイリレー釣りで出船で、イサキが釣れ出すのが遅く、ナダのハナダイもあまり良くないような感じでしたので、終了時間までイサキをやって頂きお土産にして帰港。他にアジ・ウマヅラハギ・ハタ。,,,釣りビジョン
宮田丸,日立久慈港,2026/05/02,1,0,マダイ,マダイ,メイン,マダイ,,1,7,4,0,,,0.1,1.2,,,,,1,,,,,,,,,,,"イナダ,カサゴ,ハナダイ",,,テンヤマダイ。今日は大型マダイ上がりませんでしたが、マダイ、ゲストともにアタリが多かったようでした。,,,釣りビジョン
宮田丸,日立久慈港,2026/05/03,1,0,マダイ,マダイ,メイン,マダイ,,0,6,3,0,,,0.1,1.2,,,,,1,,,,,,,,,,,"イナダ,カサゴ,ハナダイ",,,テンヤマダイ。今日は前半潮の流れ悪く、マダイのアタリ今一つ。,,,釣りビジョン
宮田丸,日立久慈港,2026/05/06,1,0,マダイ,マダイ,メイン,マダイ,,0,5,2,0,,,0.1,1.0,,,,,1,,,,,,,,,,,"マゾイ,メバル,カサゴ",,,テンヤマダイ。今日は根魚のアタリ圧倒的に多かったものの、良型マダイのアタリ少なく感じました。,,,釣りビジョン
宮田丸,日立久慈港,2026/05/09,1,0,マダイ,マダイ,メイン,マダイ,,2,12,7,0,,,0.1,2.8,,,,,1,,,,,,,,,,,"マゾイ,メバル,カサゴ",,,テンヤマダイ。今日は潮流れ、マダイ、青物、根魚アタリ良く好釣果でした。,,,釣りビジョン
宮田丸,日立久慈港,2026/05/10,1,0,マダイ,マダイ,メイン,マダイ,,0,10,5,0,,,0.1,1.2,,,,,1,,,,,,,,,,,"イナダ,マゾイ,メバル",,,テンヤマダイ。今日は大型マダイ出ませんでしたが、マダイ、青物、根魚アタリ良くソコソコの釣果でした。,,,釣りビジョン
宮田丸,日立久慈港,2026/05/16,1,0,マダイ,マダイ,メイン,マダイ,,0,3,1,0,,,0.2,2.8,,,,,1,,,,,,,,,,,"ワラサ,イナダ,ムシガレイ",,,テンヤマダイ。今日は潮の流れ、マダイのアタリ共に今ひとつでした。,,,釣りビジョン
小柴丸,金沢八景,2026/05/08,1,0,シロギス,シロギス,メイン,シロギス,,6,28,17,0,17,26,,,,中ノ瀬,,,1,,,,,,,,,,,"カサゴ,アジ,カナガシラ交じる",,,中ノ瀬で良型揃い。他にカサゴ・アジ・カナガシラ交じる。,,,釣りビジョン
小柴丸,金沢八景,2026/05/08,2,0,イシモチ,イシモチ,メイン,イシモチ,,2,10,6,0,24,36,,,,富岡沖,,,1,20.0,20.0,,,,,,,,,"シロギス,マダイ,アジ",,,大型揃いで、他にシロギス・マダイ・アジ・交じる。。,,,釣りビジョン
小柴丸,金沢八景,2026/05/09,1,0,イシモチ,イシモチ,メイン,イシモチ,,4,40,22,0,22,34,,,,小柴沖,,,1,20.0,20.0,,,,,,,,,"シロギス,アジ交じる",,,良型揃いで、他にシロギス・アジ交じる。。,,,釣りビジョン
小柴丸,金沢八景,2026/05/10,1,0,イシモチ,イシモチ,メイン,イシモチ,,15,25,20,0,20,33,,,,小柴沖,,,1,20.0,20.0,,,,,,,,,"シロギス,アジも交じる",,,良型揃いで、他にシロギス・アジも交じる。。,,,釣りビジョン
小柴丸,金沢八景,2026/05/11,1,0,イシモチ,イシモチ,メイン,イシモチ,,5,28,16,0,19,33,,,,小柴沖,,,1,20.0,20.0,,,,,,,,,"シロギス多数,アジも交じる",,,良型中心に他にシロギス多数・アジも交じる。。,,,釣りビジョン
小柴丸,金沢八景,2026/05/12,1,0,イシモチ,イシモチ,メイン,イシモチ,,4,23,13,0,20,33,,,,小柴沖,,,1,20.0,20.0,,,,,,,,,"シロギス,アジ,マゴチも交じる",,,良型中心に、他にシロギス・アジ・マゴチも交じる。。,,,釣りビジョン
小柴丸,金沢八景,2026/05/13,1,0,イシモチ,イシモチ,メイン,イシモチ,,13,53,33,0,19,32,,,,小柴沖,,,1,20.0,20.0,,,,,,,,,"シロギス,アジ,マコガレイも交じる",,,良型中心に、他にシロギス・アジ・マコガレイも交じる。。,,,釣りビジョン
小柴丸,金沢八景,2026/05/15,1,0,イシモチ,イシモチ,メイン,イシモチ,,16,40,28,0,20,31,,,,小柴沖,,,1,20.0,20.0,,,,,,,,,シロギスも交じる,,,良型揃いで、他にシロギスも交じる。。,,,釣りビジョン
小柴丸,金沢八景,2026/05/15,2,0,アジ,アジ,メイン,アジ,,20,43,31,0,17,29,,,,小柴沖,,,1,20.0,20.0,,,,,,,,,"マコガレイ,シロギスも交じる",,,他にマコガレイ・シロギスも交じる。。,,,釣りビジョン
小柴丸,金沢八景,2026/05/16,1,0,イシモチ,イシモチ,メイン,イシモチ,,4,20,12,0,20,31,,,,,,,1,20.0,20.0,,,,,,,,,"シロギス,アジ交じる",,,良型中心に、他にシロギス・アジ交じる。。,,,釣りビジョン
山下丸,久比里港,2026/05/07,1,0,カワハギ,カワハギ,メイン,カワハギ,,1,14,7,0,16,34,,,,鴨居沖,,,1,15.0,15.0,17.0,17.0,濁り,,,,,,,,,,17℃,濁る,釣りビジョン
山下丸,久比里港,2026/05/07,2,0,カサゴ,カサゴ,メイン,カサゴ,,25,31,28,0,16,27,,,,鴨居沖,,,1,30.0,30.0,17.0,17.0,濁り,,,,,,,,,,17℃,濁る,釣りビジョン
山下丸,久比里港,2026/05/07,3,0,アジ,アジ,メイン,アジ,,15,30,22,0,24,38,,,,久里浜沖,観音崎沖,,2,30.0,60.0,17.0,17.0,濁り,,,,,,,,,,17℃,濁る,釣りビジョン
山下丸,久比里港,2026/05/08,1,0,カワハギ,カワハギ,メイン,カワハギ,,1,11,6,0,18,28,,,,鴨居沖,,,1,15.0,15.0,17.0,17.0,濁り,,,,,,,,,,17℃,濁る,釣りビジョン
山下丸,久比里港,2026/05/08,2,0,アジ,アジ,メイン,アジ,,18,77,47,0,24,40,,,,久里浜沖,,,1,30.0,50.0,17.0,17.0,濁り,,,,,,,,,,17℃,濁る,釣りビジョン
山下丸,久比里港,2026/05/09,1,0,カワハギ,カワハギ,メイン,カワハギ,,0,29,14,0,17,31,,,,鴨居沖,,,1,15.0,15.0,17.5,17.5,濁り,,,,,,,,,,17～17.5℃,濁る,釣りビジョン
山下丸,久比里港,2026/05/09,2,0,カサゴ,カサゴ,メイン,カサゴ,,40,65,52,0,15,27,,,,鴨居沖,,,1,20.0,20.0,17.5,17.5,濁り,,,,,,,,,,17～17.5℃,濁る,釣りビジョン
山下丸,久比里港,2026/05/10,1,0,カワハギ,カワハギ,メイン,カワハギ,,1,14,7,0,17,28,,,,鴨居沖,,,1,20.0,20.0,17.0,17.0,濁り,,,,,,,,,,17℃,濁る,釣りビジョン
山下丸,久比里港,2026/05/10,2,0,アジ,アジ,メイン,アジ,,16,33,24,0,24,38,,,,久里浜沖,観音崎沖,,2,30.0,80.0,17.0,17.0,濁り,,,,,,,,,,17℃,濁る,釣りビジョン
山下丸,久比里港,2026/05/11,1,0,カワハギ,カワハギ,メイン,カワハギ,,1,15,8,0,14,28,,,,鴨居沖,,,1,15.0,15.0,18.0,18.0,濁り,,,,,,,,,,17～18℃,濁る,釣りビジョン
山下丸,久比里港,2026/05/11,2,0,カサゴ,カサゴ,メイン,カサゴ,,31,57,44,0,15,27,,,,鴨居沖,,,1,20.0,20.0,18.0,18.0,濁り,,,,,,,,,,17～18℃,濁る,釣りビジョン
山下丸,久比里港,2026/05/11,3,0,アジ,アジ,メイン,アジ,,40,70,55,0,22,38,,,,久里浜沖,,,1,30.0,75.0,18.0,18.0,濁り,,,,,,,,,,17～18℃,濁る,釣りビジョン
山下丸,久比里港,2026/05/14,1,0,カワハギ,カワハギ,メイン,カワハギ,,0,8,4,0,16,30,,,,久里浜沖,鴨居沖,,2,15.0,20.0,18.0,18.0,濁り,,,,,,,,,,18℃,濁る,釣りビジョン
山下丸,久比里港,2026/05/14,2,0,カサゴ,カサゴ,メイン,カサゴ,,25,35,30,0,16,27,,,,久里浜沖,,,1,15.0,15.0,18.0,18.0,濁り,,,,,,,,,,18℃,濁る,釣りビジョン
山下丸,久比里港,2026/05/14,3,0,アジ,アジ,メイン,アジ,,30,76,53,0,21,46,,,,久里浜沖,,,1,30.0,80.0,18.0,18.0,濁り,,,,,,,,,,18℃,濁る,釣りビジョン
