ship,area,date,trip_no,is_cancellation,tsuri_mono_raw,tsuri_mono,main_sub,fish_raw,time_slot,cnt_min,cnt_max,cnt_avg,is_boat,size_min,size_max,kg_min,kg_max,tackle,point_place1,point_place2,point_place3,n_points_visited,depth_min,depth_max,water_temp_min,water_temp_max,water_color,wind_direction,wind_speed,tide_info,wave_info,weather,by_catch,cancel_reason,cancel_type,kanso_raw,suion_raw,suishoku_raw,source
美喜丸,松輪江奈港,2026/05/12,1,0,ワラサ,ワラサ,メイン,ワラサ,,,,,0,,,4.0,4.0,,,,,1,,,,,,,,,,,,,,,,,釣りビジョン
美喜丸,松輪江奈港,2026/05/13,1,0,マダイ,マダイ,メイン,マダイ,,3,3,3,1,,,2.3,2.3,,,,,1,,,,,,,,,,,,,,,,,釣りビジョン
美喜丸,松輪江奈港,2026/05/14,1,0,マダイ,マダイ,メイン,マダイ,,2,2,2,0,,,,,,,,,1,,,,,,,,,,,,,,,,,釣りビジョン
翔太丸,小網代港,2026/05/07,1,0,マルイカ,マルイカ,メイン,マルイカ,朝,10,34,22,0,15,35,,,,城ヶ島沖,剣崎沖,,2,60.0,80.0,17.5,17.5,やや澄み,,,,,,,,,続く流しは無かったがポツリポツリ!今日も城ヶ島沖から反応探しです。チョイチョイ良い反応が見つかるんですが…朝に一投目から型出しで食われ始めました。,17.5℃,澄み気味,釣りビジョン
翔太丸,小網代港,2026/05/09,1,0,マルイカ,マルイカ,メイン,マルイカ,,3,28,15,0,15,35,,,,城ヶ島沖,剣崎沖,,2,55.0,80.0,17.5,17.5,濁り,,,"二枚潮,潮速く",ウネリ,,,,,予想通り前半ウネリでない高かったです。今日の城ヶ島沖もいい反応出てましたが、刃物が多く乗せても捕られる反応動きもある。,17.5℃,濁る,釣りビジョン
翔太丸,小網代港,2026/05/10,1,0,マルイカ,マルイカ,メイン,マルイカ,,2,43,22,0,15,35,,,,城ヶ島沖,剣崎沖,,2,45.0,65.0,17.5,17.5,濁り,,,"二枚潮,濁り潮",,,,,,今日も城ヶ島沖から反応探し、やはりいい反応見れてましたが動きが有り、食われたり型出る程度でした。次々と反応を変えては見るが同じ感じで、型見れるが続く事なく潮も上潮が流れ出して重たい感じ。,17.5℃,濁る,釣りビジョン
翔太丸,小網代港,2026/05/11,1,0,マルイカ,マルイカ,メイン,マルイカ,,9,39,24,0,15,35,,,,城ヶ島沖,剣崎沖,,2,40.0,70.0,17.5,17.5,薄濁り,,,,,,,,,,17.5℃,薄濁り,釣りビジョン
翔太丸,小網代港,2026/05/12,1,0,マルイカ,マルイカ,メイン,マルイカ,,7,64,35,0,15,40,,,,城ヶ島沖,剣崎沖,,2,40.0,50.0,17.5,17.5,薄濁り,,,,,,,,,マルイカ釣れました。良型交じりで乗り活発の流しも絶好調。,17.5℃,薄濁り,釣りビジョン
翔太丸,小網代港,2026/05/13,1,0,マルイカ,マルイカ,メイン,マルイカ,,8,94,51,0,14,35,,,,城ヶ島沖,剣崎沖,,2,40.0,55.0,17.5,17.5,濁り,,,潮変わり,,,,,,乗りました!乗り乗りの流しも有り絶好調に!今日も城ヶ島沖から!いい反応見れて着乗り!直ぐに食われて何匹も上がらずチョット場所変えてまたまた食われる。もう少し上がればいいんですがね。,17.5℃,濁る,釣りビジョン
翔太丸,小網代港,2026/05/14,1,0,マルイカ,マルイカ,メイン,マルイカ,朝,5,132,68,0,14,35,,,,城ヶ島沖,剣崎沖,,2,35.0,50.0,17.5,17.5,濁り,,,,,,,,,良かったです!乗り乗り大爆釣132匹!今日も城ヶ島沖から!もちろんいい反応が有り半数乗りました。今日は良いのか…?と思ったら食われる動き出す。,17.5℃,濁る,釣りビジョン
翔太丸,小網代港,2026/05/16,1,0,マルイカ,マルイカ,メイン,マルイカ,,1,21,11,0,15,30,,,,カメギ根,小網代沖,城ヶ島沖,3,40.0,70.0,17.5,17.5,濁り,,,,,,,,,今日も城ヶ島沖は流れが速く…。小網代沖～城ヶ島西沖で反応探したんですが、すぐそこに潮目が有り、流れの速い場所も。,17.5℃,濁る,釣りビジョン
船宿 まる八,平和島,2026/05/05,1,0,アジ,アジ,メイン,アジ,ショート,10,90,50,0,16,26,,,,木更津沖,,,1,15.0,25.0,,,薄濁り,,,,,,,,,LTショートアジ乗合船。今日は昨日のシケの影響か中小サイズ多く、小ぶり優勢でしたが数は釣れました。,,薄濁り,釣りビジョン
船宿 まる八,平和島,2026/05/05,2,0,シロギス,シロギス,メイン,シロギス,,9,70,39,0,16,24,,,,木更津沖,,,1,7.0,15.0,,,薄濁り,,,"潮緩,潮止まり",,,,,,シロギス船。開始から潮流れてると良型メインでポチポチたまにダブルも交じり良い感じ。,,薄濁り,釣りビジョン
船宿 まる八,平和島,2026/05/08,1,0,アジ,アジ,メイン,アジ,ショート,20,91,55,0,14,28,,,,木更津沖,,,1,15.0,25.0,,,薄濁り,,,,,,,,,LTショートアジ乗合船。今日は大中小交じり。,,薄濁り,釣りビジョン
船宿 まる八,平和島,2026/05/09,1,0,アジ,アジ,メイン,アジ,ショート,10,91,50,0,14,28,,,,木更津沖,,,1,15.0,25.0,,,薄濁り,,,,,,,,,LTショートアジ乗合船。今日は小ぶり優勢、大中交じり。,,薄濁り,釣りビジョン
船宿 まる八,平和島,2026/05/10,1,0,アジ,アジ,メイン,アジ,ショート,8,98,53,0,16,30,,,,木更津沖,,,1,15.0,25.0,,,薄濁り,,,,,,,,,LTショートアジ乗合船。前半は大中小交じりでポチポチ。,,薄濁り,釣りビジョン
船宿 まる八,平和島,2026/05/15,1,0,アジ,アジ,メイン,アジ,ショート,4,31,17,0,14,28,,,,木更津沖,,,1,15.0,25.0,,,濁り,,,,,,,,,LTショートアジ乗合船。今日は大中小交じりでポツリポツリ。,,濁る,釣りビジョン
荒川屋,金沢八景,2026/05/03,1,0,シロギス,シロギス,メイン,午前シロギス,午前,1,40,20,0,15,22,,,,中ノ瀬,,,1,17.0,17.0,,,,,,,,,,,,今日も良型の交じり良くポツリポツリと釣れてくれました。。,,,釣りビジョン
荒川屋,金沢八景,2026/05/03,2,0,シロギス,シロギス,メイン,午後シロギス,午後,1,20,10,0,15,22,,,,富岡沖,,,1,15.0,15.0,,,,,,,,,"アジ,イシモチ,カサゴ",,,午後は風避けと潮の緩いポイントでの釣行でした。派手な出方は無く、船中でポッツリポッツリの出方で拾い釣りでした。,,,釣りビジョン
荒川屋,金沢八景,2026/05/03,3,0,アジ,アジ,メイン,午前アジ,午前,10,55,32,0,19,26,,,,根岸沖,,,1,18.0,18.0,,,,,,潮速く,,,イシモチ,,,今日も潮速くオマツリ騒ぎでした。中盤からバリバリアタリ、皆さんマイペースでしたがビギナーさんも楽しめました。,,,釣りビジョン
荒川屋,金沢八景,2026/05/03,4,0,アジ,アジ,メイン,午後アジ,午後,4,45,24,0,18,20,,,,根岸沖,,,1,18.0,18.0,,,,,,潮速く,,,"カサゴ,イシモチ",,,潮速くポイント入れず転々しましたが、中盤から小振りですが少し釣れました。他にカサゴ・イシモチ。,,,釣りビジョン
荒川屋,金沢八景,2026/05/08,1,0,アジ,アジ,メイン,午前アジ,午前,7,77,42,0,18,25,,,,富岡沖,,,1,20.0,20.0,18.4,18.4,薄濁り,南西,強,,,,イシモチ,,,スタートから南西風強く釣りにくかったです。アジの機嫌は良く前半いい感じでアタリましたが、中盤からはイマイチでした。,18.4℃,薄濁り,釣りビジョン
荒川屋,金沢八景,2026/05/08,2,0,アジ,アジ,メイン,ショートアジ,ショート,20,68,44,0,23,35,,,,走水沖,,,1,50.0,50.0,18.4,18.4,薄濁り,,,,,,,,,スタートから、良型が好調に釣れてくれました。。,18.4℃,薄濁り,釣りビジョン
荒川屋,金沢八景,2026/05/09,1,0,シロギス,シロギス,メイン,午前シロギス,午前,7,52,29,0,17,22,,,,中ノ瀬,,,1,17.0,17.0,,,,,,,,,,,,,,,釣りビジョン
荒川屋,金沢八景,2026/05/09,2,0,シロギス,シロギス,メイン,午後シロギス,午後,2,48,25,0,17,22,,,,中ノ瀬,,,1,17.0,17.0,,,,,,,,,,,,午後は潮もあまり流れませんでしたが、良型がポツリポツリと釣れました。。,,,釣りビジョン
荒川屋,金沢八景,2026/05/09,3,0,アジ,アジ,メイン,午前アジ,午前,15,43,29,0,18,25,,,,富岡沖,,,1,17.0,17.0,,,,,,,,,イシモチ,,,アカクラゲが気になりましたが、スタートからアタリ良く、ほぼ終日釣れました。他にイシモチ。,,,釣りビジョン
荒川屋,金沢八景,2026/05/09,4,0,アジ,アジ,メイン,午後アジ,午後,2,46,24,0,18,23,,,,富岡沖,,,1,23.0,23.0,,,,,,,,,イシモチ,,,午後は単発な喰いでアタリ続かずでしたが、風もナギて釣り日和でした。他にイシモチ。,,,釣りビジョン
荒川屋,金沢八景,2026/05/10,1,0,シロギス,シロギス,メイン,午前シロギス,午前,4,46,25,0,17,23,,,,中ノ瀬,,,1,17.0,17.0,19.3,19.3,薄濁り,,,,,,,,,,19.3℃,薄濁り,釣りビジョン
荒川屋,金沢八景,2026/05/10,2,0,アジ,アジ,メイン,午前アジ,午前,3,23,13,0,18,25,,,,富岡沖,,,1,15.0,15.0,19.3,19.3,薄濁り,,,,,,イシモチ,,,アタリ続かず物足りない喰いでしたが、終日ポツリポツリで晩のオカズは釣れました。他にイシモチ。,19.3℃,薄濁り,釣りビジョン
荒川屋,金沢八景,2026/05/10,2,0,アジ,アジ,サブ,ヒラメ,,,,,0,56,56,,,,,,,1,,,19.3,19.3,薄濁り,,,,,,イシモチ,,,アタリ続かず物足りない喰いでしたが、終日ポツリポツリで晩のオカズは釣れました。他にイシモチ。,19.3℃,薄濁り,釣りビジョン
荒川屋,金沢八景,2026/05/10,3,0,アジ,アジ,メイン,午後アジ,午後,5,46,25,0,18,25,,,,富岡沖,,,1,20.0,20.0,19.3,19.3,薄濁り,,,,,,"キス,サバ",,,午後はスタートはアタリ良く、徐々に渋りました。他にキス・サバ。,19.3℃,薄濁り,釣りビジョン
荒川屋,金沢八景,2026/05/10,4,0,アジ,アジ,メイン,ショートアジ,ショート,15,65,40,0,23,38,,,,走水沖,,,1,50.0,50.0,19.3,19.3,薄濁り,,,,,,,,,,19.3℃,薄濁り,釣りビジョン
荒川屋,金沢八景,2026/05/12,1,0,アジ,アジ,メイン,午前アジ,午前,2,52,27,0,18,24,,,,富岡沖,,,1,20.0,20.0,21.4,21.4,薄濁り,,,潮止まり,,,"イシモチ,サバ",,,潮止まりからのスタートでしたが、出足からアタリ良く釣り日和でしたが、中盤から失速してしまいました。他にイシモチ・サバ。,21.4℃,薄濁り,釣りビジョン
荒川屋,金沢八景,2026/05/12,2,0,アジ,アジ,メイン,午後アジ,午後,11,59,35,0,19,24,,,,富岡沖,,,1,25.0,25.0,21.4,21.4,薄濁り,,,,,,イシモチ,,,スタートは拾い釣りでしたが、中盤からアタッたのでオカズはバッチリです。他にイシモチ。,21.4℃,薄濁り,釣りビジョン
荒川屋,金沢八景,2026/05/12,3,0,シロギス,シロギス,メイン,ショートシロギス,ショート,22,90,56,0,17,23,,,,中ノ瀬,,,1,18.0,18.0,21.4,21.4,薄濁り,,,,,,,,,スタートから、ポツポツと釣れてくれました。途中から、アカクラゲに苦戦しました。,21.4℃,薄濁り,釣りビジョン
荒川屋,金沢八景,2026/05/15,1,0,アジ,アジ,メイン,午前アジ,午前,12,92,52,0,18,25,,,,富岡沖,,,1,18.0,18.0,,,,,,,,,,,,スタートからポツリポツリアタリ、淀みで少したるみましたが、ほぼ終日アタリ有りました。 2。,,,釣りビジョン
荒川屋,金沢八景,2026/05/15,2,0,アジ,アジ,メイン,午後アジ,午後,8,44,26,0,19,25,,,,根岸沖,,,1,19.0,19.0,,,,,,,,,,,,,,,釣りビジョン
荒川屋,金沢八景,2026/05/15,3,0,シロギス,シロギス,メイン,ショートシロギス,ショート,8,44,26,0,19,25,,,,根岸沖,,,1,19.0,19.0,,,,,,,,,イシモチ,,,派手なアタリは無かったですが、納竿までアタってくれました。他にイシモチ。,,,釣りビジョン
豊丸,鹿島港,2026/05/03,1,0,マダイ,マダイ,メイン,マダイ,,0,6,3,0,,,0.3,3.5,,鹿島沖,,,1,30.0,30.0,17.4,17.4,薄濁り,,,,,,"トラフグ,フグ,ワラサ",,,マダイ船・2隻の高低。他にトラフグ・フグ・ワラサ・ホウボウ・カサゴ・マハタ。,17.4℃,薄濁り,釣りビジョン
豊丸,鹿島港,2026/05/03,1,0,マダイ,マダイ,サブ,ハナダイ,,0,5,2,0,,,0.3,0.5,,,,,1,,,17.4,17.4,薄濁り,,,,,,"トラフグ,フグ,ワラサ",,,マダイ船・2隻の高低。他にトラフグ・フグ・ワラサ・ホウボウ・カサゴ・マハタ。,17.4℃,薄濁り,釣りビジョン
豊丸,鹿島港,2026/05/05,1,0,マダイ,マダイ,メイン,マダイ,,0,9,4,0,,,0.5,5.0,,鹿島沖,,,1,30.0,30.0,15.4,15.4,薄濁り,,,,,,"トラフグ,ホウボウ,イナダ",,,マダイ船。他にトラフグ・ホウボウ・イナダ・カサゴ。,15.4℃,薄濁り,釣りビジョン
豊丸,鹿島港,2026/05/05,1,0,マダイ,マダイ,サブ,ハナダイ,,0,3,1,0,,,0.3,0.8,,,,,1,,,15.4,15.4,薄濁り,,,,,,"トラフグ,ホウボウ,イナダ",,,マダイ船。他にトラフグ・ホウボウ・イナダ・カサゴ。,15.4℃,薄濁り,釣りビジョン
豊丸,鹿島港,2026/05/09,1,0,マダイ,マダイ,メイン,マダイ,,0,4,2,0,,,0.5,4.0,,鹿島沖,,,1,30.0,30.0,15.0,15.0,濁り,,,,,,"ハナダイ,ホウボウ,トラフグ",,,マダイ船。他にハナダイ・ホウボウ・トラフグ。,15℃,濁る,釣りビジョン
豊丸,鹿島港,2026/05/12,1,0,マダイ,マダイ,メイン,マダイ,,0,5,2,0,,,0.5,3.5,,鹿島沖,,,1,25.0,30.0,15.2,15.2,薄濁り,,,,,,"ハナダイ,イナダ,ホウボウ",,,マダイ船。他にハナダイ・イナダ・ホウボウ。,15.2℃,薄濁り,釣りビジョン
豊丸,鹿島港,2026/05/16,1,0,マダイ,マダイ,メイン,マダイ,,0,4,2,0,,,0.3,4.5,,鹿島沖,,,1,30.0,35.0,17.0,17.0,薄濁り,,,,,,"トラフグ,ショウサイフグ,ホウボウ",,,マダイ船。他にトラフグ・ショウサイフグ・ホウボウ・ワラサ・ヒラメ。,17℃,薄濁り,釣りビジョン
豊丸,鹿島港,2026/05/16,1,0,マダイ,マダイ,サブ,ハナダイ,,0,3,1,0,,,0.3,0.5,,,,,1,,,17.0,17.0,薄濁り,,,,,,"トラフグ,ショウサイフグ,ホウボウ",,,マダイ船。他にトラフグ・ショウサイフグ・ホウボウ・ワラサ・ヒラメ。,17℃,薄濁り,釣りビジョン
重郎平丸,下田港,2026/05/06,1,0,アカイカ,アカイカ,メイン,アカイカ,,250,250,250,1,,,,,,神津島,,,1,,,16.3,16.3,濁り,,,潮緩,,,メダイ多数,,,神津島アカイカ泳がせカンパチ・モロコ狙い。本日も神津島行ってきました。,16.3℃,濁る,釣りビジョン
重郎平丸,下田港,2026/05/06,1,0,アカイカ,アカイカ,サブ,ヒレナガカンパチ,,,,,0,,,6.5,6.5,,神津島,,,1,,,16.3,16.3,濁り,,,潮緩,,,メダイ多数,,,神津島アカイカ泳がせカンパチ・モロコ狙い。本日も神津島行ってきました。,16.3℃,濁る,釣りビジョン
重郎平丸,下田港,2026/05/06,1,0,アカイカ,アカイカ,サブ,マダイ,,,,,0,,,7.78,7.78,,神津島,,,1,,,16.3,16.3,濁り,,,潮緩,,,メダイ多数,,,神津島アカイカ泳がせカンパチ・モロコ狙い。本日も神津島行ってきました。,16.3℃,濁る,釣りビジョン
重郎平丸,下田港,2026/05/06,1,0,アカイカ,アカイカ,サブ,ハマダイ,,12,12,12,1,,,1.85,7.34,,神津島,,,1,,,16.3,16.3,濁り,,,潮緩,,,メダイ多数,,,神津島アカイカ泳がせカンパチ・モロコ狙い。本日も神津島行ってきました。,16.3℃,濁る,釣りビジョン
重郎平丸,下田港,2026/05/10,1,0,マダイ,マダイ,メイン,ハマダイ,,10,10,10,1,,,1.85,2.8,,神津島,,,1,,,19.1,19.1,濁り,,,,,,,,,神津島アカイカ泳がせカンパチ・モロコ狙い。本日も神津島行ってきました。,17.9～19.1℃,濁る,釣りビジョン
重郎平丸,下田港,2026/05/10,1,0,マダイ,マダイ,メイン,マダイ,,,,,0,,,5.5,5.5,,神津島,,,1,,,19.1,19.1,濁り,,,,,,,,,神津島アカイカ泳がせカンパチ・モロコ狙い。本日も神津島行ってきました。,17.9～19.1℃,濁る,釣りビジョン
重郎平丸,下田港,2026/05/10,1,0,マダイ,マダイ,サブ,メダイ,,10,10,10,1,,,2.5,5.5,,神津島,,,1,,,19.1,19.1,濁り,,,,,,,,,神津島アカイカ泳がせカンパチ・モロコ狙い。本日も神津島行ってきました。,17.9～19.1℃,濁る,釣りビジョン
重郎平丸,下田港,2026/05/13,1,0,カンパチ,カンパチ,メイン,カンパチ,朝,5,5,5,1,,,3.5,9.5,,神津島,,,1,,,18.8,18.8,濁り,,,,,,イサキ入れ食い多数でした,,,神津島アカイカ泳がせカンパチ・モロコ狙い。本日も神津島行ってきました。,17.6～18.8℃,濁る,釣りビジョン
重郎平丸,下田港,2026/05/13,1,0,カンパチ,カンパチ,サブ,メダイ,朝,6,6,6,1,,,2.5,5.5,,神津島,,,1,,,18.8,18.8,濁り,,,,,,イサキ入れ食い多数でした,,,神津島アカイカ泳がせカンパチ・モロコ狙い。本日も神津島行ってきました。,17.6～18.8℃,濁る,釣りビジョン
重郎平丸,下田港,2026/05/13,1,0,カンパチ,カンパチ,サブ,マダイ,朝,,,,0,,,5.5,5.5,,神津島,,,1,,,18.8,18.8,濁り,,,,,,イサキ入れ食い多数でした,,,神津島アカイカ泳がせカンパチ・モロコ狙い。本日も神津島行ってきました。,17.6～18.8℃,濁る,釣りビジョン
重郎平丸,下田港,2026/05/14,1,0,カンパチ,カンパチ,メイン,カンパチ,,1,1,1,1,,,3.8,10.5,,神津島,,,1,,,18.8,18.8,濁り,,,,,,アカイサキ,,,神津島アカイカ泳がせカンパチ・モロコ狙い。本日も神津島行ってきました…。,18.8℃,濁る,釣りビジョン
重郎平丸,下田港,2026/05/14,1,0,カンパチ,カンパチ,サブ,オニカサゴ,,,,,0,,,2.0,2.0,,神津島,,,1,,,18.8,18.8,濁り,,,,,,アカイサキ,,,神津島アカイカ泳がせカンパチ・モロコ狙い。本日も神津島行ってきました…。,18.8℃,濁る,釣りビジョン
釣船 五郎丸,鴨居大室港,2026/05/07,1,0,アジ,アジ,メイン,ショートアジ,ショート,8,54,31,0,22,36,,,,鴨井沖,観音崎沖,,2,40.0,50.0,,,,,,,,,,,,潮が動いてから、活性良くなりました。。,,,釣りビジョン
釣船 五郎丸,鴨居大室港,2026/05/07,2,0,タチウオ,タチウオ,メイン,ショートタチウオ,朝,0,2,1,0,65,90,,,,猿島沖,本牧沖,,2,40.0,50.0,,,,,,,,,,,,朝一顔見れましたが反応小さく、いろいろな所を探しに行きました。。,,,釣りビジョン
釣船 五郎丸,鴨居大室港,2026/05/09,1,0,アジ,アジ,メイン,ショートアジ,ショート,15,65,40,0,20,40,,,,観音崎沖,,,1,50.0,60.0,,,,,,,,,,,,良型交じりで釣れました。。,,,釣りビジョン
釣船 五郎丸,鴨居大室港,2026/05/09,2,0,タチウオ,タチウオ,メイン,ショートタチウオ,ショート,0,3,1,0,65,90,,,,第二海堡沖周辺,,,1,10.0,40.0,,,,,,,,,,,,浅場で顔見れました。。,,,釣りビジョン
釣船 五郎丸,鴨居大室港,2026/05/10,1,0,アジ,アジ,メイン,ショートアジ,ショート,10,66,38,0,22,40,,,,鴨居沖,観音崎沖,,2,40.0,80.0,,,,,,,,,,,,,,,釣りビジョン
釣船 五郎丸,鴨居大室港,2026/05/10,2,0,アジ,アジ,メイン,ショートアジ,ショート,21,50,35,0,22,40,,,,鴨居沖,観音崎沖,,2,40.0,80.0,,,,,,,,,,,,中アジ主体で良型も交じり、ポツポツ釣れました。。,,,釣りビジョン
釣船 五郎丸,鴨居大室港,2026/05/11,1,0,アジ,アジ,メイン,ショートアジ,ショート,32,63,47,0,23,38,,,,鴨居沖,観音崎沖,,2,40.0,60.0,,,,,,,,,,,,中アジ主体で好調に釣れました。。,,,釣りビジョン
釣船 五郎丸,鴨居大室港,2026/05/12,1,0,アジ,アジ,メイン,ショートアジ,ショート,40,71,55,0,24,38,,,,鴨居沖,観音崎沖,,2,40.0,70.0,,,,,,,,,,,,,,,釣りビジョン
釣船 五郎丸,鴨居大室港,2026/05/12,2,0,アジ,アジ,メイン,ショートアジ,ショート,25,99,62,0,24,38,,,,鴨居沖,観音崎沖,,2,40.0,70.0,,,,,,,,,,,,,,,釣りビジョン
釣船 五郎丸,鴨居大室港,2026/05/13,1,0,アジ,アジ,メイン,ショートアジ,ショート,10,64,37,0,23,36,,,,観音崎沖,,,1,50.0,70.0,,,,,,,,,,,,,,,釣りビジョン
釣船 五郎丸,鴨居大室港,2026/05/13,2,0,マルイカ,マルイカ,メイン,日中マルイカ,夜,1,13,7,0,13,28,,,,剣崎沖,,,1,30.0,60.0,,,,,,,,,,,,反応あり、アタリもあります。。,,,釣りビジョン
釣船 五郎丸,鴨居大室港,2026/05/14,1,0,アジ,アジ,メイン,ショートアジ,ショート,22,55,38,0,23,36,,,,観音崎沖,,,1,60.0,60.0,,,,,,,,,,,,中アジ主体に好調に釣れました。。,,,釣りビジョン
釣船 五郎丸,鴨居大室港,2026/05/16,1,0,アジ,アジ,メイン,ショートアジ,ショート,5,35,20,0,24,36,,,,鴨居沖,観音崎沖,,2,40.0,70.0,,,,,,"潮速く,上げ潮",,,,,,潮速く釣りづらいも、前半好調も後半上げ潮になり食い渋くなりました。。,,,釣りビジョン
長崎屋,横浜本牧港,2026/05/08,1,0,シロギス,シロギス,メイン,ショートシロギス,ショート,29,180,104,0,13,23,,,,航程3,20分位,,2,,,16.6,16.6,濁り,,,,,,"ホウボウ,マコガレイ等",,,好調!良型中心に1日ポツポツとアタリ続き好調でした!トップは180匹!2番手145匹、3番手115匹。他にホウボウ・マコガレイ等。,16.6℃,濁る,釣りビジョン
長崎屋,横浜本牧港,2026/05/08,2,0,アジ,アジ,メイン,ショートLTアジ,ショート,33,56,44,0,16,30,,,,航程3,10分位,,2,,,16.6,16.6,濁り,,,,,,"イシモチ,クロダイ",,,近場のライトアジ!小型中心に中型もポツポツと交じり、中盤からアタリ良くなり、皆さん同じくらいの釣果でお土産になりました!他にイシモチ・クロダイ。。,16.6℃,濁る,釣りビジョン
長崎屋,横浜本牧港,2026/05/09,1,0,シロギス,シロギス,メイン,ショートシロギス,ショート,14,148,81,0,13,23,,,,航程3,20分位,,2,,,16.6,16.6,濁り,,,,,,"ホウボウ,マコガレイ,ムシガレイ等",,,好調!盛況!大中小サイズ交じりで1日ポツポツとアタリ続き好調でした!トップは1本竿で148匹!2番手103匹。30匹前後の方が多かったです。,16.6℃,濁る,釣りビジョン
長崎屋,横浜本牧港,2026/05/09,2,0,アジ,アジ,メイン,ショートLTアジ,ショート,12,86,49,0,16,25,,,,航程3,10分位,,2,,,16.6,16.6,濁り,,,,,,イシモチ,,,近場のライトアジ!土曜日ながらゆったりで出船。小型中心に何度かポツポツと良い感じの時間帯あり好調でした!2番手75匹、3番手70匹。,16.6℃,濁る,釣りビジョン
長崎屋,横浜本牧港,2026/05/10,1,0,シロギス,シロギス,メイン,ショートシロギス,ショート,15,153,84,0,13,23,,,,航程3,20分位,,2,,,18.0,18.0,濁り,,,,,,,,,,18℃,濁る,釣りビジョン
長崎屋,横浜本牧港,2026/05/10,2,0,シロギス,シロギス,メイン,ショートシロギス,ショート,19,126,72,0,13,23,,,,航程3,20分位,,2,,,18.0,18.0,濁り,,,,,,"ホウボウ,イシモチ,マコガレイ",,,好調!大中小サイズ交じりで1日ポツポツとアタリ続き好調でした!トップは153匹!2番手103匹。別船はトップ126匹!2番手97匹、3番手96匹。,18℃,濁る,釣りビジョン
長崎屋,横浜本牧港,2026/05/10,3,0,アジ,アジ,メイン,ショートLTアジ,ショート,18,71,44,0,17,32,,,,航程3,10分位,,2,,,18.0,18.0,濁り,,,,,,クロダイ,,,近場のライトアジ!日曜日ながら少人数で出船。小型中心に中型も交じってポツポツとアタリ好調!2番手65匹。,18℃,濁る,釣りビジョン
長崎屋,横浜本牧港,2026/05/11,1,0,シロギス,シロギス,メイン,ショートシロギス,ショート,10,120,65,0,13,23,,,,航程3,20分位,,2,,,17.7,17.7,薄濁り,,,,,,"ホウボウ,ムシガレイ,サバ等",,,平日ながら盛況!ありがとうございました!良型中心に1日ポツポツとアタリ続き好調でした!トップは1本竿で120匹!2番手73匹。25～30匹くらいの方が多かったです。,17.7℃,薄濁り,釣りビジョン
長崎屋,横浜本牧港,2026/05/11,2,0,アジ,アジ,メイン,ショートLTアジ,ショート,20,54,37,0,17,31,,,,航程3,10分位,,2,,,17.7,17.7,薄濁り,,,,,,クロダイ,,,少人数で出船。小型中心に中型交じり、ポツポツ釣れたり止まったりでした。,17.7℃,薄濁り,釣りビジョン
長崎屋,横浜本牧港,2026/05/12,1,0,シロギス,シロギス,メイン,ショートシロギス,ショート,26,141,83,0,13,24,,,,航程3,20分位,,2,,,18.7,18.7,濁り,,,,,,"ホウボウ,ムシガレイ,アジ等",,,好調!良型中心に1日ポツポツとアタリ続き好調でした!トップは1本竿、ミヨシの席で141匹!2番手128匹、3番手104匹。40匹前後の方が多かったです。,18.7℃,濁る,釣りビジョン
長崎屋,横浜本牧港,2026/05/12,2,0,アジ,アジ,メイン,ショートLTアジ,ショート,12,92,52,0,17,32,,,,航程3,10分位,,2,,,18.7,18.7,濁り,,,,,,クロダイ,,,近場のライトアジ!今日は程よくコマセの効く人数で出船!小型中心に中型も交じってポツポツと続き好調でした!2番手70匹。他にクロダイ。,18.7℃,濁る,釣りビジョン
長崎屋,横浜本牧港,2026/05/13,1,0,シロギス,シロギス,メイン,ショートシロギス,ショート,23,163,93,0,13,23,,,,航程3,20分位,,2,,,19.3,19.3,薄濁り,,,,,,"ホウボウ,ムシガレイ等",,,好調!大中小サイズ交じりで1日ポツポツとアタリ続き好調でした!トップは163匹!2番手112匹。40～50匹台の方が多かったです。,19.3℃,薄濁り,釣りビジョン
