ship,area,date,trip_no,is_cancellation,tsuri_mono_raw,tsuri_mono,main_sub,fish_raw,time_slot,cnt_min,cnt_max,cnt_avg,is_boat,size_min,size_max,kg_min,kg_max,tackle,point_place1,point_place2,point_place3,n_points_visited,depth_min,depth_max,water_temp_min,water_temp_max,water_color,wind_direction,wind_speed,tide_info,wave_info,weather,by_catch,cancel_reason,cancel_type,kanso_raw,suion_raw,suishoku_raw,source
伝五郎丸,松輪江奈漁港,2026/03/30,1,0,マダイ,マダイ,メイン,マダイ,NULL,0.0,5.0,2.5,0,,,0.6,1.2,NULL,神奈川県 三浦市 松輪江奈漁港,NULL,NULL,1,NULL,NULL,15.1,15.1,NULL,北東,2.0m/s,中潮,南 0.3m/s,曇り時々晴れ,,NULL,NULL,朝からポツポツ当たりましたが、バラシも多く残念でした。トップ5匹釣ることができ、アジ、サバが少し混じりました。31日は予報悪く出船中止とさせていただきます。4/1は予約2人と空き多数ありますので、飛び乗りも大歓迎です。皆様のご乗船お待ちしています。本日もご乗船いただきありがとうございました。,15.1℃,NULL,chowari/伝五郎丸
伝五郎丸,松輪江奈漁港,2026/03/29,1,0,マダイ,マダイ,メイン,マダイ,NULL,0.0,1.0,0.5,0,,,0.8,1.2,NULL,神奈川県 三浦市 松輪江奈漁港,NULL,NULL,1,NULL,NULL,15.0,15.0,NULL,西南西,1.4m/s,若潮,南南東 0.3m/s,晴れ後時々曇り,,NULL,NULL,マダイは広く反応あるも口使ってくれず、難しい釣りになり顔見ただけで、他にサバ混じりでした。 マダイ釣りはビシを下げてしまうと、反応が浮いてこなくなりますので、道糸でしっかりタナを揃えて、こまめに手返しをして、皆さんで協力してマダイをgetしましょう。30日も出船しますが、空き多数ありますので、飛び乗り大歓迎です。本日もご乗船いただきありがとうございました。,15.0℃,NULL,chowari/伝五郎丸
伝五郎丸,松輪江奈漁港,2026/03/26,1,0,マダイ,マダイ,メイン,マダイ,NULL,1.0,9.0,5.0,0,,,0.8,1.8,NULL,神奈川県 三浦市 松輪江奈漁港,NULL,NULL,1,NULL,NULL,14.8,14.8,NULL,北東,6.4m/s,小潮,南南東 1.4m/s,雨時々止む,,NULL,NULL,今日は朝からポツポツ当たりが続き、大型バラシや他も複数回バラシ多くもったいなかったです。トップ9匹が2人と皆様ボウズなく釣れ、好調でした。他にイシダイ、クロダイ、サバが混じりました。27日も出船しますが、空き多数ありますので、飛び乗り大歓迎です。本日もご乗船いただきありがとうございました。,14.8℃,NULL,chowari/伝五郎丸
伝五郎丸,松輪江奈漁港,2026/03/25,1,0,マダイ,マダイ,メイン,マダイ,NULL,0.0,2.0,1.0,0,,,0.8,1.8,NULL,神奈川県 三浦市 松輪江奈漁港,NULL,NULL,1,NULL,NULL,14.8,14.8,NULL,南東,4.5m/s,小潮,南南東 0.6m/s,雨,,NULL,NULL,マダイの反応モリモリでしたが、口使ってくれず苦戦しました。トップ2匹でアジ、サバ混じりでした。ビシを下げてしまうと反応が浮いて来ないので、指示棚を合わせて皆さんで協力してマダイをgetしましょう。26日は雨予報ですが出船します。飛び乗り大歓迎です。本日もご乗船いただきありがとうございました。,14.8℃,NULL,chowari/伝五郎丸
伝五郎丸,松輪江奈漁港,2026/03/24,1,0,マダイ,マダイ,メイン,マダイ,NULL,0.0,3.0,1.5,0,,,0.5,1.5,NULL,神奈川県 三浦市 松輪江奈漁港,NULL,NULL,1,NULL,NULL,14.7,14.7,NULL,北北東,8.9m/s,中潮,南東 0.8m/s,晴れ後時々曇り,,NULL,NULL,マダイはポツリポツリ当たりましたが、バラシもありもったいなかったです。トップ3匹で混じりはアジ、サバ。残念ながら0の方も出てしまいました。25日はキャンセル出て、只今予約3人とガラガラに空いていますので、さらなるお電話お待ちしています。本日もご乗船いただきありがとうございました。,14.7℃,NULL,chowari/伝五郎丸
伝五郎丸,松輪江奈漁港,2026/03/22,1,0,マダイ,マダイ,メイン,マダイ,NULL,0.0,2.0,1.0,0,,,0.5,1.2,NULL,神奈川県 三浦市 松輪江奈漁港,NULL,NULL,1,NULL,NULL,14.9,14.9,NULL,北北東,4.8m/s,中潮,南南東 0.3m/s,晴れ後時々曇り,,NULL,NULL,反応入るも口使ってくれず、厳しい釣りになり、トップ2匹で混じりはアジでした。23日はまだ予約2人とガラガラに空いていますので、飛び乗りも大歓迎です。皆様の乗船お待ちしています。本日もご乗船いただきありがとうございました。,14.9℃,NULL,chowari/伝五郎丸
