ship,area,date,trip_no,is_cancellation,tsuri_mono_raw,tsuri_mono,main_sub,fish_raw,time_slot,cnt_min,cnt_max,cnt_avg,is_boat,size_min,size_max,kg_min,kg_max,tackle,point_place1,point_place2,point_place3,n_points_visited,depth_min,depth_max,water_temp_min,water_temp_max,water_color,wind_direction,wind_speed,tide_info,wave_info,weather,by_catch,cancel_reason,cancel_type,kanso_raw,suion_raw,suishoku_raw,source
南伊豆忠兵衛丸,南伊豆町手石港,2026/03/29,1,0,アブラボウズ,アブラボウズ,メイン,アブラボウズ,NULL,0.0,1.0,0.5,0,,,33.9,44.6,NULL,静岡県 賀茂郡南伊豆町 手石港,NULL,NULL,1,NULL,NULL,16.1,16.1,NULL,西北西,0.9m/s,若潮,東 1.1m/s,晴れ後時々曇り,ソコダラ,NULL,NULL,23号船、エサ釣り。 アブラボウズ、33.9kg～44.6kg、0～1本。船中2本。 他ソコダラ、ユメサメなど、バラシあり。 エサで2本釣れました！よかったです。 今月も残すところあと2日ですね。 本日もありがとうございました。,16.1℃,NULL,chowari/南伊豆忠兵衛丸
南伊豆忠兵衛丸,南伊豆町手石港,2026/03/29,1,0,ソコダラ,NULL,サブ,ソコダラ,NULL,,,,0,,,,,NULL,静岡県 賀茂郡南伊豆町 手石港,NULL,NULL,1,NULL,NULL,16.1,16.1,NULL,西北西,0.9m/s,若潮,東 1.1m/s,晴れ後時々曇り,NULL,NULL,NULL,23号船、エサ釣り。 アブラボウズ、33.9kg～44.6kg、0～1本。船中2本。 他ソコダラ、ユメサメなど、バラシあり。 エサで2本釣れました！よかったです。 今月も残すところあと2日ですね。 本日もありがとうございました。,16.1℃,NULL,chowari/南伊豆忠兵衛丸
南伊豆忠兵衛丸,南伊豆町手石港,2026/03/27,1,0,アブラボウズ,アブラボウズ,メイン,アブラボウズ,NULL,,,,0,,,,,NULL,静岡県 賀茂郡南伊豆町 手石港,NULL,NULL,1,NULL,NULL,16.0,16.0,NULL,北東,2.1m/s,小潮,東南東 2.0m/s,晴れ後時々曇り,アコウ・キンメダイ,NULL,NULL,キンメ船２１号船・キンメ0.4～0.6kg、12～25枚。朝の内から潮の流れが悪く苦戦しました。アブラボウズ船２３号船・アブラボウズ38～４３kg２人１本ずつ。・アコウ２.５kg、１本。,16.0℃,NULL,chowari/南伊豆忠兵衛丸
南伊豆忠兵衛丸,南伊豆町手石港,2026/03/27,1,0,アコウ,NULL,サブ,アコウ,NULL,,,,0,,,,,NULL,静岡県 賀茂郡南伊豆町 手石港,NULL,NULL,1,NULL,NULL,16.0,16.0,NULL,北東,2.1m/s,小潮,東南東 2.0m/s,晴れ後時々曇り,NULL,NULL,NULL,キンメ船２１号船・キンメ0.4～0.6kg、12～25枚。朝の内から潮の流れが悪く苦戦しました。アブラボウズ船２３号船・アブラボウズ38～４３kg２人１本ずつ。・アコウ２.５kg、１本。,16.0℃,NULL,chowari/南伊豆忠兵衛丸
南伊豆忠兵衛丸,南伊豆町手石港,2026/03/27,1,0,キンメダイ,キンメダイ,サブ,キンメダイ,NULL,,,,0,,,,,NULL,静岡県 賀茂郡南伊豆町 手石港,NULL,NULL,1,NULL,NULL,16.0,16.0,NULL,北東,2.1m/s,小潮,東南東 2.0m/s,晴れ後時々曇り,NULL,NULL,NULL,キンメ船２１号船・キンメ0.4～0.6kg、12～25枚。朝の内から潮の流れが悪く苦戦しました。アブラボウズ船２３号船・アブラボウズ38～４３kg２人１本ずつ。・アコウ２.５kg、１本。,16.0℃,NULL,chowari/南伊豆忠兵衛丸
