ship,area,date,trip_no,is_cancellation,tsuri_mono_raw,tsuri_mono,main_sub,fish_raw,time_slot,cnt_min,cnt_max,cnt_avg,is_boat,size_min,size_max,kg_min,kg_max,tackle,point_place1,point_place2,point_place3,n_points_visited,depth_min,depth_max,water_temp_min,water_temp_max,water_color,wind_direction,wind_speed,tide_info,wave_info,weather,by_catch,cancel_reason,cancel_type,kanso_raw,suion_raw,suishoku_raw,source
興栄丸,焼津港,2026/04/29,1,0,マアジ,アジ,メイン,マアジ,NULL,0.0,20.0,10.0,0,20.0,45.0,,,NULL,静岡県 焼津市 焼津港,NULL,NULL,1,NULL,NULL,18.3,18.3,NULL,南西,4.5m/s,中潮,南 0.7m/s,曇り,,NULL,NULL,夜便コマセアジでした 一流目から反応良く、大型の本命揚がり期待しましたが速い二枚潮と風で上手く流せず苦戦しました 波でバレる魚も多かったです あちこち移動しますが良いポイント無く、どうなるかと心配しましたが後半に少し潮が落ち着くとアタリ増えてラスト1時間程は連発でした 40センチオーバーの大型もポツポツ混ざりながら最後まで釣れてくれてトップ20本以上 ラスト1時間で10本以上釣れた方も もう少し早く始まればもっと数増えたと思いますが、お土産はあり安心しました マダイ3枚、クロダイ、大サバなど混ざる 6日以降夜便コマセアジ空きあります お問い合わせください,18.3℃,NULL,chowari/興栄丸
興栄丸,焼津港,2026/04/27,1,0,マアジ,アジ,メイン,マアジ,NULL,65.0,65.0,65.0,0,20.0,40.0,,,NULL,静岡県 焼津市 焼津港,NULL,NULL,1,NULL,NULL,18.1,18.1,NULL,北北東,2.7m/s,若潮,南南東 1.1m/s,曇り,,NULL,NULL,気になるポイントがあったので今期初の場所ですが調査とコマ仕込みに出船しました 開始から反応良く、一投目から良型連発 最大40センチ程で30～35センチがメインですが肉厚で形の良いアジが多かったです 4時間程でリリース入れず65本 マダイ1.5キロ頭に4枚 クロダイ2枚 大鯛も多いのかハリス切れはかなりの数でした… 連日コマセアジ好調です 28日は怪しい予報ですが空きあります 11時半の予報で判断させて頂きます 29日以降も空きあります お問い合わせください,18.1℃,NULL,chowari/興栄丸
興栄丸,焼津港,2026/04/25,1,0,マダイ,マダイ,メイン,マダイ,NULL,0.0,35.0,17.5,0,20.0,40.0,,,NULL,静岡県 焼津市 焼津港,NULL,NULL,1,NULL,NULL,17.8,17.8,NULL,東北東,3.4m/s,小潮,南東 0.7m/s,曇り,,NULL,NULL,夜便コマセアジでした 開始から反応良く、一投目から釣れてくれますが小型～中型なのですぐに移動。 移動後は平均サイズも大きくなり良く釣れてくれました 波は高いですが潮は緩く3時間程一流しで釣れ続けてくれました 後半は少しポイントを変えながら広く探ってみましたが最後の一投まで本命、マダイとアタリあり久し振りに良く釣れてくれました 40センチ程の大型も多く混ざりながらトップ30本以上 クーラー満タンの方も 難しい日が続いていましたが広く反応見えたので今後に期待です 連休中も夜便コマセアジメインで出船します 空きありますので、お問い合わせください,17.8℃,NULL,chowari/興栄丸
興栄丸,焼津港,2026/04/22,1,0,マアジ,アジ,メイン,マアジ,NULL,6.0,6.0,6.0,0,20.0,40.0,,,NULL,静岡県 焼津市 焼津港,NULL,NULL,1,NULL,NULL,18.0,18.0,NULL,北東,1.3m/s,中潮,南東 0.7m/s,晴れ後時々曇り,マダイ,NULL,NULL,短時間ですがコマ仕込みに出船。 1時間程でキロ前後のマダイ2枚、マアジ20～40センチが6匹でした サイズは色々でしたが連発するタイミングもあり、久し振りに良い反応でした 濁りも取れて潮も緩かったので今後に期待です 連休も夜便コマセアジメインで出船します 空きありますので、お問い合わせください,18.0℃,NULL,chowari/興栄丸
興栄丸,焼津港,2026/04/22,1,0,マダイ,マダイ,サブ,マダイ,NULL,2.0,2.0,2.0,0,,,0.8,1.0,NULL,静岡県 焼津市 焼津港,NULL,NULL,1,NULL,NULL,18.0,18.0,NULL,北東,1.3m/s,中潮,南東 0.7m/s,晴れ後時々曇り,NULL,NULL,NULL,短時間ですがコマ仕込みに出船。 1時間程でキロ前後のマダイ2枚、マアジ20～40センチが6匹でした サイズは色々でしたが連発するタイミングもあり、久し振りに良い反応でした 濁りも取れて潮も緩かったので今後に期待です 連休も夜便コマセアジメインで出船します 空きありますので、お問い合わせください,18.0℃,NULL,chowari/興栄丸
