ship,area,date,trip_no,is_cancellation,tsuri_mono_raw,tsuri_mono,main_sub,fish_raw,time_slot,cnt_min,cnt_max,cnt_avg,is_boat,size_min,size_max,kg_min,kg_max,tackle,point_place1,point_place2,point_place3,n_points_visited,depth_min,depth_max,water_temp_min,water_temp_max,water_color,wind_direction,wind_speed,tide_info,wave_info,weather,by_catch,cancel_reason,cancel_type,kanso_raw,suion_raw,suishoku_raw,source
嘉丸,宇佐美港,2026/03/30,1,0,タイ,マダイ,メイン,タイ,NULL,2.0,2.0,2.0,0,,,1.0,1.2,NULL,静岡県 伊東市 宇佐美港,NULL,NULL,1,NULL,NULL,16.3,16.3,NULL,東,1.9m/s,中潮,東南東 0.4m/s,雨のち曇り,,NULL,NULL,イサキ、タイで出船、イサキからスタートしたが濁りが入り1時間やったが型が出ずタイに移動したが濁りで食いは渋く苦戦。,16.3℃,NULL,chowari/嘉丸
嘉丸,宇佐美港,2026/03/27,1,0,イサキ,イサキ,メイン,イサキ,NULL,3.0,33.0,18.0,0,26.0,31.0,,,NULL,静岡県 伊東市 宇佐美港,NULL,NULL,1,NULL,NULL,16.0,16.0,NULL,北東,2.3m/s,小潮,東南東 1.3m/s,晴れ後時々曇り,,NULL,NULL,イサキからスタート、スタート時は食い気なく当たりが出ず苦戦したが途中ポツポツ当たり出し個人差は出たが終了一時間半タイに、タイは不発でした。,16.0℃,NULL,chowari/嘉丸
嘉丸,宇佐美港,2026/03/24,1,0,イサキ,イサキ,メイン,イサキ,NULL,20.0,24.0,22.0,0,26.0,34.0,,,NULL,静岡県 伊東市 宇佐美港,NULL,NULL,1,NULL,NULL,15.9,15.9,NULL,北東,3.1m/s,中潮,東南東 0.8m/s,晴れ後時々曇り,タイ,NULL,NULL,イサキからスタート、イサキはポツポツ当たりは出たが途中渋り終了一時間にタイをスタート、タイミングよく２匹を上げ終了でした。,15.9℃,NULL,chowari/嘉丸
嘉丸,宇佐美港,2026/03/24,1,0,タイ,マダイ,サブ,タイ,NULL,0.0,1.0,0.5,0,,,1.8,3.0,NULL,静岡県 伊東市 宇佐美港,NULL,NULL,1,NULL,NULL,15.9,15.9,NULL,北東,3.1m/s,中潮,東南東 0.8m/s,晴れ後時々曇り,NULL,NULL,NULL,イサキからスタート、イサキはポツポツ当たりは出たが途中渋り終了一時間にタイをスタート、タイミングよく２匹を上げ終了でした。,15.9℃,NULL,chowari/嘉丸
嘉丸,宇佐美港,2026/03/21,1,0,タイ,マダイ,メイン,タイ,NULL,1.0,1.0,1.0,0,,,1.4,1.4,NULL,静岡県 伊東市 宇佐美港,NULL,NULL,1,NULL,NULL,15.9,15.9,NULL,東北東,2.2m/s,中潮,東 0.5m/s,晴れ,,NULL,NULL,タイで出船、当たりは一回で食い気なく釣果伸びず苦戦。,15.9℃,NULL,chowari/嘉丸
