ship,area,date,trip_no,is_cancellation,tsuri_mono_raw,tsuri_mono,main_sub,fish_raw,time_slot,cnt_min,cnt_max,cnt_avg,is_boat,size_min,size_max,kg_min,kg_max,tackle,point_place1,point_place2,point_place3,n_points_visited,depth_min,depth_max,water_temp_min,water_temp_max,water_color,wind_direction,wind_speed,tide_info,wave_info,weather,by_catch,cancel_reason,cancel_type,kanso_raw,suion_raw,suishoku_raw,source
大喜丸,網代港,2026/03/29,1,0,イサキ,イサキ,メイン,イサキ,NULL,,,,0,,,,,NULL,静岡県 熱海市 網代港,NULL,NULL,1,NULL,NULL,16.2,16.2,NULL,南西,0.5m/s,若潮,東南東 0.5m/s,晴れ後時々曇り,マダイ・ムロアジ,NULL,NULL,午前：イサキ五目船。朝から反応は有るものの船下に来ない？反応に載せても逃げる様子で大苦戦でした。後半は場所移動してダブルもあり、なんとかお土産にはなりました。結果、18匹～25匹、2番手24匹。他はマダイ(1㌔前後)にムロアジでした。 ご乗船ありがとうございましたm(__)m,16.2℃,NULL,chowari/大喜丸
大喜丸,網代港,2026/03/29,1,0,マダイ,マダイ,サブ,マダイ,NULL,,,,0,,,,,NULL,静岡県 熱海市 網代港,NULL,NULL,1,NULL,NULL,16.2,16.2,NULL,南西,0.5m/s,若潮,東南東 0.5m/s,晴れ後時々曇り,NULL,NULL,NULL,午前：イサキ五目船。朝から反応は有るものの船下に来ない？反応に載せても逃げる様子で大苦戦でした。後半は場所移動してダブルもあり、なんとかお土産にはなりました。結果、18匹～25匹、2番手24匹。他はマダイ(1㌔前後)にムロアジでした。 ご乗船ありがとうございましたm(__)m,16.2℃,NULL,chowari/大喜丸
大喜丸,網代港,2026/03/29,1,0,ムロアジ,アジ,サブ,ムロアジ,NULL,,,,0,,,,,NULL,静岡県 熱海市 網代港,NULL,NULL,1,NULL,NULL,16.2,16.2,NULL,南西,0.5m/s,若潮,東南東 0.5m/s,晴れ後時々曇り,NULL,NULL,NULL,午前：イサキ五目船。朝から反応は有るものの船下に来ない？反応に載せても逃げる様子で大苦戦でした。後半は場所移動してダブルもあり、なんとかお土産にはなりました。結果、18匹～25匹、2番手24匹。他はマダイ(1㌔前後)にムロアジでした。 ご乗船ありがとうございましたm(__)m,16.2℃,NULL,chowari/大喜丸
大喜丸,網代港,2026/03/24,1,0,ヒラメ,ヒラメ,メイン,ヒラメ,NULL,4.0,4.0,4.0,0,,,0.8,3.0,NULL,静岡県 熱海市 網代港,NULL,NULL,1,NULL,NULL,15.9,15.9,NULL,北東,3.1m/s,中潮,東南東 0.8m/s,晴れ後時々曇り,オオモンハタ,NULL,NULL,午前：ヒラメ五目船。浅場中心に攻めました。エサ反応は多く、船中4枚(0.8㌔-1.0㌔-1.2㌔-3.0㌔)。バラシもありで残念。他はオオモンハタ。ホウボウなど。まだまだ楽しめそうです(^-^),15.9℃,NULL,chowari/大喜丸
大喜丸,網代港,2026/03/24,1,0,オオモンハタ,ハタ,サブ,オオモンハタ,NULL,,,,0,,,,,NULL,静岡県 熱海市 網代港,NULL,NULL,1,NULL,NULL,15.9,15.9,NULL,北東,3.1m/s,中潮,東南東 0.8m/s,晴れ後時々曇り,NULL,NULL,NULL,午前：ヒラメ五目船。浅場中心に攻めました。エサ反応は多く、船中4枚(0.8㌔-1.0㌔-1.2㌔-3.0㌔)。バラシもありで残念。他はオオモンハタ。ホウボウなど。まだまだ楽しめそうです(^-^),15.9℃,NULL,chowari/大喜丸
大喜丸,網代港,2026/03/22,1,0,イサキ,イサキ,メイン,イサキ,NULL,,,,0,,,,,NULL,静岡県 熱海市 網代港,NULL,NULL,1,NULL,NULL,15.9,15.9,NULL,北東,2.1m/s,中潮,東南東 0.2m/s,晴れ後時々曇り,,NULL,NULL,午前：イサキ五目船。今日はお連れさんが寝坊で仕方なく1名様での出船でした。相変わらず潮流れ速く、コマセも効かない状態でした。こんな時程ひと工夫が必要ですね。結果、中型主体で23匹でした。コマセの撒き方や棚の取り方など色々と 工夫をしてみて下さい。 ご乗船ありがとうございましたm(__)m,15.9℃,NULL,chowari/大喜丸
