ship,area,date,trip_no,is_cancellation,tsuri_mono_raw,tsuri_mono,main_sub,fish_raw,time_slot,cnt_min,cnt_max,cnt_avg,is_boat,size_min,size_max,kg_min,kg_max,tackle,point_place1,point_place2,point_place3,n_points_visited,depth_min,depth_max,water_temp_min,water_temp_max,water_color,wind_direction,wind_speed,tide_info,wave_info,weather,by_catch,cancel_reason,cancel_type,kanso_raw,suion_raw,suishoku_raw,source
政勝丸,外川港,2026/03/30,1,0,アマダイ,アマダイ,メイン,アマダイ,NULL,6.0,7.0,6.5,0,27.0,42.0,,,NULL,千葉県 銚子市 外川漁港,NULL,NULL,1,NULL,NULL,14.9,14.9,NULL,西南西,2.8m/s,中潮,東 1.2m/s,曇り時々晴れ,,NULL,NULL,ゲストにムシガレイ、ホウボウ、レンコ鯛 朝からアタリ多く好調に釣れました！ ゲストのホウボウも良型混じりでした。 トップ7匹が2名様,14.9℃,NULL,chowari/政勝丸
政勝丸,外川港,2026/03/25,1,0,ヒラメ,ヒラメ,メイン,ヒラメ,NULL,6.0,9.0,7.5,0,,,0.4,3.8,NULL,千葉県 銚子市 外川漁港,NULL,NULL,1,NULL,NULL,14.3,14.3,NULL,南南東,5.9m/s,小潮,東 1.3m/s,曇りのち一時雨,,NULL,NULL,ゲストにスズキ、ホウボウ、ムシガレイ 朝からベイトの反応濃く、潮も流れたのでアタリ多かったです。 良型多く、みなさん釣れたのでソゲはリリースしていただきました。 ご協力ありがとうございます ゲストに4kg、84cmのスズキGET！,14.3℃,NULL,chowari/政勝丸
政勝丸,外川港,2026/03/23,1,0,アラ,アラ,メイン,アラ,NULL,0.0,2.0,1.0,0,,,0.7,3.3,NULL,千葉県 銚子市 外川漁港,NULL,NULL,1,NULL,NULL,14.2,14.2,NULL,西北西,3.4m/s,中潮,南東 0.9m/s,雨のち晴れ,,NULL,NULL,ゲストにオニカサゴ、カンコ、沖メバル、ユメカサゴ、ヨリトフグ 2kg前後のオニカサゴやカンコなど、良型のゲストも上がりました。 大雨のなか、最後までがんばっていただきありがとうございました。,14.2℃,NULL,chowari/政勝丸
政勝丸,外川港,2026/03/23,2,0,メヌケ,メヌケ,メイン,メヌケ,NULL,0.0,3.0,1.5,0,,,1.5,5.2,NULL,千葉県 銚子市 外川漁港,NULL,NULL,1,NULL,NULL,14.2,14.2,NULL,西北西,3.4m/s,中潮,南東 0.9m/s,雨のち晴れ,,NULL,NULL,本日仕立船 その他多数詳細電話確認,14.2℃,NULL,chowari/政勝丸
政勝丸,外川港,2026/03/22,1,0,アラ,アラ,メイン,アラ,NULL,0.0,1.0,0.5,0,,,2.2,3.6,NULL,千葉県 銚子市 外川漁港,NULL,NULL,1,NULL,NULL,14.5,14.5,NULL,南東,2.3m/s,中潮,東 0.9m/s,晴れ後時々曇り,,NULL,NULL,ゲストにオニカサゴ、カンコ、メダイ、沖メバル、ユメカサゴ 本命のアタリ少なかったですが、2.9kgのオニカサゴや3kg前後のカンコなどが釣れました。,14.5℃,NULL,chowari/政勝丸
政勝丸,外川港,2026/03/21,1,0,ヒラメ,ヒラメ,メイン,ヒラメ,NULL,2.0,5.0,3.5,0,,,0.4,7.88,NULL,千葉県 銚子市 外川漁港,NULL,NULL,1,NULL,NULL,14.6,14.6,NULL,北北西,4.8m/s,中潮,東北東 1.3m/s,晴れ,,NULL,NULL,ゲストにカサゴ 朝からベイトの反応多く、良型混じりでみなさん釣れました。 トップ5枚が2名様、平均3、4枚 1kg前後を中心に2kg3kgも混じり、最大で7.88kgでした。,14.6℃,NULL,chowari/政勝丸
政勝丸,外川港,2026/03/20,1,0,アマダイ,アマダイ,メイン,アマダイ,NULL,0.0,8.0,4.0,0,23.0,37.0,,,NULL,千葉県 銚子市 外川漁港,NULL,NULL,1,NULL,NULL,14.8,14.8,NULL,北東,8.2m/s,大潮,東 1.9m/s,曇り一時雨,,NULL,NULL,ゲストにレンコ鯛、ムシガレイ、アジ ウネリ高くタナとりが難しい一日でした。 良型混じりで竿頭8匹2番手6匹 本日は雨、風強いなかご乗船ありがとうございました。,14.8℃,NULL,chowari/政勝丸
政勝丸,外川港,2026/03/20,2,0,アラ,アラ,メイン,アラ,NULL,0.0,3.0,1.5,0,,,1.5,3.7,NULL,他沖,NULL,NULL,1,NULL,NULL,14.8,14.8,NULL,北東,8.2m/s,大潮,東 1.9m/s,曇り一時雨,オニカサゴ,NULL,NULL,その他沖メバル、メダイなど,14.8℃,NULL,chowari/政勝丸
政勝丸,外川港,2026/03/20,2,0,オニカサゴ,オニカサゴ,サブ,オニカサゴ,NULL,0.0,2.0,1.0,0,,,1.2,1.5,NULL,他沖,NULL,NULL,1,NULL,NULL,14.8,14.8,NULL,北東,8.2m/s,大潮,東 1.9m/s,曇り一時雨,NULL,NULL,NULL,その他沖メバル、メダイなど,14.8℃,NULL,chowari/政勝丸
